Positionale Netzwerkanalyse als Beispiel eines	134.63999938964844	116.78338623046876	16.01995849609375	283.9849395751953	0.0
soziologischen Zugangs zur Analyse von politischen	134.63999938964844	136.282958984375	16.01995849609375	323.7562713623047	0.0
Chats	134.63999938964844	155.83685302734375	16.02001953125	31.87980651855469	0.0
Christian Stegbauer	134.63999938964844	185.28961181640625	12.0	79.31639099121094	1.0
Fragestellung	134.63999938964844	229.162841796875	12.47998046875	64.32441711425781	2.0
Oft wird behauptet, die Teilnehmer am Chat oder anderen Gruppenkommunikati-	134.63999938964844	253.25537109375	10.076904296875	326.0078887939453	3.0
onsmedien im Internet unterlägen keinen Beschränkungen hinsichtlich der Mög-	134.6400146484375	265.735595703125	10.076904296875	326.0461730957031	3.0
lichkeiten gegenseitig Kontakt aufzunehmen. Dagegen werden gerade in der for-	134.6400146484375	278.2158203125	10.076904296875	326.0370788574219	3.0
malen Soziologie, wie sie von Georg Simmel (1995) oder Leopold von Wiese (1968)	134.63999938964844	290.7554931640625	10.076904296875	326.0995330810547	3.0
vertreten wird, und den strukturalistisch beeinflussten Überlegungen, etwa von	134.63999938964844	303.2357177734375	10.076904296875	326.0391387939453	3.0
Harrison White (1992) das Entstehen von Grenzen betont. Zum Beleg für die Ent-	134.63999938964844	315.7159423828125	10.076904296875	326.0663604736328	3.0
grenzungsposition in virtuellen Gruppen soll an dieser Stelle ein Zitat ausreichen.	134.6400146484375	328.25567626953125	10.076873779296877	325.9837341308594	3.0
»Sie (die virtuellen Gruppen) zeichnen sich dadurch aus, dass jeder Netzteilnehmer	134.6400146484375	340.73590087890625	10.076904296875	325.99578857421875	3.0
nicht nur die Möglichkeit hat, mit jedem anderen Teilnehmer eines elektronischen	134.6400146484375	353.21612548828125	10.076904296875	326.02197265625	3.0
Netzwerks zu kommunizieren, sondern dies auch faktisch tut.« (Dollhausen/	134.6400146484375	365.7558288574219	10.076904296875	326.04010009765625	3.0
Wehner 2000: 81)	134.6400146484375	378.236083984375	10.076904296875	69.20413208007811	3.0
Diese beiden Positionen in der wissenschaftlichen Diskussion, die eine, ausge-	148.85952758789062	390.71630859375	10.076904296875	311.8891296386719	3.0
hend vor allem von technischen Möglichkeiten von neuen Medien, die andere ver-	134.6400146484375	403.2560119628906	10.076904296875	326.0441589355469	3.0
wurzelt in einer soziologischen Tradition, die sich mit Simmel (1917) vor allem	134.6400146484375	415.73626708984375	10.076904296875	326.0924987792969	3.0
durch ihre Grenzen und Schwellen (also negativ) bestimmt und sich bereits an	134.63999938964844	428.2164916992188	10.076904296875	326.04713439941406	3.0
unterschiedlichen Gegenständen bewährte, bilden das Spannungsfeld der hier vor-	134.63998413085938	440.7561950683594	10.076904296875	326.08642578125	3.0
zustellenden Anwendung der Netzwerkanalyse.	134.63998413085938	453.2364501953125	10.076904296875	183.66156005859372	3.0
Der vorliegende Beitrag verfolgt ein weiteres Ziel: Es soll gezeigt werden, wie	148.86050415039062	465.7166748046875	10.076904296875	311.92242431640625	3.0
sich mit Hilfe der Netzwerkanalyse die Kommunikationsstruktur von Chats unter-	134.6409912109375	478.2563781738281	10.076904296875	326.0663757324219	3.0
suchen lässt. Dabei wird auf methodologische Aspekte hinsichtlich der Auswahl des	134.6409912109375	490.73663330078125	10.076904296875	326.0834045410156	3.0
Analyseinstruments eingegangen.	134.64097595214844	503.21685791015625	10.076904296875	128.78883361816406	3.0
Untersucht wird die Herausbildung von Positionen mit Rollenbeziehungen am	148.86048889160156	515.756591796875	10.076904296875	311.7994537353516	3.0
Beispiel zweier Chats, die im Anschluss an eine Sendung des politischen Magazins	134.64100646972656	528.23681640625	10.076904296875	326.0451202392578	3.0
Monitor stattgefunden haben.	134.6409912109375	540.717041015625	10.076904296875	115.921630859375	3.0
Die Chat-Sitzungen dauerten jeweils etwa eine Stunde. Zwar ist es möglich, dass	148.86050415039062	553.2567138671875	10.076904296875	311.9787902832031	3.0
nach jeder Sendung die gleichen Personen am Chat teilnehmen, dies ist jedoch	134.6409912109375	565.7369995117188	10.076904296875	326.07537841796875	3.0
relativ unwahrscheinlich. Dafür, dass sich die Teilnehmer nicht bereits vorher	134.6409912109375	578.2172241210938	10.076904296875	326.0643005371094	3.0
kannten, fanden sich keine Hinweise in den Beiträgen, die in den Chatprotokollen	134.6409912109375	590.7568969726562	10.076889038085938	325.9393310546875	3.0
gespeichert sind. Es ist also davon auszugehen, dass sich einander unbekannte Per-	134.64097595214844	603.2371826171875	10.076889038085938	326.08848571777344	3.0
4 7 7 0	134.63999938964844	85.97540283203125	10.076904296875	21.8336181640625	4.0
A D - H O C - G R U P P E : O N L I N E - F O R S C H U N G	219.3600006103516	88.30474853515625	7.02227783203125	141.45338439941406	5.0
sonen zum Chat treffen. Anlass für die Diskussion im elektronischen Medium war	134.63999938964844	115.7353515625	10.076904296875	326.0310516357422	6.0
die während der Sendung mehrfach von der Moderatorin angekündigte Möglichkeit	134.63998413085938	128.215576171875	10.076904296875	325.9877014160156	6.0
nach der Sendung mit den Autoren von zwei ausgewählten Beiträgen über das Me-	134.63998413085938	140.7552490234375	10.076904296875	326.0269775390625	6.0
dium Chat zu diskutieren. Wenn die Überlegungen der Vertreter der Entgrenzungs-	134.63998413085938	153.2354736328125	10.076904296875	326.04217529296875	6.0
position korrekt wären, hätte im Prinzip jeder mit jedem in Kontakt kommen kön-	134.63999938964844	165.7156982421875	10.076904296875	326.03306579589844	6.0
nen müssen. Dieser Überlegung entgegen steht die Entwicklung von Positionen mit	134.63999938964844	178.25537109375	10.076904296875	326.0370635986328	6.0
zugehörigen Rollen, wodurch die Handlungsoptionen der Teilnehmer begrenzt	134.63999938964844	190.735595703125	10.076904296875	326.03404235839844	6.0
werden. Sind Positionen herausgebildet, orientiert sich das Handeln der Teilnehmer	134.63999938964844	203.2158203125	10.076904296875	326.01390075683594	6.0
daran, Handlungsfreiheiten werden dadurch wesentlich beschränkt.	134.6400146484375	215.7554931640625	10.076904296875	261.21640014648443	6.0
Für die Kommunikation unter einer größeren Anzahl an Anwesenden, die man	148.8594970703125	228.2357177734375	10.076904296875	311.8316650390625	6.0
auch Großgruppen nennen könnte, so hat Rauch (1983) gezeigt, entwickelt sich	134.63999938964844	240.7159423828125	10.076904296875	326.08042907714844	6.0
eine Struktur mit einer eigenen Tradition, die aus einer Arena mit mehreren Haupt-	134.63999938964844	253.255615234375	10.076904296875	326.0673065185547	6.0
sprechern besteht und einem Publikum innerhalb maximal einer halben Stunde. Die	134.63998413085938	265.73583984375	10.076904296875	326.0340270996094	6.0
Zahl der Hauptsprecher bleibt aber auf die Größe einer Kleingruppe (hier vier bis	134.63996887207028	278.216064453125	10.076904296875	326.09352111816406	6.0
acht Teilnehmer) beschränkt. Die Hauptsprecher agieren als Vertreter einer imagi-	134.63998413085938	290.7557373046875	10.076904296875	326.0079040527344	6.0
nären Fraktion. Die Vertreter können aber ihre Position als Hauptsprecher nur so	134.63998413085938	303.2359619140625	10.076904296875	325.9947204589844	6.0
lange halten, wie sie durch Beifallsbekundungen aus »ihrem« Hinterland, den Rän-	134.63998413085938	315.7161865234375	10.076904296875	326.0079040527344	6.0
gen der Arena gestützt werden. Die Unterstützung erfolgt vor allem durch nonver-	134.63998413085938	328.25592041015625	10.076873779296877	326.02496337890625	6.0
bale Hinweise, etwa Kopfnicken oder durch Zwischenrufe. Entfällt diese Unterstüt-	134.63996887207028	340.73614501953125	10.076904296875	326.09754943847656	6.0
zung, verbleibt der nicht mehr unterstützte Sprecher nicht länger im Hauptspre-	134.63996887207028	353.21636962890625	10.076904296875	326.1267852783203	6.0
cherfeld. Eine weitere relevante Feststellung Rauchs war, dass die Delegiertenfunk-	134.63998413085938	365.7560729980469	10.076904296875	326.05718994140625	6.0
tion der Hauptsprecher weniger von individuellen Merkmalen abhängt, allenfalls die	134.63996887207028	378.236328125	10.076904296875	326.01292419433594	6.0
Zahl der vorher bereits bekannten anderen Teilnehmer (heute würde man dies als	134.63995361328122	390.716552734375	10.076904296875	326.01287841796875	6.0
soziales Kapital bezeichnen), spielte eine Rolle dabei. Wichtiger für die Zuweisung	134.63993835449222	403.2562561035156	10.076904296875	326.0673370361328	6.0
der Position »Hauptsprecher« war der Zeitpunkt der ersten Wortmeldung. Wer sich	134.63995361328122	415.7365112304688	10.076904296875	326.044189453125	6.0
gleich zu Anfang zu Wort meldete, kam viel eher in die Hauptsprecherrolle als	134.63996887207028	428.21673583984375	10.076904296875	326.0370635986328	6.0
andere. Wer sich nicht sogleich mit einem Beitrag meldete, hatte es später sehr	134.63998413085938	440.7564392089844	10.076904296875	326.0531921386719	6.0
schwer, sich überhaupt zu beteiligen. Dies war dann nur mit einem besonders fun-	134.63998413085938	453.2366943359375	10.076904296875	326.08251953125	6.0
dierten Beitrag möglich, wobei wohl in der Bedeutung des Arguments, die Begrün-	134.63998413085938	465.7169189453125	10.076904296875	326.0945129394531	6.0
dung für dieses »aus der Rolle fallen« zu suchen ist.	134.63996887207028	478.2566223144531	10.076904296875	198.24989318847656	6.0
Rauchs Pilotstudie zeigt, dass sich schnell ganz ausgeprägte Positionen in größe-	148.85948181152344	490.7368774414063	10.076904296875	311.8507843017578	6.0
ren Gruppen bilden. Die Notwendigkeit hierfür wird in Aufmerksamkeitsbeschrän-	134.63896179199222	503.21710205078125	10.076904296875	325.9695587158203	6.0
kungen gesehen, die es eben nur zulassen, dass, sofern alle dem Gespräch folgen	134.63897705078122	515.7568359375	10.076904296875	325.99066162109375	6.0
wollen, zur gleichen Zeit nicht mehrere Redner aktiv sein können. Reden mehrere	134.63896179199222	528.237060546875	10.076904296875	325.9866485595703	6.0
gleichzeitig, zerfällt der Kommunikationsraum in mehrere Subgruppen.	134.63896179199222	540.71728515625	10.076904296875	276.92420959472656	6.0
Wir können annehmen, dass sich das Kapazitätsproblem im Chat in ähnlicher	148.8584747314453	553.2569580078125	10.076904296875	311.7994842529297	6.0
Weise stellen wird, wie in der Großgruppe. Wenn alle Teilnehmer die angekündigte	134.63795471191406	565.7372436523438	10.076904296875	326.1106719970703	6.0
Möglichkeit nutzen wollen, muss es wohl oder übel zu Engpässen kommen. Es ist	134.63795471191406	578.2174682617188	10.076904296875	326.02696228027344	6.0
zu erwarten, dass auch im Chat eine Kommunikationsstruktur als Ausdruck sich	134.637939453125	590.7571411132812	10.076889038085938	326.0330810546875	6.0
entwickelnder Beziehungen entstehen wird. Da der Chat als Möglichkeit mit den	134.637939453125	603.2374267578125	10.076889038085938	326.0793762207031	6.0
S T E G B A U E R : P O S I T I O N A L E N E T Z W E R K A N A L Y S E	206.0399932861328	88.30474853515625	7.02227783203125	168.1637725830078	7.0
4 7 7 1	437.8800048828125	85.97540283203125	10.076904296875	21.8336181640625	8.0
Redakteuren zu diskutieren, angekündigt wurde, ist zu erwarten, dass diese über	134.63999938964844	115.7353515625	10.076904296875	326.12071228027344	9.0
eine herausragende Position verfügen.	134.63999938964844	128.215576171875	10.076904296875	147.7585906982422	9.0
Andererseits ergibt sich die Schwierigkeit, dass ein Hauptregulierungsmecha-	148.85951232910156	140.7552490234375	10.076904296875	311.82460021972656	9.0
nismus gegenüber der Großgruppe beim Chat offenbar nicht funktioniert: Die	134.63897705078122	153.2354736328125	10.076904296875	326.04510498046875	9.0
Nebenbeikommunikation, die sich vor allem in nonverbalen Beifalls-, bzw. Missfal-	134.63897705078122	165.7156982421875	10.076904296875	325.98974609375	9.0
lenskundgebungen äußerte, kann im Chat nicht in gleicher Weise stattfinden.1	134.63899230957028	178.25537109375	10.076904296875	300.8345489501953	9.0
Um zu untersuchen, ob sich innerhalb der kurzen Zeit, die ein solcher Chat	148.86074829101562	190.735595703125	10.076904296875	311.84881591796875	9.0
dauert, eine die Handlungsoptionen der Teilnehmer kanalisierende Struktur heraus-	134.64125061035156	203.2158203125	10.076904296875	326.01795959472656	9.0
bildet, muss eine Methode angewendet werden, diese Struktur zu analysieren.	134.64126586914062	215.7554931640625	10.076904296875	299.5459289550781	9.0
Die Untersuchung von Chats	134.63999938964844	266.662841796875	12.47998046875	141.78025817871094	10.0
Es werden zwei Chats untersucht, die im Anschluss an eine Sendung des politischen	134.63999938964844	290.75537109375	10.076904296875	325.96754455566406	11.0
Magazins »Monitor« stattfanden.2 Zur Analyse wurden zwei Protokolldateien der	134.63999938964844	303.2353515625	10.0771484375	326.03221130371094	11.0
Sendung vom 16. Mai 2002 ausgewählt. Der eine Beitrag stammt von Johannes	134.64016723632812	315.715576171875	10.076904296875	326.0028076171875	11.0
Höflich und Horst Freudenthaler und trägt den Titel: »Tödliche Gefahr auf Spiel-	134.64015197753906	328.25531005859375	10.076873779296877	326.00083923339844	11.0
plätzen – Die Kommunen gucken weg« (im Folgenden »Spielpatz-Chat« genannt).	134.64016723632812	340.73553466796875	10.076904296875	325.9937744140625	11.0
Hierin geht es um den Zustand und die Sicherheitsprüfung von Spielplätzen. Der	134.64018249511722	353.21575927734375	10.076904296875	326.03712463378906	11.0
Beitrag greift ein Unglück auf einem Spielplatz in einem Ort nahe Offenbach auf	134.64019775390622	365.7554626464844	10.076904296875	326.02294921875	11.0
und es wird diskutiert, dass sich die Kommunen nicht genügend um die Sicherheit	134.64018249511722	378.2357177734375	10.076904296875	326.08338928222656	11.0
von Spielplätzen kümmerten. Der andere Beitrag: »Tobinsteuer – Gerechtigkeit ist	134.64016723632812	390.7159423828125	10.076904296875	326.0985412597656	11.0
machbar« (im Folgenden »Tobinsteuer-Chat« genannt) stammt von Sonia Mikich	134.64016723632812	403.2556457519531	10.076904296875	326.0350646972656	11.0
und Kim Otto. Die Tobinsteuer ist eine Minimalsteuer, die auf weltweite Geld-	134.64018249511722	415.7359008789063	10.076904296875	326.2134246826172	11.0
ströme erhoben werden könnte, um spekulative Transaktionen durch eine Kosten-	134.64018249511722	428.21612548828125	10.076904296875	326.0351104736328	11.0
belastung zu behindern. Damit, so wird argumentiert, könne man die negativen	134.64018249511722	440.7558288574219	10.076904296875	325.98777770996094	11.0
Auswirkungen dieser Art von Spekulationen verhindern, ohne die weltwirtschaftlich	134.64019775390622	453.236083984375	10.076904296875	326.05120849609375	11.0
notwendigen Transaktionen zu verhindern.	134.64021301269528	465.71630859375	10.076904296875	167.44178771972656	11.0
Vor allem im Beitrag über die Spielplätze waren hauptsächlich in der ersten	148.86073303222656	478.2560119628906	10.076904296875	311.77723693847656	11.0
Hälfte eine Reihe von Chattern anwesend, die einen Beitrag über eine mögliche	134.64122009277344	490.73626708984375	10.076904296875	326.01585388183594	11.0
Indizierung des Computerspiels Counterstrike erwartet hatten (die Sendung wurde	134.64120483398438	503.2164916992188	10.076904296875	326.0522155761719	11.0
kurze Zeit nach dem Amoklauf eines ehemaligen Schülers in einem Erfurter Gym-	134.64120483398438	515.7562255859375	10.076904296875	326.0108947753906	11.0
——————	134.63999938964844	533.1338500976561	12.01239013671875	72.01434326171875	12.0
1 Zwar findet sich im Chat auch die Möglichkeit mittels paraverbaler Äußerungen, sich durch so	142.26034545898438	546.951904296875	8.035797119140625	318.44921875	12.0
genannten Emoticons ähnliche Weise zu äußern, jedoch würde hieraus immer ein Beitrag, der eben	148.8601531982422	556.9716796875	8.035797119140625	311.8018951416016	12.0
nicht simultan, sondern sequentiell wirksam würde.	148.8601531982422	566.93212890625	8.035797119140625	158.02882385253906	12.0
2 Seit diesem Jahr gibt es die Möglichkeit des Chat bei der Sendung Monitor nicht mehr. Für das	142.26034545898438	576.951904296875	8.035797119140625	318.408935546875	12.0
Feedback der Zuschauer wurde wieder »Kreuzverhör« eingerichtet. Dabei handelt es sich um ein	148.85934448242188	586.9718017578125	8.035797119140625	311.83642578125	12.0
Format, welches im WDR im Anschluss an Monitor ausgestrahlt wird und bei dem die Zuschauer	148.85934448242188	596.93212890625	8.035797119140625	311.75299072265625	12.0
über Telefon mit den Redakteuren in Kontakt kommen können.	148.85934448242188	606.9520263671875	8.035797119140625	198.5951232910156	12.0
4 7 7 2	134.63999938964844	85.97540283203125	10.076904296875	21.8336181640625	13.0
A D - H O C - G R U P P E : O N L I N E - F O R S C H U N G	219.3600006103516	88.30474853515625	7.02227783203125	141.45338439941406	14.0
nasium ausgestrahlt). Dieser im Programm zunächst angekündigte Beitrag wurde	134.63999938964844	115.7353515625	10.076904296875	326.0965118408203	15.0
nicht gesendet, aber einige der Chat-Teilnehmer hatten eine Ausstrahlung aufgrund	134.63999938964844	128.215576171875	10.076904296875	326.0633087158203	15.0
einer Presseankündigung der Monitor-Redaktion erwartet und gaben wiederholt	134.6400146484375	140.7552490234375	10.076904296875	325.9604797363281	15.0
ihrem Unmut über das Ausbleiben dieses Themas Ausdruck. Sie fragten mehrfach	134.6400146484375	153.2354736328125	10.076904296875	326.04010009765625	15.0
nach der Reportage, und störten damit den Ablauf der Diskussion über das andere	134.6400146484375	165.7156982421875	10.076904296875	325.9675598144531	15.0
Thema.	134.63999938964844	178.25537109375	10.076904296875	29.540435791015625	15.0
Um die Daten des Chats auswertbar zu machen, wird zunächst jedem Teilneh-	148.85951232910156	190.735595703125	10.076904296875	311.8507843017578	15.0
mer eine Identifikationsnummer zugeordnet. Um die entstandenen Kommunikati-	134.63899230957028	203.2158203125	10.076904296875	326.07237243652344	15.0
onsbeziehungen sichtbar zu machen, ist es erforderlich, eine Relation (type of tie)	134.63900756835938	215.7554931640625	10.076904296875	326.0622253417969	15.0
zu definieren. Im vorliegenden Fall wurde als Relation »Bezugnahme auf« gewertet.	134.63900756835938	228.2357177734375	10.076904296875	326.0440673828125	15.0
Damit ist gemeint, dass jemand eine Frage konkret an einen anderen stellt, eine	134.63900756835938	240.7159423828125	10.076904296875	326.05621337890625	15.0
solche beantwortet oder auch wenn aus dem Kontext ersichtlich wird, dass ein	134.63900756835938	253.255615234375	10.076904296875	326.0703430175781	15.0
Beitrag einer anderen Person konkret gilt. Nach dieser Definition beziehungsbil-	134.63900756835938	265.73583984375	10.076904296875	326.0270080566406	15.0
dende Beiträge richten sich oft an genau einen Teilnehmer oder der Autor/in bzw.	134.63899230957028	278.216064453125	10.076904296875	325.99269104003906	15.0
Redakteur/in der Sendung, in manchen Fällen kommt es auch vor, dass noch ein	134.63899230957028	290.7557373046875	10.076904296875	325.99876403808594	15.0
weiterer Teilnehmer gleichzeitig angesprochen wird. Wenn auf Teilnehmer direkt	134.63899230957028	303.2359619140625	10.076904296875	326.0299835205078	15.0
Bezug genommen wird, dann entsteht, so die hier verwendete Definition, eine	134.63899230957028	315.7161865234375	10.076904296875	326.10960388183594	15.0
Kommunikationsbeziehung zwischen den beiden. Sprechen sich Teilnehmer im	134.63899230957028	328.25592041015625	10.076873779296877	326.0239715576172	15.0
Verlauf mehrfach an, werden diese Relationen aufsummiert. Falls sich eine Mittei-	134.63899230957028	340.73614501953125	10.076904296875	326.0753936767578	15.0
lung an alle anderen richtet oder es sich nicht aus dem Kontext erschließen lässt,	134.63899230957028	353.21636962890625	10.076904296875	325.9967498779297	15.0
wer damit gemeint ist, kommt dadurch auch keine Beziehung zustande. Die auf-	134.63899230957028	365.7560729980469	10.076904296875	326.12779235839844	15.0
grund dieses Kriteriums konstruierten Beziehungen werden schließlich in eine Be-	134.63900756835938	378.236328125	10.076904296875	326.02099609375	15.0
ziehungsmatrix umgesetzt. Nachdem die Matrix erstellt wurde, können die Techni-	134.63900756835938	390.716552734375	10.076904296875	326.06732177734375	15.0
ken der Netzwerkanalyse angewendet werden, hier der Concor-Algorithmus3 des Pro-	134.63899230957028	403.25537109375	10.097412109375	326.0019073486328	15.0
gramms Ucinet 6, die Grafiken wurden mit NETDRAW erstellt.	134.64019775390622	415.7353820800781	10.097412109375	241.83233642578125	15.0
Mit Hilfe des Concor Algorithmus, der zu den Verfahren der Blockmodellana-	148.8605499267578	428.21563720703125	10.076904296875	311.7571563720703	15.0
lyse zählt, werden die in die Untersuchung einbezogenen Matrizen so umsortiert,	134.64004516601562	440.7553405761719	10.076904296875	326.0189514160156	15.0
dass Bereiche mit einem ähnlichen Kommunikations-/Beziehungsmuster zusam-	134.64004516601562	453.235595703125	10.076904296875	326.037109375	15.0
mengehören. Die Teilnehmer werden dann nach Ähnlichkeit dieses Musters analog	134.64004516601562	465.7158203125	10.076904296875	326.0581970214844	15.0
eines hierarchischen Clusterverfahrens in so genannte Blöcke unterteilt. In der	134.64002990722656	478.2555236816406	10.076904296875	326.0834503173828	15.0
Soziologie werden nur selten die Beziehungen selbst in die Analyse mit einbezogen	134.64004516601562	490.73577880859375	10.076904296875	326.0562438964844	15.0
– zumeist gehen in die Untersuchungen Daten, die mit einer bestimmten Person	134.64004516601562	503.2160034179688	10.076904296875	326.1036071777344	15.0
verknüpft sind, ein. Dies ist bei der gewählten Methode der Blockmodellanalyse	134.64004516601562	515.7557373046875	10.076904296875	326.0833740234375	15.0
anders – hier betrachtet man direkt die Beziehungen der Teilnehmer zueinander.	134.64004516601562	528.2359619140625	10.076904296875	326.0733947753906	15.0
Gefestigte Muster von Beziehungen von Personen untereinander bezeichnet man	134.64006042480472	540.7161865234375	10.076904296875	325.9726104736328	15.0
als Rollenbeziehungen mit den zugehörigen Positionen. Nach den Überlegungen	134.64006042480472	553.255859375	10.076904296875	325.9837188720703	15.0
der Entwickler dieser Methode (White/Breiger 1995; White u.a. 1976, Boorman/	134.64006042480472	565.7361450195312	10.076904296875	326.05223083496094	15.0
——————	134.63999938964844	583.1138305664062	12.01239013671875	72.01434326171875	16.0
3 Nähere Beschreibung zu diesem Algorithmus siehe: Boorman/White 1976; White/Breiger 1975;	142.26034545898438	596.931884765625	8.035797119140625	318.41131591796875	16.0
White u.a. 1976, aber auch Stegbauer/Rausch 1999; Stegbauer 2001.	148.86013793945312	606.95166015625	8.035797119140625	209.7207336425781	16.0
S T E G B A U E R : P O S I T I O N A L E N E T Z W E R K A N A L Y S E	206.0399932861328	88.30474853515625	7.02227783203125	168.1637725830078	17.0
4 7 7 3	437.8800048828125	85.97540283203125	10.076904296875	21.8336181640625	18.0
White 1976) ist es nicht entscheidend, das Beziehungsmuster einzelner Personen zu	134.63999938964844	115.7353515625	10.076904296875	326.0562286376953	19.0
untersuchen. Viel wichtiger sind die Positionen, die meist von mehreren Teilneh-	134.6400146484375	128.215576171875	10.076904296875	326.076416015625	19.0
mern mit ähnlichen (äquivalenten) Beziehungen gebildet werden. Positionen mit	134.64002990722656	140.7552490234375	10.076904296875	326.08140563964844	19.0
ihren zugehörigen Rollenmustern bestehen bzw. entwickeln sich in jedem Sozi-	134.64002990722656	153.2354736328125	10.076904296875	326.04112243652344	19.0
alraum. Die aufgefundenen Blöcke repräsentieren im Modell dann Positionen, in	134.64004516601562	165.7156982421875	10.076904296875	326.03106689453125	19.0
denen hier Teilnehmer mit einem ähnlichen Beziehungsmuster zu anderen zusam-	134.64004516601562	178.25537109375	10.076904296875	325.97662353515625	19.0
mengefasst werden. Deren Beziehungen werden als Rollenbeziehungen aufgefasst.	134.64002990722656	190.735595703125	10.076904296875	326.0572052001953	19.0
Die Tendenz geht heute immer stärker zu einer graphischen Darstellung von Blö-	134.64002990722656	203.2158203125	10.076904296875	325.97157287597656	19.0
cken. Wird dagegen eine Beziehungsmatrix dargestellt, repräsentieren Nullen	134.64002990722656	215.7554931640625	10.076904296875	326.0068817138672	19.0
»Nichtbeziehungen« und in Regel Einsen die Beziehungen.	134.64002990722656	228.2357177734375	10.076904296875	228.30931091308597	19.0
Die positionale Analyse basiert auf der Annahme, dass es möglich sei, von den	148.8605499267578	240.7159423828125	10.076904296875	311.7762908935547	19.0
Beziehungen zwischen den einzelnen Akteuren eines Netzwerks zu Beziehungen	134.64002990722656	253.255615234375	10.076904296875	326.0038299560547	19.0
zwischen zunächst abstrakten sozialen Aggregaten, den Blöcken oder Positionen	134.64004516601562	265.73583984375	10.076904296875	326.00482177734375	19.0
überzugehen. Dabei soll eine Beziehungsmatrix so umsortiert werden, dass ein	134.64004516601562	278.216064453125	10.076904296875	326.0229797363281	19.0
interpretierbares Muster entsteht.	134.64004516601562	290.7557373046875	10.076904296875	129.56173706054688	19.0
Harrison C. White (1992) geht in seinem Buch »Identity and Control« davon	148.85955810546875	303.2359619140625	10.076904296875	311.79437255859375	19.0
