arrival of much more practical attitude scales that made it possible to directly	48.0	85.44308471679688	10.0	318.0010986328125	61
apprehend death anxiety. In fact, 95 percent of the studies published in psy-	48.0	96.94308471679688	10.0	317.9801330566406	61
chology on this topic use these types of test (Neimeyer, 1997–8). Among the	48.0	108.44308471679688	10.0	317.988037109375	61
better known, we cite Templer’s (1970) ‘Death Anxiety Scale (D.A.S)’, Colett	48.0	119.94308471679688	10.0	317.99505615234375	61
and Lester’s (1969) the ‘Fear of Death Scale (F.D.S)’, Neimeyer’s (1994)	48.0	131.44308471679688	10.0	317.9989929199219	61
‘Threat Index (T.I)’ and Dickstein’s (1975) ‘Death Concern Scale (D.C.S)’.	48.0	142.94308471679688	10.0	317.99896240234375	61
Moreover, the last scale is composed of 30 items and 2 dimensions: one dimen-	48.0	154.44308471679688	10.0	317.9901428222656	61
sion representing the conscious meditation of death, and a second dimension	48.0	165.94308471679688	10.0	317.9861145019531	61
representing a negative evaluation of it. However, only the second factor is con-	48.0	177.44308471679688	10.0	317.98797607421875	61
sidered as specifically characterizing death anxiety. The other dimension does	48.0	188.94308471679688	10.0	317.9951477050781	61
not correspond to negative emotional reaction towards death but to the con-	48.0	200.44308471679688	10.0	317.9850158691406	61
sciousness of it. In addition, a more recent analysis (Klug and Boss, 1976) shows	48.0	211.94308471679688	10.0	317.9861145019531	61
that the factor relative to death anxiety is only composed of five items. I can also	48.0	223.44308471679688	10.0	317.99212646484375	61
add here that this factor is apprehended in a general, undifferentiated manner.	48.0	234.94308471679688	10.0	317.9989929199219	61
Furthermore, this scale is the only one that has been validated to date in a French	48.0	246.44308471679688	10.0	317.998046875	61
context (Urien, 2001).	48.0	257.9430847167969	10.0	88.8489990234375	61
Measures of predominant temporal orientation and future anxiety	48.0	286.3804016113281	10.0	282.41802978515625	62
I have chosen Usunier and Valette-Florence’s ‘Times Styles Scale’ (1994) in	48.0	303.9430847167969	10.0	317.99603271484375	63
order to measure temporal orientation. It should be noted here that in its com-	48.0	315.4430847167969	10.0	317.998046875	63
plete version, this scale measures 4 dimensions and 8 sub-dimensions in 29	48.0	326.9430847167969	10.0	317.9901428222656	63
items. I have kept the dimensions that seem pertinent for this study, that is, the	48.0	338.4430847167969	10.0	317.9891662597656	63
predominant temporal orientation towards the past and the predominant orienta-	48.0	349.9430847167969	10.0	317.99310302734375	63
tion towards the future. This scale offers very good psychometric qualities and	48.0	361.4430847167969	10.0	317.9970703125	63
has often been used (partially or completely) on various and numerous popula-	48.0	372.9430847167969	10.0	317.99310302734375	63
tions and in different cultural contexts (Valette-Florence et al., 2001), resulting	48.0	384.4430847167969	10.0	317.9980163574219	63
in many relatively recent publications (for a summary, see Usunier and Valette-	48.0	395.9430847167969	10.0	318.0050354003906	63
Florence in this issue).	48.0	407.4430847167969	10.0	90.52700805664062	63
This scale does not take into account present-orientation. I have used one of	58.0	418.9430847167969	10.0	307.9860534667969	63
the dimensions of the temporal orientations scale developed by Ko and Gentry	48.0	430.4430847167969	10.0	317.9830322265625	63
(1991), and by Gentry (1993) for this specific dimension. The reliability of the	48.0	441.9430847167969	10.0	317.9931335449219	63
measure of this dimension is adequate (α = 0.74). The authors have attempted to	48.0	453.2789001464844	10.1641845703125	317.9949951171875	63
test the intercultural validity of these scales on two samples (American and	48.0	464.9430847167969	10.000007629394531	317.9969787597656	63
Thai students) and to explore the sub-dimensions. However, only the present-	48.0	476.4430847167969	10.0	317.9850769042969	63
orientation appeared to resist an invariance of factors.	48.0	487.9430847167969	10.0	214.88494873046875	63
Concerning future anxiety, we have used Zaleski’s scale (1996). This one-	58.0	499.4430847167969	10.0	307.9880065917969	63
dimensional scale, tested and validated on several American and Polish samples,	48.0	510.943115234375	10.0	317.9920654296875	63
has good psychometric qualities. It is composed of 29 items in all, 4 of which are	48.0	522.443115234375	9.999996185302734	317.9939880371094	63
URIEN: SELFLESS TIME	155.9907989501953	32.758056640625	9.0	86.72700500488281	64
377	344.8546142578125	32.7579345703125	9.0	13.5	65
‘buffers’. Moreover, in order to check the global convergent validity of the scale	40.35430145263672	50.943115234375	10.0	317.9910659790039	66
in relation to other ones that are conceptually close, the author correlated the	40.35430145263672	62.443115234375	10.0	318.00110626220703	66
Polish version of this scale with other anxiety scales. The coefficients obtained	40.35430145263672	73.943115234375	9.999969482421875	317.9930191040039	66
show that this type of anxiety is close to traditional conceptions of anxiety, be it	40.35430145263672	85.44308471679688	10.0	317.9931106567383	66
Cattell’s (1966) ‘Overt-Covert Anxiety’ (r = 0.48, N = 88), Taylor’s (1953)	40.35430145263672	96.94308471679688	10.019317626953125	317.9989700317383	66
‘Manifest Anxiety’ (r = 0.64, N= 83) or Spielberger ’s (1971) ‘Trait Anxiety’	40.35429382324219	108.44308471679688	10.019317626953125	317.99900817871094	66
(r = 0.61, N = 135). In fact, if all of these results show that all of these scales	40.35328674316406	119.94308471679688	10.019317626953125	318.0029754638672	66
belong to the same network of the conceptual sphere of anxiety, the scale of	40.35428237915039	131.44308471679688	10.0	317.99306869506836	66
future anxiety, however, conserves its own specificity and its own discriminat-	40.35428237915039	142.94308471679688	10.0	317.9920310974121	66
ing utility. Finally, this scale shows encouraging psychometric qualities as well	40.35428237915039	154.44308471679688	10.0	317.990047454834	66
as a cross-cultural method central to the process of creating a scale.	40.35428237915039	165.94308471679688	10.0	269.30102157592773	66
Validation of the scales used	40.35428237915039	194.38040161132812	10.0	120.53197860717773	67
I have worked from two samples of individuals of French origin: one sample of	40.35428237915039	211.94308471679688	10.0	317.9860496520996	68
349 young adults (average age: 21) and a sample of 302 older adults (average	40.35428237915039	223.44308471679688	10.0	317.990047454834	68
age: 47). Six hundred and fifty-one questionnaires were then used for the data	40.35428237915039	234.94308471679688	10.0	317.98705673217773	68
analysis. According to the works of Gesser et al. (1987), the individuals in their	40.35428237915039	246.44308471679688	10.0	317.98806381225586	68
40s would have a higher death anxiety than the individuals belonging to other	40.35428237915039	257.9430847167969	10.0	317.9761619567871	68
age groups. In fact, these two samples have multiple interests: they allow us to	40.35428237915039	269.4430847167969	10.0	317.9900779724121	68
have differences in mean age that are important enough to detect a potential	40.35428237915039	280.9430847167969	10.0	317.9930992126465	68
variation in the intensity of the level of death anxiety whatever the meaning of	40.35428237915039	292.4430847167969	10.0	317.99197006225586	68
this variation. It also makes it possible to analyse the stability of relations	40.35428237915039	303.9430847167969	10.0	318.0020408630371	68
between death anxiety and the different traditional temporal dimensions.	40.35428237915039	315.4430847167969	10.0	317.9991111755371	68
Considering the size of our samples and the nature of our variables, I have	40.35428237915039	326.9430847167969	10.0	317.98998641967773	68
retained more specifically the method of estimation according to the maximum	40.35428237915039	338.4430847167969	10.0	318.0050926208496	68
likelihood. Concerning the translation of the scales into French, I have used the	40.35428237915039	349.9430847167969	10.0	317.9880027770996	68
technique of blind parallel translation: each of the three translators involved	40.35428237915039	361.4430847167969	10.0	318.00197982788086	68
did his own translation from the source language to the target language inde-	40.35428237915039	372.9430847167969	10.0	317.990047454834	68
pendently, then the different versions were compared and a final version was	40.35428237915039	384.4430847167969	10.0	317.9980125427246	68
made.	40.35428237915039	395.9430847167969	10.0	24.156002044677734	68
Test of the short form scale of death anxiety	40.35428237915039	424.3804016113281	10.0	187.14599227905273	69
As recommended by Klug and Boss (1976), the texts were administered to the	40.35428237915039	441.9430847167969	10.0	317.98900985717773	70
two samples in its original version. An exploratory factorial analysis then made	40.35428237915039	453.4430847167969	10.0	317.991024017334	70
it possible to keep items whose ‘loadings’ were superior to 0.50 on one factor	40.35428237915039	464.9430847167969	10.000007629394531	317.9860496520996	70
and weak on the other factor. My analysis was based uniquely on the dimension	40.35428237915039	476.4430847167969	10.0	317.9891014099121	70
concerning death anxiety. This analysis permitted me to find again the five items	40.35428237915039	487.9430847167969	10.0	317.99404525756836	70
that specifically measure death anxiety. A confirmatory analysis to one latent	40.35428237915039	499.4430847167969	10.0	318.00304794311523	70
factor and five variables of measure was then realized. Validation of the	40.35428237915039	510.943115234375	10.0	317.99901962280273	70
measures was done based on the confirmatory analyses. The adequacy of the	40.35428237915039	522.443115234375	9.999996185302734	317.99099349975586	70
378	48.0	32.74774169921875	9.0	13.5	71
TIME & SOCIETY 16(2/3)	158.2447052001953	32.7476806640625	9.0	97.51118469238281	72
final specified model of measure with the data is satisfactory on the two samples	48.0	50.943115234375	10.0	318.00201416015625	73
(comparative fit index [CFI*] of 0.99/0.98). The reliability tests give satis-	48.0	62.443115234375	10.0	318.00311279296875	73
factory results. Indeed, the calculation of Joreskog’s ρ gives a result of 0.88 for	48.0	73.7789306640625	10.164154052734375	317.9980163574219	73
the young adults and 0.82 for the older adults. In order to be certain of the con-	48.000030517578125	85.44308471679688	10.0	317.9850769042969	73
vergent validity, I retained only three indictors: a significant link between the	48.000030517578125	96.94308471679688	10.0	317.9991149902344	73
variables of measure and their latent factor, satisfactory criteria of adjustment	48.000030517578125	108.44308471679688	10.0	318.0100402832031	73
and, finally, factorial weights > 0.5. Since all of the criteria have been observed,	48.000030517578125	119.94308471679688	10.0	317.99090576171875	73
we can then conclude that the reliability is good and that the validity of the scale	48.000030517578125	131.44308471679688	10.0	317.9920654296875	73
is satisfactory for the two samples.	48.000030517578125	142.94308471679688	10.0	138.83497619628906	73
Test of the future anxiety scale	48.000030517578125	171.38040161132812	10.0	130.77899169921875	74
The exploratory factorial analysis done on the 25 statements showed the	48.000030517578125	188.94308471679688	10.0	317.9901428222656	75
existence of a main factor on the two samples. I therefore retained the first	48.000030517578125	200.44308471679688	10.0	318.00799560546875	75
component and specified a model of measure to one factor. In the end, I obtained	48.000030517578125	211.94308471679688	10.0	317.9910583496094	75
a one-dimensional structure and 13 variables from the 2 samples. These	48.000030517578125	223.44308471679688	10.0	317.99102783203125	75
variables have a significant liaison with their latent factor. The adequacy of the	48.000030517578125	234.94308471679688	10.0	318.0030517578125	75
specified models of measure with the data is very satisfactory (CFI* of	48.000030517578125	246.44308471679688	10.0	317.99700927734375	75
0.98/0.96). The coefficients of reliability are good (Joreskog’s ρ is 0.90 for the	48.000030517578125	257.7789001464844	10.1641845703125	317.9970397949219	75
young adults and 0.92 for the older adults). The Z tests are all significant and	48.00006103515625	269.4430847167969	10.0	317.98309326171875	75
the supplementary guarantee of convergent validity are given by satisfactory	48.00006103515625	280.9430847167969	10.0	317.9991149902344	75
criteria of adjustment and factorial weights all superior to 0.5.	48.00006103515625	292.4430847167969	10.0	247.3961181640625	75
Tests of future-orientation, past-orientation and present-orientation scales	48.00006103515625	320.8804016113281	10.0	316.2850646972656	76
After a confirmatory analysis of the items corresponding to predominant	48.00006103515625	338.4430847167969	10.0	317.9971008300781	77
temporal orientations, we obtain the two dimensions corresponding to future-	48.00006103515625	349.9430847167969	10.0	317.99310302734375	77
orientation and past-orientation on the two samples. The coefficients of reli-	48.00006103515625	361.4430847167969	10.0	318.0030517578125	77
ability are good (ρ of 0.78 and 0.77 for orientation towards the past, and 0.78	48.00006103515625	372.7789001464844	10.1641845703125	317.9860534667969	77
and 0.67 for orientation towards the future). With a CFI of 0.95 and 0.97, the	48.00006103515625	384.4430847167969	10.0	317.9850158691406	77
two specified models have a good quality of adjustment. All of the Z tests are	48.00006103515625	395.9430847167969	10.0	317.98907470703125	77
significant, and all of the statements have a factorial weight > 0.5, which attest	48.00006103515625	407.4430847167969	10.0	317.9999694824219	77
to the convergent validity.	48.00006103515625	418.9430847167969	10.0	104.9639892578125	77
Regarding orientation towards the present, a confirmatory analysis with a	58.00006103515625	430.4430847167969	10.0	307.9971008300781	77
latent factor and 6 variables of measure has been done. An in-depth reading of	48.00006103515625	441.9430847167969	10.0	317.99609375	77
the different variables shows that they express an active search for pleasure very	48.00006103515625	453.4430847167969	10.0	317.99700927734375	77
close to hedonism. The quality of the fit index are excellent for both the samples	48.00006103515625	464.9430847167969	10.000007629394531	317.9971008300781	77
of young adults and older adults. The indices of reliability are good (Joreskog’s	48.00006103515625	476.4430847167969	10.0	317.9900817871094	77
ρ: 0.86/0.85) and the convergent validity is satisfactory. The quality of the	48.00006103515625	487.7789001464844	10.1641845703125	317.9890441894531	77
indicators of adjustment and the fact that all of the statements except one have a	48.00006103515625	499.4430847167969	10.0	317.9971008300781	77
factorial weight > 0.5 are additional guarantees of convergent validity.	48.00006103515625	510.943115234375	10.0	281.8990478515625	77
Moreover, the correlation analysis between the different latent factors corre-	58.00006103515625	522.443115234375	9.999996185302734	308.0109558105469	77
URIEN: SELFLESS TIME	155.9907989501953	32.758056640625	9.0	86.72700500488281	78
379	344.8546142578125	32.7579345703125	9.0	13.5	79
TABLE 1	180.72500610351562	49.992431640625	9.0	37.25999450683594	80
Correlations between death anxiety and future anxiety, future-orientation,	56.5277099609375	59.9923095703125	9.0	285.65728759765625	80
past-orientation and present-orientation	122.1278076171875	69.9921875	9.0	154.45889282226562	80
Death anxiety	213.74070739746094	90.04885864257812	9.0	50.22721862792969	81
Young adults	159.73260498046875	100.04876708984375	9.0	48.240020751953125	82
(average age: 21 years)	142.0106964111328	110.04885864257812	9.0	83.68917846679688	82
Older adults	270.7341003417969	100.04876708984375	9.0	44.235015869140625	83
(average age: 47 years)	251.01239013671875	110.04885864257812	9.0	83.689208984375	83
Future anxiety	40.35389709472656	128.04885864257812	9.0	52.233306884765625	84
Future-orientation	40.35389709472656	138.04876708984375	9.0	65.47770690917969	84
Past-orientation	40.35389709472656	148.04867553710938	9.0	56.98350524902344	84
Present-orientation	40.35430145263672	158.04885864257812	9.0	68.47380828857422	84
Note: All of the Z tests are significant, p = 5%	40.35430145263672	180.853515625	8.015472412109375	147.79517364501953	85
0.41	177.35369873046875	128.04885864257812	9.0	15.747299194335938	86
0.17	177.3563995361328	138.04876708984375	9.0	15.747299194335938	86
0.31	177.3572998046875	148.04867553710938	9.0	15.747299194335938	86
–0.10	172.85861206054688	158.04885864257812	9.0	20.24639892578125	86
0.43	285.8504943847656	128.04885864257812	9.0	15.747314453125	87
0.20	285.85321044921875	138.04876708984375	9.0	15.747314453125	87
0.35	285.8540954589844	148.04867553710938	9.0	15.747314453125	87
–0.12	281.3544921875	158.04885864257812	9.0	20.24639892578125	87
sponding to each of the traditional temporal dimensions mobilized shows that	40.35430145263672	212.16680908203125	10.0	317.9950942993164	88
their discriminating validity is established.	40.35430145263672	223.66680908203125	10.0	170.23596954345703	88
Analysis of the links between the traditional temporal dimensions and	40.35430145263672	252.1041259765625	10.0	297.4520950317383	89
death anxiety	40.35430145263672	263.6041259765625	10.0	57.487998962402344	89
After having examined the psychometric quality of each scale, we can now	40.35430145263672	281.16680908203125	10.0	317.9870376586914	90
envisage a correlational analysis between the different latent factors. Having	40.35430145263672	292.66680908203125	10.0	318.00403594970703	90
two samples makes it possible to observe the stability of the coefficients	40.35430145263672	304.16680908203125	10.0	317.9970169067383	90
obtained. Concerning the quality of the model and considering the lack of	40.35430145263672	315.66680908203125	10.0	317.98804473876953	90
normality of the data distribution, the robust fit index has been retained. The	40.35430145263672	327.16680908203125	10.0	317.99405670166016	90
value of the CFI (0.91), of the incremental fit index (IFI) (0.91) and the root	40.35430145263672	338.66680908203125	10.0	317.99002838134766	90
mean square error of approximation (RMSEA) (0.053) permits us to maintain	40.35430145263672	350.16680908203125	10.0	317.9981155395508	90
that our models possess a satisfactory quality of adjustment.	40.35430145263672	361.66680908203125	10.0	240.2000503540039	90
The analysis of the results shows that death anxiety is positively and signifi-	50.35430145263672	373.16680908203125	10.0	307.9861526489258	90
cantly correlated to future anxiety, orientation towards the past and orientation	40.35430145263672	384.66680908203125	10.0	318.00012969970703	90
towards the future. On the other hand, the correlation coefficient is negative but	40.35430145263672	396.16680908203125	10.0	317.99503326416016	90
significant with orientation towards the present. One will also note that the	40.35430145263672	407.66680908203125	10.0	317.99002838134766	90
intensity of the correlation coefficients is different, depending on the temporal	40.35430145263672	419.16680908203125	10.0	318.00003814697266	90
dimensions, and that these coefficients vary slightly between the two samples.	40.35430145263672	430.66680908203125	10.0	312.66312408447266	90
Moderating effect of age	40.35430145263672	459.1041259765625	10.0	104.10700225830078	91
We will successively study the moderating effect of age on the variation in the	40.35430145263672	476.66680908203125	10.0	317.9970169067383	92
intensity of death anxiety between the two samples, and the variation in the	40.35430145263672	488.16680908203125	10.0	317.99112701416016	92
intensity of correlation links between death anxiety and the other temporal	40.35430145263672	499.66680908203125	10.0	317.9960708618164	92
dimensions studied in this research. This last analysis will make it possible to	40.35430145263672	511.16680908203125	10.0	317.9931106567383	92
know if the slight variations observed are significant or not.	40.35430145263672	522.6668090820312	9.999996185302734	238.7990493774414	92
380	48.0	32.74774169921875	9.0	13.5	93
TIME & SOCIETY 16(2/3)	158.2447052001953	32.7476806640625	9.0	97.51118469238281	94
TABLE 2	187.72459411621094	54.1851806640625	9.0	37.25999450683594	95
Results of the univariate descriptive statistics	119.76289367675781	64.18505859375	9.0	173.18971252441406	95
Young adults N= 349	47.353515625	112.24154663085938	9.01739501953125	77.32260131835938	96
Older adults N = 302	47.354000091552734	122.24154663085938	9.01739501953125	77.81219863891602	96
Mean = m	172.32119750976562	94.24154663085938	9.0	37.064697265625	97
m = 9.46	173.34091186523438	112.24154663085938	9.0	35.0264892578125	98
1	
m = 10.39	171.09140014648438	122.24154663085938	9.0	39.5260009765625	98
2	178.09140014648438	1
Death anxiety	220.7404022216797	84.24154663085938	9.0	50.22721862792969	99
Standard Deviation = σ	257.48822021484375	94.09378051757812	9.14776611328125	84.72958374023438	99
σ1 = 3.85	283.127685546875	112.09378051757812	11.41455078125	33.453094482421875	100
σ2 = 3.63	283.127685546875	122.09378051757812	11.41455078125	33.453094482421875	100
Study of the influence of age on the intensity of death anxiety	48.0	171.38040161132812	10.0	259.65802001953125	101
We have tested the existence of significant differences between the mean death	48.0	188.94308471679688	10.0	318.0050048828125	102
anxiety of young adults and older adults. This mean was calculated based on the	48.0	200.44308471679688	10.0	317.9790954589844	102
summations of the scores obtained on the five items constituting death anxiety.	48.0	211.94308471679688	10.0	317.99212646484375	102
The results of the univariate descriptive statistics are given in Table 2.	48.0	223.44308471679688	10.0	280.43707275390625	102
The calculation of the Z test gives us a result of 3.17. Since the result is	58.0	234.94308471679688	10.0	307.985107421875	102
superior to 1.96, the bilateral mean comparison test shows that the differences in	48.0	246.44308471679688	10.0	317.99700927734375	102
death anxiety are significant, p = 5 per cent. In our samples, death anxiety felt at	48.0	257.9430847167969	10.019317626953125	317.9909973144531	102
47 years of age is then slightly more important than it is felt at 21 years of age.	48.0	269.4430847167969	10.0	314.87811279296875	102
The influence of age on the intensity of the correlation links between death	48.0	297.8804016113281	10.0	317.135009765625	103
anxiety and the other temporal dimensions	48.0	309.3804016113281	10.0	182.46002197265625	103
According to Byrne’s (1994) recommendations on the subject, studying the	48.0	326.9430847167969	10.0	317.984130859375	104
moderating effect of a variable on the links between latent factors amounts to	48.0	338.4430847167969	10.0	318.0030212402344	104
carrying out a multi-group analysis by testing the invariance of the parameters	48.0	349.9430847167969	10.0	317.99298095703125	104
of measure and the parameters of correlation on several samples. This is pre-	48.0	361.4430847167969	10.0	318.00006103515625	104
cisely why I worked with two samples: one made up of young adults, the other	48.0	372.9430847167969	10.0	317.9791259765625	104
of older adults. In order to do so, I used Lagrange’s test, which evaluates the	48.0	384.4430847167969	10.0	317.9840393066406	104
effects of liberating the parameters fixed in the initial specified model on	48.0	395.9430847167969	10.0	318.00616455078125	104
the decline of the ‘Chi square’, and makes it possible to improve the quality of	48.0	407.4430847167969	10.0	317.985107421875	104
the model. I then followed the classical method recommended by Byrne and I	48.0	418.9430847167969	10.0	317.9910583496094	104
then simultaneously tested the invariance of the measurement models and the	48.0	430.4430847167969	10.0	317.9960021972656	104
invariance of the correlation links. I set constraints of equality between the	48.0	441.9430847167969	10.0	318.0030822753906	104
parameters of measure (coefficients of regression of the different variables of	48.0	453.4430847167969	10.0	318.01202392578125	104
measure on their latent factor) for the two samples, and constraints of equality	48.0	464.9430847167969	10.000007629394531	318.0010681152344	104
between the parameters corresponding to the correlation coefficients between	48.0	476.4430847167969	10.0	318.0029602050781	104
the latent factors obtained on the sample of the young adults and those obtained	48.0	487.9430847167969	10.0	317.984130859375	104
on the sample of older adults. The analysis of the results show that the quality of	48.0	499.4430847167969	10.0	317.9831848144531	104
the multi-group model seemed satisfactory on the whole (Chi square = 1458, d.f.	48.0	510.943115234375	10.0	317.98199462890625	104
= 763, NFI = 0.901, CFI = 0.902, RMSEA = 0.053). The observation of	48.0	522.443115234375	9.999996185302734	318.02197265625	104
URIEN: SELFLESS TIME	155.9907989501953	32.758056640625	9.0	86.72700500488281	105
381	344.8546142578125	32.7579345703125	9.0	13.5	106
Lagrange’s multivariate tests on the ‘constrained’ parameters of the measure of	40.35430145263672	50.943115234375	10.0	318.0119400024414	107
death anxiety shows none of them are significant. This means that there is	40.35430145263672	62.443115234375	10.0	317.9890823364258	107
invariance in the instrument of measure on the two samples. However, this	40.35430145263672	73.943115234375	9.999969482421875	317.99011993408203	107
