www.ssoar.info	401.6929931640625	115.6031494140625	18.0	131.21990966796875	0
Selfless Time	73.69999694824219	204.35015869140625	18.0	114.62400817871094	1
Urien, Bertrand	73.69999694824219	224.9937744140625	13.0	88.08799743652344	2
Postprint / Postprint	73.69999694824219	254.47564697265625	10.0	87.17001342773438	3
Zeitschriftenartikel / journal article	73.69999694824219	269.30963134765625	10.0	148.82998657226562	4
Zur Verfügung gestellt in Kooperation mit / provided in cooperation with:	73.69999694824219	295.744384765625	10.0	345.13999938964844	5
www.peerproject.eu	73.69999694824219	310.316650390625	10.0	87.77998352050781	6
Empfohlene Zitierung / Suggested Citation:	59.527000427246094	353.9180603027344	9.0	184.78795623779297	7
Urien, Bertrand: Selfless Time. In: Time & Society 16 (2007), 2-3, pp. 367-386. DOI: https://	59.527000427246094	364.4825439453125	9.020660400390625	362.3940200805664	7
doi.org/10.1177/0961463X07080273	59.527000427246094	375.28253173828125	9.0	145.39496612548828	7
Nutzungsbedingungen:	59.527000427246094	567.9148559570312	8.0	89.22400665283203	8
Dieser Text wird unter dem "PEER Licence Agreement zur	59.527000427246094	577.3358764648438	8.0	228.18399810791016	8
Verfügung" gestellt. Nähere Auskünfte zum PEER-Projekt finden	59.527000427246094	586.9358520507812	8.0	228.18997955322266	8
Sie hier: http://www.peerproject.eu Gewährt wird ein nicht	59.527000427246094	596.535888671875	8.0	228.1869888305664	8
exklusives, nicht übertragbares, persönliches und beschränktes	59.527000427246094	606.1358642578125	8.0	228.18897247314453	8
Recht auf Nutzung dieses Dokuments. Dieses Dokument	59.527000427246094	615.73583984375	8.0	228.18997955322266	8
ist ausschließlich für den persönlichen, nicht-kommerziellen	59.527000427246094	625.3358764648438	8.0	228.18799591064453	8
Gebrauch bestimmt. Auf sämtlichen Kopien dieses Dokuments	59.527000427246094	634.9358520507812	8.0	228.18799591064453	8
müssen alle Urheberrechtshinweise und sonstigen Hinweise	59.527000427246094	644.535888671875	8.0	228.1869888305664	8
auf gesetzlichen Schutz beibehalten werden. Sie dürfen dieses	59.527000427246094	654.1358642578125	8.0	228.1869888305664	8
Dokument nicht in irgendeiner Weise abändern, noch dürfen	59.527000427246094	663.73583984375	8.0	228.18598175048828	8
Sie dieses Dokument für öffentliche oder kommerzielle Zwecke	59.527000427246094	673.3358764648438	8.0	228.18900299072266	8
vervielfältigen, öffentlich ausstellen, aufführen, vertreiben oder	59.527000427246094	682.9358520507812	8.0	228.18799591064453	8
anderweitig nutzen.	59.527000427246094	692.535888671875	8.0	69.33599090576172	8
Mit der Verwendung dieses Dokuments erkennen Sie die	59.527000427246094	702.1358642578125	8.0	228.18500518798828	8
Nutzungsbedingungen an.	59.527000427246094	711.73583984375	8.0	93.36798858642578	8
Diese Version ist zitierbar unter / This version is citable under:	59.527000427246094	792.8366088867188	10.0	273.25000762939453	9
http://nbn-resolving.de/urn:nbn:de:0168-ssoar-223512	59.527000427246094	804.8366088867188	10.0	238.91996002197266	9
Terms of use:	304.7229919433594	567.9148559570312	8.0	51.824005126953125	10
This document is made available under the "PEER Licence	304.7229919433594	577.3358764648438	8.0	228.18399047851562	10
Agreement ". For more Information regarding the PEER-project	304.7229919433594	586.9358520507812	8.0	228.18496704101562	10
see: http://www.peerproject.eu This document is solely intended	304.7229919433594	596.535888671875	8.0	228.18997192382812	10
for your personal, non-commercial use.All of the copies of	304.7229919433594	606.1358642578125	8.0	228.18405151367188	10
this documents must retain all copyright information and other	304.7229919433594	615.73583984375	8.0	228.18399047851562	10
information regarding legal protection. You are not allowed to alter	304.7229919433594	625.3358764648438	8.0	228.19204711914062	10
this document in any way, to copy it for public or commercial	304.7229919433594	634.9358520507812	8.0	228.19003295898438	10
purposes, to exhibit the document in public, to perform, distribute	304.7229919433594	644.535888671875	8.0	228.19100952148438	10
or otherwise use the document in public.	304.7229919433594	654.1358642578125	8.0	143.09600830078125	10
By using this particular document, you accept the above-stated	304.7229919433594	663.73583984375	8.0	228.18399047851562	10
conditions of use.	304.7229919433594	673.3358764648438	8.0	62.21600341796875	10
Selfless Time	149.122802734375	102.35089111328125	18.0	100.472412109375	11
From life space to death anticipation	89.91619873046875	125.5946044921875	14.0	218.88156127929688	12
Bertrand Urien	159.5355987548828	154.71646118164062	12.0	79.64039611816406	13
ABSTRACT. Time studies in psychology or in consumer behaviour,	76.35430145263672	218.20565795898438	9.0	245.98892974853516	14
traditionally think of the personal future as a Lewinian ‘life space’,	76.35430145263672	228.20556640625	9.0	245.99787139892578	14
containing several well-known time dimensions: future time per-	76.35430145263672	238.20547485351562	9.0	246.00061798095703	14
spective, future anxiety, and hope. Those dimensions are used to test	76.35430145263672	248.20538330078125	9.0	245.9898452758789	14
the predictive power of various behaviours (attitudinal change,	76.35430145263672	258.2052917480469	9.0	245.99524688720703	14
health behaviour, delay of gratification, etc.) or more specifically:	76.35430145263672	268.2052001953125	9.0	246.00421905517578	14
the temporality of consumer behaviours as implied in consumption	76.35430145263672	278.2051086425781	9.0	245.99616241455078	14
of cultural goods, exploratory consumer behaviour, or mail order	76.35430145263672	288.20501708984375	9.0	245.99430084228516	14
purchasing. However, the personal future is flexible enough to	76.35430145263672	298.2049255371094	9.0	245.9889907836914	14
enable individuals to project themselves well beyond this ‘life space’	76.35430145263672	308.204833984375	9.0	245.99616241455078	14
into a post-mortem future. In this context, I propose to look at the	76.35430145263672	318.2047424316406	9.0	245.99622344970703	14
concept of death anxiety. Researchers studying the influence of time	76.35430145263672	328.20465087890625	9.0	245.99796295166016	14
representations on human behaviour should not limit themselves to	76.35430145263672	338.2045593261719	9.0	245.99527740478516	14
apprehending the traditional dimension of personal future; they	76.35430145263672	348.2044677734375	9.0	245.99518585205078	14
could integrate an understanding of the future that projects us beyond	76.35430145263672	358.204345703125	9.0	245.98892974853516	14
physical death. This requires first a close examination of the rela-	76.35430145263672	368.2042236328125	9.0	245.99970245361328	14
tionships between death anxiety and the traditionally applied future	76.35430145263672	378.2041320800781	9.0	245.99433135986328	14
dimensions, and then broadening the scope to various human and	76.35430145263672	388.20404052734375	9.0	245.98172760009766	14
consumer behaviours still unexplained by traditionally acknowl-	76.35430145263672	398.20391845703125	9.0	245.9970474243164	14
edged temporal dimensions. I first present the classical Lewinian	76.35430145263672	408.20379638671875	9.0	246.0024185180664	14
notion of personal future, highlighting some of its aspects, to show	76.35430145263672	418.2037048339844	9.0	245.99076080322266	14
how death anxiety is part of the personal future, and presents major	76.35430145263672	428.20361328125	9.0	245.9943618774414	14
behavioural impacts. Second, by using structural equation model-	76.35430145263672	438.2034912109375	9.0	245.9943618774414	14
ling, and a multi-group approach, I present an empirical study aiming	76.35430145263672	448.203369140625	9.0	245.99884796142578	14
to show the nature and the intensity of the links between death	76.35430145263672	458.2032775878906	8.999992370605469	245.98978424072266	14
anxiety and the other traditionally applied dimensions. KEY	76.35430145263672	468.20318603515625	9.0	245.9970474243164	14
WORDS • death anxiety • generativity • personal future • psycho-	76.35430145263672	478.20306396484375	9.0	245.99433135986328	14
logical time • Terror Management Theory	76.35430145263672	488.2029724121094	9.0	150.83280181884766	14
Time & Society copyright © 2007 SAGE (Los Angeles, London, New Delhi and Singapore)	52.247100830078125	509.10394287109375	8.01544189453125	294.2063903808594	15
VOL. 16 No. 2/3 (2007), pp. 367–386 0961-463X DOI: 10.1177/0961463X07080273	60.03830337524414	518.1039428710938	8.0	278.648006439209	15
www.sagepublications.com	151.1455078125	527.1039428710938	8.000003814697266	88.41360473632812	15
368	48.0	32.74774169921875	9.0	13.5	16
TIME & SOCIETY 16(2/3)	158.2447052001953	32.7476806640625	9.0	97.51118469238281	17
Introduction	179.78199768066406	50.88043212890625	10.0	54.43901062011719	18
‘Temporal consciousness cannot be divorced from the awareness of death.’	48.0	74.443115234375	9.999969482421875	317.9959411621094	19
With this phrase, Clay Routledge and Jamie Arndt (2005) draw our attention to	48.0	85.94308471679688	10.0	317.986083984375	19
the potential contiguity of two fundamental human faculties, thinking about time	48.0	97.44308471679688	10.0	317.9910888671875	19
and death anticipation. The aim of this article is to integrate death anticipation in	48.0	108.94308471679688	10.0	318.0020751953125	19
the conceptual structure of our time experience. Close relations between death	48.0	120.44308471679688	10.0	317.9930419921875	19
and time have already been demonstrated. For example, Held and Nützinger	48.0	131.94308471679688	10.0	317.9891052246094	19
(1998) and Sabelis (2002) discuss the dominance of ‘clock time’ as the ultimate	48.0	143.44308471679688	10.0	317.99005126953125	19
mode for conjuration of finitude. However, if we want to expand our scope	48.0	154.94308471679688	10.0	317.98602294921875	19
beyond relations with ‘clock time’, we should envisage death with other forms	48.0	166.44308471679688	10.0	317.987060546875	19
of time experience, also qualified by perception, perspective or temporal	48.0	177.94308471679688	10.0	318.0019836425781	19
orientation.1 Very early, the French philosopher Guyau (1890) considered time	48.0	189.36175537109375	10.081329345703125	317.9935607910156	19
as a product of the consciousness and wrote that the past and the future are	48.00049591064453	200.94308471679688	10.0	317.9950180053711	19
represented. In keeping with the tradition of Lewin (1942), psychologists and	48.00049591064453	212.44308471679688	10.0	317.98412322998047	19
social psychologists such as Fraisse (1967), Nuttin (1980), Raynor and Entin	48.00049591064453	223.94308471679688	10.0	317.98509979248047	19
(1982), have contributed considerably to the structuring and the knowledge in	48.00049591064453	235.44308471679688	10.0	317.98412322998047	19
this field of research. Moreover, among the three temporal zones, the future has	48.00049591064453	246.94308471679688	10.0	317.99498748779297	19
been the object of specific research (Bouffard, 1993; Zaleski, 1996, 2005), as	48.00049591064453	258.4430847167969	10.0	317.98909759521484	19
much as on the means of apprehending and living it cognitively and emotionally	48.00049591064453	269.9430847167969	10.0	317.98717498779297	19
as on its behavioural impact (Strathman and Joireman, 2005). But what future	48.00049591064453	281.4430847167969	10.0	317.9961166381836	19
are we discussing? Since the works of Lewin (1942), most works traditionally	48.00049591064453	292.9430847167969	10.0	317.99007415771484	19
think of the personal future as a Lewinian ‘life space’ (Bergadaà, 1990;	48.00049591064453	304.4430847167969	10.0	317.9909896850586	19
Strathman and Joireman 2005). In psychology for example, this ‘life space’ con-	48.00049591064453	315.9430847167969	10.0	317.99498748779297	19
tains several well-known dimensions that are used to test the predictive power of	48.00049591064453	327.4430847167969	10.0	317.99193572998047	19
various behaviours (attitude change, health behaviour, delay of gratification,	48.00049591064453	338.9430847167969	10.0	317.9890670776367	19
etc.). In marketing and consumer behaviour, other behaviours are tested	48.00049591064453	350.4430847167969	10.0	317.9950180053711	19
(consumption of cultural goods, exploratory consumer behaviour, mail order	48.00049591064453	361.9430847167969	10.0	317.98702239990234	19
purchasing, etc.). Yet, Boyd and Zimbardo (1997) strayed onto another path by	48.00049591064453	373.4430847167969	10.0	317.98006439208984	19
integrating what happens in the afterlife into their reflection about time. Adam	48.00049591064453	384.9430847167969	10.0	317.99608612060547	19
and Groves (2007) outline the importance of the encounters with death to ‘tame	48.00049591064453	396.4430847167969	10.0	317.99706268310547	19
the future’. Finally, Routledge and Arndt (2005: 59) add that, ‘Being able to	48.00049591064453	407.9430847167969	10.0	317.9820785522461	19
think about the future means being able to think about a future without us in it.’	48.00049591064453	419.4430847167969	10.0	317.9891586303711	19
In keeping with the works of these authors, this article proposes to integrate	48.00049591064453	430.9430847167969	10.0	317.9930953979492	19
death anticipation, and more specifically death anxiety, into the structure of	48.00049591064453	442.4430847167969	10.0	317.99303436279297	19
one’s personal future. On the individual level, this new integration requests first	48.00049591064453	453.9430847167969	10.0	317.99205780029297	19
a close examination of the relationships between death anxiety and the tradi-	48.00049591064453	465.4430847167969	10.000007629394531	317.9909896850586	19
tional dimensions of the future, and should then broaden the scope of under-	48.00049591064453	476.9430847167969	10.0	317.9830551147461	19
standing of various human and consumer behaviours still unexplained by	48.00049591064453	488.4430847167969	10.0	317.9790573120117	19
traditional temporal dimensions. If the behavioural impact of death anxiety has	48.00049591064453	499.9430847167969	10.0	317.99202728271484	19
already been studied both in psychology (Tomer and Eliason, 1996) and con-	48.00049591064453	511.443115234375	10.0	317.98506927490234	19
sumer behaviour (Bonsu and Belk, 2003; Urien, 2003), there rarely have been	48.00049591064453	522.943115234375	9.999996185302734	317.9829635620117	19
URIEN: SELFLESS TIME	155.9907989501953	32.758056640625	9.0	86.72700500488281	20
369	344.8546142578125	32.7579345703125	9.0	13.5	21
works addressing the topic in terms of time studies. Yet, it is important that	40.35430145263672	50.943115234375	10.0	317.9950942993164	22
researchers studying the influence of time representations on human behaviour,	40.35430145263672	62.443115234375	10.0	317.99308013916016	22
and consumer behaviour, should not limit themselves to apprehending the	40.35430145263672	73.943115234375	9.999969482421875	317.9871292114258	22
traditional dimensions of the personal future but integrate also the future which	40.35430145263672	85.44308471679688	10.0	317.9970169067383	22
projects us beyond our physical death.	40.35430145263672	96.94308471679688	10.0	153.27298736572266	22
This research firstly presents the classical Lewinian notion of personal future,	50.35430145263672	108.44308471679688	10.0	308.0010757446289	22
highlights some of its aspects, shows how death anxiety is part of the personal	40.35430145263672	119.94308471679688	10.0	317.98905181884766	22
future, and presents some of the major behavioural impacts. Second, by using	40.35430145263672	131.44308471679688	10.0	317.99210357666016	22
structural equation modelling, and a multi-group approach, we present an	40.35430145263672	142.94308471679688	10.0	317.9870376586914	22
empirical study aiming to show the nature and the intensity of the links between	40.35430145263672	154.44308471679688	10.0	317.9871292114258	22
death anxiety and other dimensions of temporal orientation.	40.35430145263672	165.94308471679688	10.0	238.80204010009766	22
Death Anxiety: Personal Future and Selfless Anticipation	77.164306640625	201.38040161132812	10.0	244.385009765625	23
‘Man is the only animal aware of his own mortality. Without the awareness of	40.354305267333984	224.94308471679688	10.0	317.9980812072754	24
one’s own finiteness, there can be no consciousness of one’s past – no remorse,	40.354305267333984	236.44308471679688	10.0	317.9900550842285	24
nor nostalgia – and no consciousness of one’s future – in other words, no	40.354305267333984	247.94308471679688	10.0	317.9780616760254	24
consciousness of time’ (Piettre, 1994: 117, author’s translation). Paul Fraisse, an	40.354305267333984	259.4430847167969	10.0	317.99805068969727	24
eminent psychologist of time, wrote that philosophical reflection had preceded	40.354305267333984	270.9430847167969	10.0	317.995059967041	24
scientific reflection on a number of issues, and that this process was certainly	40.354305267333984	282.4430847167969	10.0	317.99509048461914	24
still underway. After presenting the work of several philosophers on the links	40.354305267333984	293.9430847167969	10.0	317.99106216430664	24
between death awareness and the representation of time, I will argue how death	40.354305267333984	305.4430847167969	10.0	317.9890785217285	24
anxiety can be integrated into the network of the personal future.	40.354305267333984	316.9430847167969	10.0	259.04504776000977	24
Death awareness and personal future	40.354305267333984	345.3804016113281	10.0	158.8459815979004	25
The subjective experience of time and, more specifically, the representation	40.354305267333984	362.9430847167969	10.0	317.99805068969727	26
humankind has constructed of time, has been one of philosophy’s favourite	40.354305267333984	374.4430847167969	10.0	317.9880714416504	26
topics. Nonetheless, the variety of ways in which philosophy grasps time should	40.354305267333984	385.9430847167969	10.0	317.98215103149414	26
prompt us to caution. It led Pélicier (cited in Sutter, 1983) to write that all	40.354305267333984	397.4430847167969	10.0	318.00204849243164	26
philosophers have dealt with time without giving any definite answers, since	40.354305267333984	408.9430847167969	10.0	317.98508071899414	26
none of them talk about the same thing. He continues by stating that they are	40.354305267333984	420.4430847167969	10.0	317.99206924438477	26
only philosophers in one particular moment and grasp time on the basis of their	40.354305267333984	431.9430847167969	10.0	317.9900550842285	26
own personal issues that depend on their own life stories and status. While	40.354305267333984	443.4430847167969	10.0	317.98608779907227	26
time is thought of as a ‘dilation of the soul’ by St Augustine or as an ‘intimate	40.354305267333984	454.9430847167969	10.0	317.98617935180664	26
consciousness’ by Husserl, it is a space of possibilities and action projects for	40.354305267333984	466.4430847167969	10.000007629394531	317.99609756469727	26
Heidegger (1927/1986). According to Heidegger, ‘authentic’ time is the open-	40.354305267333984	477.9430847167969	10.0	317.9910011291504	26
ended time of projects; it is the characteristic of human reality to be projected	40.354305267333984	489.4430847167969	10.0	318.0050392150879	26
before one’s own situation. Our relation to time is determined by the tragic fate	40.354305267333984	500.9430847167969	10.0	318.00012588500977	26
of our personal future and the awareness that our future’s limitation, that is, of	40.354305267333984	512.443115234375	10.0	318.00207901000977	26
the more or less 700,000 hours theoretically at our disposal. ‘Authentic time’ is	40.354305267333984	523.943115234375	9.999996185302734	317.9861183166504	26
370	48.0	32.74774169921875	9.0	13.5	27
TIME & SOCIETY 16(2/3)	158.2447052001953	32.7476806640625	9.0	97.51118469238281	28
not constructed by the individual alone but is rather the result of his/her aware-	48.0	50.943115234375	10.0	317.9999084472656	29
ness of his/her own death: human existence is finite and it is precisely the	48.0	62.443115234375	10.0	317.9880676269531	29
‘anticipation of one’s own finiteness’, the co-presence of death – source of	48.0	73.943115234375	9.999969482421875	317.99591064453125	29
existential anxiety – that reveals the future, a temporal perspective full of possi-	48.0	85.44308471679688	10.0	317.99505615234375	29
bilities and plans. French philosopher Marcel Conche (1980: 71) wrote: ‘Death	48.0	96.94308471679688	10.0	317.9940185546875	29
is my fate. So be it. I anticipate it. I refuse to wait until time passes and let the	48.0	108.44308471679688	10.0	317.99017333984375	29
future come to me. I anticipate the future; I decide what it will be; I determine it’	48.0	119.94308471679688	10.0	318.0099792480469	29
(author’s translation). Confronted with the ‘destined power’ of time, several	48.0	131.44308471679688	10.0	318.00201416015625	29
reactions are possible. Conche suggests that there are several types of illusions	48.0	142.94308471679688	10.0	317.9949951171875	29
that make it possible to forget about one’s mortality: the ‘religious illusion’	48.0	154.44308471679688	10.0	318.0001220703125	29
opens up the hope of life after death; the ‘moral illusion’ awards hope of	48.0	165.94308471679688	10.0	317.9930419921875	29
eternity on the basis of merit; the ‘social illusion’ works, thanks to prestige,	48.0	177.44308471679688	10.0	317.99713134765625	29
fame, consideration and glory; the ‘ontological illusion’ relies on possessions	48.0	188.94308471679688	10.0	317.9911804199219	29
and the ‘apparent consistency of reality’ (author’s translation); finally, with the	48.0	200.44308471679688	10.0	317.99810791015625	29
‘practical illusion’, oblivion is granted, thanks to action: by focusing on my task,	48.0	211.94308471679688	10.0	317.9891357421875	29
action makes me forget my own mortality. Thus, from a metaphysical point of	48.0	223.44308471679688	10.0	317.9901428222656	29
view, death awareness is not only a cornerstone of our awareness of time, but it	48.0	234.94308471679688	10.0	317.9950256347656	29
also generates behaviours aiming at supporting or abolishing finiteness.	48.0	246.44308471679688	10.0	286.28912353515625	29
Personal future: From life space to death anxiety	48.0	274.8804016113281	10.0	208.53201293945312	30
Ever since Lewin, the personal future is considered as a possible extension of	48.0	292.4430847167969	10.0	317.99505615234375	31
one’s life space. Lewin writes that life space is extended during what he calls	48.0	303.9430847167969	10.0	317.998046875	31
‘the psychological time dimension’. The psychological time dimension of one’s	48.0	315.4430847167969	10.0	317.99407958984375	31
life space increases from hours, days and months up to years. In other words,	48.0	326.9430847167969	10.0	317.9830322265625	31
young children live in the immediate present. As they age, an evermore distant	48.0	338.4430847167969	10.0	317.9930419921875	31
psychological past and future affects their present behaviours. Psychologists of	48.0	349.9430847167969	10.0	317.99713134765625	31
time, such as Fraisse (1967), Nuttin (1980), Bouffard (1993), Zaleski (1997,	48.0	361.4430847167969	10.0	317.98504638671875	31
2005) have followed this approach and have shown how several different	48.0	372.9430847167969	10.0	317.9909973144531	31
dimensions of one’s personal future may affect one’s behaviour. Nuttin even	48.0	384.4430847167969	10.0	317.9960021972656	31
went so far as to create a theory of human motivation based on the notion of	48.0	395.9430847167969	10.0	317.9900817871094	31
personal future. He considers that the future is a pivotal life space, as opposed to	48.0	407.4430847167969	10.0	317.989013671875	31
the present and the past, which are of lesser importance. Several dimensions	48.0	418.9430847167969	10.0	317.9940490722656	31
structure our future. Among these dimensions, the best-known are the future	48.0	430.4430847167969	10.0	317.9961242675781	31
time perspective (FTP), the consideration of future consequence, anxiety, hope	48.0	441.9430847167969	10.0	317.99609375	31
and future-orientation. The future time perspective represents all the goals of an	48.0	453.4430847167969	10.0	318.0019836425781	31
individual, that is, ‘all future mental representations associated with an affect’	48.0	464.9430847167969	10.000007629394531	318.00897216796875	31
(Bouffard, 1993, author’s translation). There are two components in the FTP: a	48.0	476.4430847167969	10.0	317.99603271484375	31
cognitive component and an affective component. The cognitive component of	48.0	487.9430847167969	10.0	317.98309326171875	31
the FTP is made up of ‘goal objects’ (Nuttin, 1980), which are more or less	48.0	499.4430847167969	10.0	317.9920349121094	31
distant from the present. According to Lens (1993), someone whose goals are	48.0	510.943115234375	10.0	317.9890441894531	31
mainly located in the immediate future has a limited FTP, whereas someone	48.0	522.443115234375	9.999996185302734	318.00006103515625	31
URIEN: SELFLESS TIME	155.9907989501953	32.758056640625	9.0	86.72700500488281	32
371	344.8546142578125	32.7579345703125	9.0	13.5	33
whose goals extend to a distant future has an extended FTP. Moreover,	40.35430145263672	50.943115234375	10.0	317.9870071411133	34
Strathman et al. (1994) developed a new dimension, the consideration of future	40.35430145263672	62.443115234375	10.0	317.9900894165039	34
consequences (CFC), which deals with ‘the extent to which individuals think	40.35430145263672	73.943115234375	9.999969482421875	317.9861526489258	34
about the relatively immediate versus distant consequences of their potential	40.35430145263672	85.44308471679688	10.0	317.9990921020508	34
actions’. As for the affective dimension of the FTP, it corresponds to one’s	40.35430145263672	96.94308471679688	10.0	317.9971389770508	34
