Historical Social Research, Vol. 31 — 2006 — No. 3, 107-126	128.6999969482422	114.521728515625	7.97998046875	199.59654235839844	0
Hülya’s Migration to Germany as Self-Sacrifice	145.74000549316406	148.76593017578125	13.97998046875	269.42958068847656	1
Undergone and Suffered in Love for Her Parents, and	130.19984436035156	164.90582275390625	13.97998046875	300.53501892089844	2
Her Later Biographical Individualisation.	164.6409454345703	180.985595703125	13.97998046875	231.7017059326172	2
Biographical Problems and Biographical Work of	141.12100219726562	197.06536865234375	13.97998046875	278.73321533203125	2
Marginalisation and Individualisation of a Young	141.84097290039062	213.20526123046875	13.97998046875	277.25274658203125	3
Turkish Woman in Germany	199.8607635498047	229.2850341796875	13.97998046875	161.32081604003906	3
Fritz Schütze	246.0	267.12957763671875	12.0	62.98681640625	4
∗	311.0396728515625	264.2928466796875	7.98004150390625	3.989990234375	5
Abstract: After asking what is typical or general in the life	165.5399932861328	292.5828857421875	9.5115966796875	229.91847229003906	6
history of Hülya as a migrant worker in Germany and what	165.5399932861328	304.134521484375	9.48004150390625	229.81980895996094	7
is exceptional or unique (Section 1) the biographical proc-	165.5399932861328	315.59490966796875	9.48004150390625	229.84446716308594	8
esses of her life history up to the most central episodes of	165.5399932861328	327.114990234375	9.480010986328125	229.85865783691406	9
her conventional and estranging pre-arranged marriage and	165.5399932861328	338.6351013183594	9.47998046875	229.88148498535156	10
her way out of it through divorce after having stayed in	165.5399932861328	350.095458984375	9.47998046875	229.89756774902344	11
Germany for several years will be delineated (Section 2).	165.5399932861328	361.61553955078125	9.47998046875	229.82359313964844	12
Before reaching this turning point Hülya not only undergoes	165.5399932861328	373.1356201171875	9.47998046875	230.03501892089844	13
the “common” type trajectory of a migrant worker—the tra-	165.5399932861328	384.5959777832031	9.47998046875	229.80845642089844	14
jectory of being a cultural stranger, of being void of lan-	165.5399932861328	396.1160583496094	9.47998046875	229.76197814941406	15
guage, of being exploited by hardest sorts of work—, but, in	165.5399932861328	407.6361389160156	9.47998046875	229.9544219970703	16
addition, her personal biographical development is retarded	165.5399932861328	419.09649658203125	9.47998046875	229.9231719970703	17
by the exceptional, but probably not totally untypical ex-	165.5399932861328	430.6165771484375	9.47998046875	229.8662872314453	18
perience of being trapped within a situation of compulsory	165.5399932861328	442.13665771484375	9.47998046875	229.8652801513672	19
labour (resembling slave labour). For a long time she also	165.5399932861328	453.5970153808594	9.47998046875	229.8643341064453	20
feels obliged to remain in her trajectory position of an iso-	165.5399932861328	465.1170959472656	9.47998046875	229.89186096191406	21
lated migrant worker, since originally she had mainly meant	165.5399932861328	476.6371765136719	9.47998046875	229.92027282714844	22
to go to Germany in order to support her poverty stricken	165.5399932861328	488.0975341796875	9.47998046875	229.98570251464844	23
∗ Address all communications to: Fritz Schütze, Institut für Soziologie, Otto-von-Guericke-	128.6999969482422	512.1572265625	10.806915283203125	303.48130798339844	24
Universität, Postfach 41 20, 39016 Magdeburg, Germany; e-mail: mail@fritz-schuetze.de.	137.21975708007812	524.2242431640625	7.980010986328125	289.20635986328125	24
Revised version of: Schütze, Fritz (2003, November). Hülya’s Migration to Germany as	137.21974182128906	533.4642333984375	7.980010986328125	295.1092071533203	24
Self-Sacrifice Undergone and Suffered in Love for Her Parents, and Her Later Biographical	137.21974182128906	542.6444091796875	7.980010986328125	295.1864776611328	24
Individualisation. Biographical Problems and Biographical Work of Marginalisation and	137.21975708007812	551.82470703125	7.980010986328125	295.04931640625	24
Individualisation of a Young Turkish Woman in Germany. Part I [33 paragraphs]. Forum	137.2189483642578	561.042236328125	8.002471923828125	295.1418914794922	24
Qualitative Sozialforschung / Forum: Qualitative Social Research [On-line Journal], 4(3),	137.21893310546875	570.2225341796875	8.002349853515625	294.9750671386719	24
Art. 23. Available at: http://www.qualitative-research.net/fqs-texte/3-03/3-03schuetze-e.htm.	137.21890258789062	579.4251098632812	7.9799957275390625	288.8863525390625	24
Author’s note: I was not participant of the earlier discussions of the interview with Hülya,	137.2188720703125	588.6651611328125	7.9799957275390625	295.09320068359375	24
and I did not read the other contributions yet in order not to get influenced in my own	137.2188720703125	597.8453369140625	7.9799957275390625	295.09796142578125	24
analysis.	137.2188720703125	607.0255126953125	7.9799957275390625	27.706558227539062	24
107	273.3596496582031	626.094482421875	9.480010986328125	14.220001220703125	25
family back in Turkey with her earnings. Partly based on	165.53982543945312	115.31494140625	9.48004150390625	229.97064208984375	26
the fear that she will get self-alienated and “petrified” like	165.53982543945312	126.83502197265625	9.48004150390625	229.88137817382812	26
the older women with whom she dwells and works together	165.53982543945312	138.29541015625	9.48004150390625	229.82830810546875	26
Hülya accepts a pre-arranged marriage (probably mainly	165.53982543945312	149.81549072265625	9.48004150390625	229.81881713867188	26
negotiated by her mother) as the only way out of her pre-	165.53982543945312	161.3355712890625	9.48004150390625	229.95916748046875	26
dicament. But willy-nilly Hülya must learn that she—alrea-	165.53982543945312	172.79595947265625	9.48004150390625	229.96395874023438	26
dy embarked on her way to an individualized and emanci-	165.53982543945312	184.3160400390625	9.48004150390625	229.88613891601562	26
pated existence—cannot live in such a superimposed	165.53982543945312	195.83612060546875	9.48004150390625	229.90225219726562	26
arrangement, and therefore she distances herself from her	165.53982543945312	207.2965087890625	9.48004150390625	229.8387451171875	26
husband through the biographical escape action schemes	165.53982543945312	218.81658935546875	9.48004150390625	229.92507934570312	26
first of returning to Germany alone and then of pushing	165.53982543945312	230.336669921875	9.48004150390625	229.87481689453125	26
ahead her divorce.	165.53982543945312	241.79705810546875	9.48004150390625	69.96429443359375	26
1. Introduction: Common and Unique Features of Hülya’s	129.5399932861328	277.42169189453125	13.02001953125	301.82838439941406	27
Life History	248.5193634033203	292.36212158203125	13.02001953125	63.97770690917969	27
-	140.0399932861328	550.384033203125	7.980010986328125	2.6573333740234375	28
The interview with Hülya shows numerous aspects of life histories of Turkish	128.6999969482422	319.194580078125	9.48004150390625	303.4821319580078	29
migrant workers coming to Germany, which we consider as typical for the	128.6999969482422	330.7146911621094	9.47998046875	303.5542449951172	29
organised work migration to Germany in the sixties and early seventies. But it	128.6999969482422	342.2347717285156	9.47998046875	303.6111297607422	29
also shows features, which are unique and outstanding. Common structural	128.6999969482422	353.69512939453125	9.47998046875	303.68223571777344	29
features are, for example, the institutional processing of the workers by the	128.6999969482422	365.2152099609375	9.47998046875	303.5846405029297	29
recruiting, examination and selection strategies in Turkey and the intake and	128.70001220703125	376.73529052734375	9.47998046875	303.6054992675781	29
exploitation strategies by German firms (in Germany). Of course, all of these	128.70001220703125	388.1956481933594	9.47998046875	303.59881591796875	29
structural features are connected with deep experiences of extended suffering:	128.70001220703125	399.7157287597656	9.47998046875	303.60552978515625	29
of being dehumanised by the selection and intake procedures; of being alien-	128.70001220703125	411.2358093261719	9.47998046875	303.6842041015625	29
ated by not understanding the language and culture of Germany; of being her-	128.70001220703125	422.6961669921875	9.47998046875	303.6158142089844	29
metically isolated; of being the despicable marginalized stranger, who doesn’t	128.70001220703125	434.21624755859375	9.47998046875	303.6376953125	29
understand anything of importance to Germans; of being emotionally and mor-	128.70001220703125	445.736328125	9.47998046875	303.58270263671875	29
ally disoriented by being a cultural hybrid; of doing hard industrial work which	128.70001220703125	457.1966857910156	9.47998046875	303.63201904296875	29
one is not used to yet; of feeling estranged from oneself; of getting sick by	128.70001220703125	468.7167663574219	9.47998046875	303.6093444824219	29
exhaustion; etc.—But there are some other features in the interview with Hülya	128.70001220703125	480.2368469238281	9.47998046875	303.5951843261719	29
that are not as common as the just mentioned features. These other features	128.70001220703125	491.69720458984375	9.47998046875	303.6150207519531	29
include:	128.6999969482422	503.21728515625	9.47998046875	30.551193237304688	29
-	140.0399932861328	515.884033203125	7.980010986328125	2.6573333740234375	29
Hülya comes to Germany in 1972, when she is extremely young (she	158.0399932861328	514.7344970703125	9.47998046875	274.1719207763672	30
just turns 17 years old, and she still is almost a child at the time of her	158.0399932861328	526.19482421875	9.47998046875	274.20713806152344	30
arrival);	158.0399932861328	537.7149658203125	9.47998046875	30.595748901367188	30
Hülya is a young woman, who migrates to Germany all by herself; and	158.0399932861328	549.2344970703125	9.47998046875	274.2458953857422	30
she continues to stay alone as a marginalized person during the entire	158.0399932861328	560.69482421875	9.47998046875	274.19566345214844	30
fourteen-year period of her work and residence in Germany up to the	158.0399932861328	572.2149658203125	9.47998046875	274.29151916503906	30
time of the interview;	158.0399932861328	583.7349853515625	9.480010986328125	82.06929016113281	30
108	273.3596496582031	626.094482421875	9.480010986328125	14.220001220703125	31
- for one year—i.e., in her first year in Germany, when she is on contract	140.0399932861328	115.3145751953125	9.48004150390625	292.2422332763672	32
work in a slaughter house for chicken—her work reveals not just the	158.0399932861328	126.83465576171875	9.48004150390625	274.24781799316406	32
normal type of exploitation and estrangement features of the underpri-	158.0399932861328	138.2950439453125	9.48004150390625	274.2335968017578	32
vileged migrant worker’s occupational situation in general, but, in	158.0399932861328	149.81512451171875	9.48004150390625	274.29612731933594	32
addition, the features of compulsory work as typical for concentration	158.0399932861328	161.335205078125	9.48004150390625	274.23362731933594	32
camp or slave labour organisations. This might be closely connected to	158.0399932861328	172.79559326171875	9.48004150390625	274.23924255371094	32
her biographical condition of being an inexperienced, shy and very	158.0399932861328	184.315673828125	9.48004150390625	274.2999725341797	32
young woman, who does not speak the language and from whom, there-	158.0399932861328	195.83575439453125	9.48004150390625	274.21937561035156	32
fore, the employer and his plant organisation do not expect any type of	158.0399932861328	207.296142578125	9.48004150390625	274.28102111816406	32
systematic resistance;	158.0399932861328	218.81622314453125	9.48004150390625	82.53477478027344	32
- nevertheless: during her long stay in Germany, Hülya emancipates her-	140.0399932861328	230.33453369140625	9.48004150390625	292.2355499267578	32
self from her rural family background and dares to speak for herself and	158.0399932861328	241.794921875	9.48004150390625	274.37294006347656	32
thereby overcomes a disastrous biographical crisis situation; she ac-	158.0399932861328	253.31500244140625	9.48004150390625	274.2202911376953	32
quires an emancipated and individualized personal identity;	158.0399932861328	264.8350830078125	9.48004150390625	226.38804626464844	32
- but most important is the following extraordinary feature: Hülya’s in-	140.0399932861328	276.2945556640625	9.48004150390625	292.1786651611328	32
tention to come to Germany is linked to an unbearable material con-	158.0399932861328	287.81463623046875	9.48004150390625	274.1964874267578	32
dition in which her family lives. She attempts to free her family from	158.0399932861328	299.334716796875	9.48004150390625	274.2828826904297	32
the burden to care for her as the dependent youngest daughter, and, in	158.0399932861328	310.79510498046875	9.48004150390625	274.2592010498047	32
addition, she even intends to help her mother, father, and siblings—in	158.0399932861328	322.315185546875	9.480010986328125	274.2363739013672	32
so far as they are still dependent—out of their poverty-related	158.0399932861328	333.8352966308594	9.47998046875	274.32933044433594	32
predicament and of humiliating dependence on her oldest brother (who	158.0399932861328	345.295654296875	9.47998046875	274.3910369873047	32
took over the family household) by earning enough money in Germany	158.0399932861328	356.81573486328125	9.47998046875	274.22218322753906	32
to support the family.	158.0399932861328	368.3358154296875	9.47998046875	81.8209228515625	32
Putting the common and the unique features of the life history of Hülya to-	140.04031372070312	379.7961730957031	9.47998046875	292.1489562988281	32
gether: Hülya develops an attitude regarding the course of her marginalisation	128.70033264160156	391.3162536621094	9.47998046875	303.5752410888672	32
and cultural hybridisation, which shows many features of productive individu-	128.70033264160156	402.8363342285156	9.47998046875	303.5542755126953	32
alisation. The question is how Hülya would acquire her remarkable competen-	128.70033264160156	414.29669189453125	9.47998046875	303.6963653564453	32
cies for individualizing biographical work taking into regard all the disastrous	128.70033264160156	425.8167724609375	9.47998046875	303.6244354248047	32
difficulties of her life history.	128.70033264160156	437.33685302734375	9.47998046875	112.18534851074219	32
2. Biographical Processes in the Life History of Hülya.	137.52000427246094	472.90167236328125	13.019989013671875	285.97654724121094	33
Biographical Processes up to the Life Episodes of a Pre-	134.03976440429688	487.8421325683594	13.019989013671875	292.78204345703125	33
arranged Marriage and the Way out of it Through Divorce	129.05960083007812	502.8424377441406	13.019989013671875	302.8738708496094	33
In order to understand the mixture of uniqueness and common features in	128.6999969482422	529.6744995117188	9.47998046875	303.5922088623047	34
Hülya’s life history that is mainly patterned by her work migration to Germany,	128.6999969482422	541.1348876953125	9.47998046875	303.61878967285156	34
it is necessary to briefly recapitulate the biographical processes and the most	128.6999969482422	552.6549072265625	9.47998046875	303.45579528808594	34
important phases of these biographical processes in her life history. This short-	128.6999969482422	564.175048828125	9.47998046875	303.47569274902344	34
ened version of her biography is methodically grounded on the analytical pro-	128.6999969482422	575.6353759765625	9.47998046875	303.54576110839844	34
cedures of text sort analysis, structural description, and analytical abstraction	128.6999969482422	587.155517578125	9.480010986328125	303.5515594482422	34
(SCHÜTZE 1983, 1984). Text sort analysis looks at the features of ongoing	128.6999969482422	598.6755981445312	9.479995727539062	303.62355041503906	34
109	273.3596496582031	626.094482421875	9.4800
interaction in the interview situation and at the differential involvement of the	128.69960021972656	115.31494140625	9.48004150390625	303.58656311035156	36
communicative schemes of narration, description and argumentation in the	128.69960021972656	126.83502197265625	9.48004150390625	303.6225128173828	36
informant’s follow-up of the line of rendering of her or his personal experi-	128.69960021972656	138.29541015625	9.48004150390625	303.54200744628906	36
ences. Of particular interest in this stage of analysis are background construc-	128.69960021972656	149.81549072265625	9.48004150390625	303.50978088378906	36
tions (SCHÜTZE 1992, 2001a), which deal with disorderly chunks of bio-	128.69960021972656	161.3355712890625	9.48004150390625	303.6908721923828	36
graphical experience, and argumentative commentaries (SCHÜTZE 1987,	128.69960021972656	172.79595947265625	9.48004150390625	303.57420349121094	36
1991a), which express biographical work of the informant. Structural descrip-	128.69960021972656	184.3160400390625	9.48004150390625	303.56373596191406	36
tion is the analytical procedure, by which the unfolding of the story telling in	128.69960021972656	195.83612060546875	9.48004150390625	303.59886169433594	36
its formal textual features is articulated1 and at the same time the unfolding of	128.69960021972656	205.4615478515625	11.31500244140625	303.62892150878906	36
biographical processes is sequentially followed up and delineated (SCHÜTZE	128.70025634765625	218.81463623046875	9.48004150390625	303.6263732910156	36
1981, 1984, 1991, 1994, 1995, 2001b). Most important is the analytical activity	128.7002716064453	230.334716796875	9.48004150390625	303.56947326660156	36
of “pragmatic breaching”, which envisions the formal and substantive features	128.70025634765625	241.79510498046875	9.48004150390625	303.6453552246094	36
of the autobiographical text as expressions of a recapitulation of re-enacting or	128.70025634765625	253.315185546875	9.48004150390625	303.50408935546875	36
even “re-enlivening” (formerly) evolving biographical process structures that	128.70025634765625	264.83526611328125	9.48004150390625	303.5780029296875	36
the informant has been involved in. One basic step in the analytical abstraction	128.70025634765625	276.295654296875	9.48004150390625	303.61785888671875	36
is the integrated follow-up of the sequential order and/or simultaneous conflict	128.70025634765625	287.81573486328125	9.48004150390625	303.5969543457031	36
of the supra-segmental units of the narrative text; these lump together narrative	128.70025634765625	299.3358154296875	9.48004150390625	303.6387023925781	36
units into integrated biographical contexts that reveal stretched-out biographi-	128.70025634765625	310.79620361328125	9.48004150390625	303.6726989746094	36
cal process structures. The aim is to reach an empirically grounded concept of	128.70025634765625	322.3162841796875	9.480010986328125	303.6329345703125	36
the overall biographical structuring of the whole life history as told in the auto-	128.70025634765625	333.8363952636719	9.47998046875	303.5770568847656	36
biographical narrative interview (SCHÜTZE 1981, 1991, 1994, 2001a). In this	128.70025634765625	345.2967529296875	9.47998046875	303.6263427734375	36
following article a full application of the analytical apparatus cannot be articu-	128.70025634765625	356.81683349609375	9.47998046875	303.55322265625	36
lated. However, I articulate my understanding of the overall biographical struc-	128.70025634765625	368.3369140625	9.47998046875	303.6547546386719	36
turing of Hülya’s life history by lumping together the narrative units of Hülya’s	128.70025634765625	379.7972717285156	9.47998046875	303.565673828125	36
narrative. I use the supra-segmental sequential organization of Hülya’s overall	128.70025634765625	391.3173522949219	9.47998046875	303.5675354003906	36
autobiographical narrative as a guide. But this is only possible on the base of a	128.70025634765625	402.8374328613281	9.47998046875	303.6709289550781	36
meticulous segmentation of the entire text into local narrative units or it would	128.70025634765625	414.29779052734375	9.47998046875	303.5798645019531	36
be impossible to differentiate between segmental und supra-segmental units. In	128.70025634765625	425.81787109375	9.47998046875	303.6101989746094	36
addition, it would be impossible to appreciate the vague or even “oblique”	128.70025634765625	437.33795166015625	9.47998046875	303.5306091308594	36
ways of textual rendering of disorderly and hurting experiences, which she	128.70025634765625	448.7983093261719	9.47998046875	303.5902404785156	36
specifically expressed through background constructions dealing with her pre-	128.70025634765625	460.3183898925781	9.47998046875	303.49652099609375	36
arranged marriage and her divorce.	128.70025634765625	471.8384704589844	9.47998046875	133.150390625	36
2.1. The family trap (ll.122-154)	205.55999755859375	500.9311218261719	11.519989013671875	149.83486938476562	37
In the beginning of Hülya’s life history there is her family’s collective trajec-	128.6999969482422	520.3145751953125	9.47998046875	303.62355041503906	38
tory of being unable to autonomously support itself. Hülya’s parents do not	128.6999969482422	531.834716796875	9.47998046875	303.5902557373047	38
have the capacity to give a proper education to three of five children, still de-	128.6999969482422	543.2950439453125	9.47998046875	303.64341735839844	38
1 These include narrative units, sub-segmental phenomena (like background constructions	128.6999969482422	569.0631103515625	9.160919189453125	303.69798278808594	39
and descriptive detailing) and supra-segmental meta-units of sequential biographical con-	137.2201690673828	579.4242553710938	7.9799957275390625	295.13706970214844	39
texts dealing with biographical process structures (like biographical action schemes, bio-	137.22015380859375	588.664306640625	7.9799957275390625	295.1108093261719	39
graphical trajectories of suffering, biographical processes of identity metamorphosis and the	137.2201690673828	597.844482421875	7.9799957275390625	295.2080535888672	39
pursuit of institutional expectation patterns of the life course).	137.2201690673828	607.024658203125	7.9799957275390625	197.9111785888672	39
110	273.3596496582031	626.094482421875	9.480010986328125	14.220001220703125	40
pendent on their support. Hülya’s father became severely ill, fell into unem-	128.69960021972656	115.31494140625	9.48004150390625	303.6575469970703	41
ployment, and has not worked since. He was not able to uphold his own house-	128.69960021972656	126.83502197265625	9.48004150390625	303.54676818847656	41
hold, because he did not have health or invalidity insurance. Instead, the oldest	128.69960021972656	138.29541015625	9.48004150390625	303.59693908691406	41
son took over, and he now controls the household budget covering all depend-	128.69960021972656	149.81549072265625	9.48004150390625	303.5269012451172	41
ant family members (including his father and mother). This might be a typical	128.69960021972656	161.3355712890625	9.48004150390625	303.5969696044922	41
intergenerational relationship in a rural society with patrilocal succession	128.69960021972656	172.79595947265625	9.48004150390625	303.55149841308594	41
(which goes back to ancient times). The oldest daughter is an exception to the	128.69960021972656	184.3160400390625	9.48004150390625	303.5609588623047	41
difficult situation in which other family members live: she married a well-to-do	128.69960021972656	195.83612060546875	9.48004150390625	303.63206481933594	41
farmer. Hülya’s family including herself took the opportunity to work on the	128.69960021972656	207.2965087890625	9.48004150390625	303.64158630371094	41
farm of the rich son in law during the summer season of harvest.	128.69960021972656	218.81658935546875	9.48004150390625	245.2010955810547	41
The absence of the household autonomy of Hülya’s inner family means hu-	140.03958129882812	230.336669921875	9.48004150390625	292.1535949707031	41
miliation for her father, mother, the bright youngest brother (who cannot go to	128.69960021972656	241.79705810546875	9.48004150390625	303.6909637451172	41
university), and herself. Hülya cannot get a vocational training, although she	128.69960021972656	253.317138671875	9.48004150390625	303.57139587402344	41
has been successful in school. And nobody seems to be concerned about it—	128.69960021972656	264.83721923828125	9.48004150390625	303.5420379638672	41
contrary to the concern about the educational situation of her youngest brother.	128.69960021972656	276.297607421875	9.48004150390625	303.6538543701172	41
Hülya is apparently expected to become a traditional housewife. (Later we	128.69960021972656	287.81768798828125	9.48004150390625	303.62355041503906	41
learn that Hülya’s father might possibly have had different ideas, but he had	128.69960021972656	299.3377685546875	9.48004150390625	303.6262969970703	41
been removed from his former authority position as head of the family—	128.69960021972656	310.79815673828125	9.48004150390625	303.6396942138672	41
ll.1074-1077.) In the early days of her life Hülya identifies intensely with her	128.69960021972656	322.3182373046875	9.480010986328125	303.57423400878906	41
mother, who cannot reign her own household and, hence, is unable to function	128.69960021972656	333.8383483886719	9.47998046875	303.66810607910156	41
properly as a traditional housewife and mother. She suffers a lot and seems to	128.69960021972656	345.2987060546875	9.47998046875	303.53150939941406	41
be emotionally quite unstable. Hülya doesn’t see any future perspective for her	128.69960021972656	356.81878662109375	9.47998046875	303.6063995361328	41
