mother, for her father, for her brother and for herself. She witnesses the mal-	128.69960021972656	368.3388671875	9.47998046875	303.65098571777344	41
functioning or even deterioration of the traditional rural family system in Tur-	128.6995849609375	379.7992248535156	9.47998046875	303.631103515625	41
key. It does not fit the modern requirements for the development of autono-	128.6995849609375	391.3193054199219	9.47998046875	303.61505126953125	41
mous, individualized biographical identities which Hülya is oriented to; her	128.6995849609375	402.8393859863281	9.47998046875	303.6510314941406	41
father’s advice probably plays an important role in this context. Taking into	128.6995849609375	414.29974365234375	9.47998046875	303.5277404785156	41
account the absence of a protecting health and unemployment insurance sys-	128.6995849609375	425.81982421875	9.47998046875	303.4708251953125	41
tem, one realises that no welfare state or civil society serves as a substitute for	128.6995849609375	437.33990478515625	9.47998046875	303.6016845703125	41
the lack of protection and social solidarity meant to derive from the traditional	128.6995849609375	448.8002624511719	9.47998046875	303.60650634765625	41
Turkish rural family system. This explains Hülya’s subsequent high apprecia-	128.6995849609375	460.3203430175781	9.47998046875	303.46331787109375	41
tion for the German system of social security produced and permanently upheld	128.6995849609375	471.8404235839844	9.47998046875	303.59979248046875	41
by state and cooperative institutions.	128.6995849609375	483.30078125	9.47998046875	139.04885864257812	41
2.2. Hülya’s biographical action scheme of work migration and	134.82000732421875	512.451171875	11.519989013671875	291.3408203125	42
of supporting her family through it (ll.156-195)	171.36029052734375	525.4710693359375	11.519989013671875	218.29019165039062	42
Hülya develops the plan not only to escape from the family trajectory of heter-	128.6999969482422	544.7944946289062	9.47998046875	303.61305236816406	43
onomous determination, of being dependent on the (probably not freely given)	128.6999969482422	556.3145751953125	9.47998046875	303.63682556152344	43
support of her very controlling oldest brother, of the humiliation of her parents	128.6999969482422	567.8346557617188	9.47998046875	303.66526794433594	43
and herself and of not having any developmental personal future for the family	128.6999969482422	579.2950439453125	9.480010986328125	303.60646057128906	43
members and herself, but also to rescue her family from its predicament. Hav-	128.6999969482422	590.8151245117188	9.479995727539062	303.67185974121094	43
ing seen Turkish guest workers in the neighbourhood coming back from West-	128.6999969482422	602.335205078125	9.480010986328125	303.60267639160156	43
111	273.3596496582031	626.094482421875	9.480010986328125	14.220001220703125	44
ern Germany during vacation times, who seem to be affluent in their life style	128.69960021972656	115.31494140625	9.48004150390625	303.66517639160156	45
(ll.145-146), Hülya at first fantasizes about and then plans to embark on a	128.69960021972656	126.83502197265625	9.48004150390625	303.63771057128906	45
labour migration to West Germany as soon as possible. Her fantasies can in	128.69960021972656	138.29541015625	9.48004150390625	303.58277893066406	45
part be ascribed to having been misled by the show-off displayed by migrant	128.69960021972656	149.81549072265625	9.48004150390625	303.57884216308594	45
workers having come home; here we therefore have the opportunity to study	128.69960021972656	161.3355712890625	9.48004150390625	303.51075744628906	45
the power of “pull” mechanisms of labour migration.	128.69960021972656	172.79595947265625	9.48004150390625	201.65184020996094	45
There are two features of Hülya’s action plan to go to West Germany as a	140.03958129882812	184.3160400390625	9.48004150390625	292.1887512207031	45
guest worker, which seem to be special. First, Hülya is the youngest child of	128.69960021972656	195.83612060546875	9.48004150390625	303.69837951660156	45
the family and it can legitimately be asked, why is she the only member of the	128.69960021972656	207.2698974609375	9.50665283203125	303.5504913330078	45
inner family who develops and pursues the plan to rescue the family through	128.70053100585938	218.81658935546875	9.48004150390625	303.6102600097656	45
labour migration? Being very young and female she seems to be the least fit	128.70053100585938	230.336669921875	9.48004150390625	303.61871337890625	45
family member for this type of rescue action—to be accomplished through hard	128.70053100585938	241.79705810546875	9.48004150390625	303.7467041015625	45
corporeal work, which is associated with cultural alienation and social isola-	128.70053100585938	253.317138671875	9.48004150390625	303.60833740234375	45
tion. Second, although Hülya painstakingly attempts to give the impression that	128.70053100585938	264.83721923828125	9.48004150390625	303.59600830078125	45
her family—especially her father and her mother—does not like to send her	128.70053100585938	276.297607421875	9.48004150390625	303.6747131347656	45
abroad, it is her father, who finally assists in the legal procedure of “making her	128.70053100585938	287.81768798828125	9.48004150390625	303.74676513671875	45
younger” to the effect that she can apply in advance to the administrative guest	128.70053100585938	299.3377685546875	9.48004150390625	303.5050048828125	45
worker program. One of her brothers—probably the eldest brother as head of	128.70053100585938	310.79815673828125	9.48004150390625	303.6178283691406	45
the family—accompanies her to Istanbul, the location of the selection process	128.70053100585938	322.3182373046875	9.480010986328125	303.64813232421875	45
in the administrative recruitment procedure for getting promising (healthy,	128.70053100585938	333.8383483886719	9.47998046875	303.5533447265625	45
bright, well educated, hard working) guest workers. He obviously is not only	128.70053100585938	345.2987060546875	9.47998046875	303.6955871582031	45
her protector and emotional supporter, but also controls her pursuit of labour	128.70053100585938	356.81878662109375	9.47998046875	303.6054992675781	45
migration. For example, he harshly criticizes her when she reacts with panic at	128.70053100585938	368.3388671875	9.47998046875	303.6044921875	45
the long needles used for drawing blood for the compulsory blood tests.	128.70053100585938	379.7992248535156	9.47998046875	272.8959655761719	45
One gets the impression that it is not just Hülya, who pushes through her	140.04051208496094	391.3193054199219	9.47998046875	292.15647888183594	45
biographical action scheme, but also that the family is indeed quite suppor-	128.70053100585938	402.8393859863281	9.47998046875	303.660400390625	45
tive—perhaps even pushy—regarding her pursuit and realisation of the plan.	128.70053100585938	414.29974365234375	9.47998046875	303.673828125	45
Though being the youngest child, she appears to be the least embedded and	128.70053100585938	425.81982421875	9.47998046875	303.6235046386719	45
least rooted within the family structure and social structure of rural Turkey; she	128.70053100585938	437.33990478515625	9.47998046875	303.59503173828125	45
therefore is the one most “available” for uprooting and migration to Germany	128.70053100585938	448.8002624511719	9.47998046875	303.62066650390625	45
(from where she serves as the supporter of the family from afar). In addition, as	128.70053100585938	460.3203430175781	9.47998046875	303.581787109375	45
the youngest child she can least be helped in getting a good education and a	128.7005157470703	471.8404235839844	9.47998046875	303.60643005371094	45
proper vocational training at a time when the material position of the family	128.7005157470703	483.30078125	9.47998046875	303.6310577392578	45
continuously deteriorates.	128.7005157470703	494.82086181640625	9.47998046875	98.13885498046875	45
2.3. The intake procedure for guest workers that Hülya is	149.0399932861328	523.97119140625	11.519989013671875	263.0097198486328	46
encountering (ll.197-258)	221.40057373046875	536.93115234375	11.519989013671875	118.22055053710938	46
Hülya undergoes the institutional procedure of being tested, examined and	128.6999969482422	556.3145751953125	9.47998046875	303.61122131347656	47
selected for “guest work” in Germany. This procedure resembles the intake	128.6999969482422	567.834716796875	9.47998046875	303.6330108642578	47
procedure of being drafted into, or incorporated within, an army—especially	128.6999969482422	579.2950439453125	9.480010986328125	303.61778259277344	47
taking into account the medical examinations and mental ability tests adminis-	128.6999969482422	590.815185546875	9.479995727539062	303.5068817138672	47
tered to the applicants. But it also shows some additional features of checking	128.6999969482422	602.335205078125	9.480010986328125	303.5856475830078	47
112	273.3596496582031	626.094482421875	9.480010986328125	14.220001220703125	48
and scrutinizing that are harsher than any army intake procedure: scrutiny	128.69960021972656	115.31494140625	9.48004150390625	303.6216278076172	49
resembling that given a horse or slave to be sold. In addition, a phase for the	128.69960021972656	126.83502197265625	9.48004150390625	303.54673767089844	49
presentation of the work to be done in Germany and for the signing of the	128.69960021972656	138.29541015625	9.48004150390625	303.5807647705078	49
contract is built into the institutional selection procedure for guest workers, for	128.69960021972656	149.81549072265625	9.48004150390625	303.58750915527344	49
example, for activities of advertising and of formal contract reciprocity.	128.69960021972656	161.3355712890625	9.48004150390625	272.81166076660156	49
The selection and contract procedures are formally controlled by the na-	140.03958129882812	172.79595947265625	9.48004150390625	292.2077331542969	49
tional Turkish work administration agency. But they seem to be more effec-	128.69960021972656	184.3160400390625	9.48004150390625	303.7163848876953	49
tively moulded by the interests and interventions of German firms that plan to	128.69960021972656	195.83612060546875	9.48004150390625	303.70787048339844	49
hire Turkish personnel. Two facts reveal the low efficacy of official Turkish	128.69960021972656	207.2965087890625	9.48004150390625	303.53819274902344	49
control during the intake procedure and later on (when Hülya has worked in	128.69960021972656	218.81658935546875	9.48004150390625	303.5854949951172	49
Germany for some time). First, Hülya had just turned seventeen when she	128.69960021972656	230.336669921875	9.48004150390625	303.62632751464844	49
underwent the selection and intake procedure and her age is not checked care-	128.69960021972656	241.79705810546875	9.48004150390625	303.65293884277344	49
fully. Second, the Turkish labour administration agent visiting Hülya’s firm	128.69960021972656	253.317138671875	9.48004150390625	303.5959930419922	49
(ll.390-409) does not—unlike Gogol’s “auditor”—seem to do autonomous	128.69960021972656	264.83721923828125	9.48004150390625	303.60728454589844	49
checks of the circumstances under which the Turkish labourers work and live.	128.69960021972656	276.297607421875	9.48004150390625	303.4870147705078	49
He obviously does not check if somebody of the Turkish work personnel is	128.69960021972656	287.81768798828125	9.48004150390625	303.6111602783203	49
actually missing—in this case Hülya, who is severely ill at the time (due to an	128.69960021972656	299.3377685546875	9.48004150390625	303.60081481933594	49
accident at work) and has been hidden from his eyes by being placed in a wait-	128.69960021972656	310.79815673828125	9.48004150390625	303.5932159423828	49
ing room for a whole day with the false announcement that she was seeing the	128.69960021972656	322.3182373046875	9.480010986328125	303.5524444580078	49
physician.	128.69960021972656	333.8383483886719	9.47998046875	38.789306640625	49
Generally speaking, a systematic collusion between the public Turkish la-	140.03958129882812	345.2987060546875	9.47998046875	292.1214599609375	49
bour agency and exploitative German firms apparently had been established to	128.69960021972656	356.81878662109375	9.47998046875	303.5486297607422	49
the disadvantage and detriment of the selected and hired guest workers.	128.69960021972656	368.3388671875	9.47998046875	271.51478576660156	49
2.4. The biographical trajectory of compulsory labour	156.89999389648438	397.43121337890625	11.519989013671875	247.227294921875	50
(ll.260-409)	252.8397216796875	410.45111083984375	11.519989013671875	55.3282470703125	50
During her first year in Germany, Hülya is trapped within the dynamics of a	128.6999969482422	429.8345947265625	9.47998046875	303.60069274902344	51
prisoner’s or slave worker’s trajectory of confinement and forced labour. When	128.6999969482422	441.2949523925781	9.47998046875	303.6177520751953	51
Hülya arrives at Germany, she experiences not only the normal type of immi-	128.6999969482422	452.8150329589844	9.47998046875	303.5665740966797	51
gration trajectory (RIEMANN & SCHÜTZE 1991) but also the much harsher	128.6999969482422	464.3351135253906	9.47998046875	303.6131134033203	51
ones of confinement and compulsory labour.	128.6999969482422	475.79547119140625	9.47998046875	169.99253845214844	51
In Hülya’s case, the normal type of an immigrant’s trajectory means that for	140.03997802734375	487.3155517578125	9.47998046875	292.15179443359375	51
a certain while she would not be able to proceed under the auspices of her	128.6999969482422	498.83563232421875	9.47998046875	303.62071228027344	51
biographical action scheme of labour migration—earning surplus money in	128.6999969482422	510.2960205078125	9.47998046875	303.5096893310547	51
support of her family back home in Turkey. Or more generally speaking, in the	128.6999969482422	521.8160400390625	9.47998046875	303.63490295410156	51
course of a normal immigration trajectory expectation patterns—following up	128.6999969482422	533.336181640625	9.47998046875	303.52772521972656	51
the action scheme of establishing oneself within the new life situation in a	128.6999969482422	544.7965087890625	9.47998046875	303.5419464111328	51
circumspect way, earning “real money”, and improving by this one’s own	128.6999969482422	556.3165893554688	9.47998046875	303.6205291748047	51
material life situation—are impaired or even eliminated for a while. This is so,	128.6999969482422	567.836669921875	9.47998046875	303.58738708496094	51
since everything within the new life situation turns out to be different from how	128.6999969482422	579.2969970703125	9.480010986328125	303.6871795654297	51
it had been expected prior to the journey and immigration. The experience of	128.6999969482422	590.817138671875	9.479995727539062	303.6300506591797	51
being culturally and socially strange to the new life situation, that is, of having	128.6999969482422	602.3372802734375	9.480010986328125	303.6471710205078	51
113	273.3596496582031	626.094482421875	9.480010986328125	14.220001220703125	52
to live and proceed under conditions that are unknown, would for a while	128.69960021972656	115.31494140625	9.48004150390625	303.5884246826172	53
overwhelm and impair the immigrant’s capacity to follow up her or his own	128.69960021972656	126.83502197265625	9.48004150390625	303.58363342285156	53
line of intentions and orientations by circumspect action. For a while, the im-	128.69960021972656	138.29541015625	9.48004150390625	303.63966369628906	53
migrant would only be able to react to the overpowering conditions of the	128.69960021972656	149.81549072265625	9.48004150390625	303.55906677246094	53
strange, very urging new life predicament. For example, she or he would be	128.69960021972656	161.3355712890625	9.48004150390625	303.5618438720703	53
forced to follow up the conditional relevancies of the new situation with its	128.69960021972656	172.79595947265625	9.48004150390625	303.6262664794922	53
unexpected necessities. At the same time the immigrant would also be isolated	128.69960021972656	184.3160400390625	9.48004150390625	303.5420379638672	53
socially. Especially due to the language barrier, she or he would not be able to	128.69960021972656	195.83612060546875	9.48004150390625	303.6035614013672	53
communicate with others and would feel alone. In addition, she or he would be	128.69960021972656	207.2965087890625	9.48004150390625	303.6263885498047	53
disoriented by the falsification of her or his own cultural and social expectation	128.69960021972656	218.81658935546875	9.48004150390625	303.54200744628906	53
patterns brought into the new cultural and social situation (SCHÜTZ 1964a).	128.69960021972656	230.336669921875	9.48004150390625	303.5989227294922	53
The immigrant would feel self-alienated by her or his incapacity to follow up	128.69960021972656	241.79705810546875	9.48004150390625	303.6168975830078	53
former intentions.	128.69960021972656	253.317138671875	9.48004150390625	68.09199523925781	53
Then, in the course of the normal type of immigration trajectory, the immi-	140.03958129882812	264.83721923828125	9.48004150390625	292.1480407714844	53
grant would need some time to learn the ropes of the new social and cultural	128.69960021972656	276.297607421875	9.48004150390625	303.62635803222656	53
situation—acquiring the language, managing to get in contact with others,	128.69960021972656	287.81768798828125	9.48004150390625	303.59214782714844	53
communicating with them, and understanding the regulations, conditions and	128.69960021972656	299.3377685546875	9.48004150390625	303.6946258544922	53
action possibilities of the new life and labour situation. All of this would be	128.69960021972656	310.79815673828125	9.48004150390625	303.5675506591797	53
quite difficult initially. But after some time, the immigrant would be able to re-	128.69960021972656	322.3182373046875	9.480010986328125	303.6566925048828	53
cover her or his own action capacities for following up the old overall action	128.69960021972656	333.8383483886719	9.47998046875	303.63771057128906	53
scheme of earning surplus money and to improve her situation. For example,	128.69960021972656	345.2987060546875	9.47998046875	303.65379333496094	53
Hülya could really start to support her family in Turkey, and in addition to this	128.69960021972656	356.81878662109375	9.47998046875	303.6870880126953	53
she could develop a new biographical action scheme (e.g., to establish her own	128.69960021972656	368.3388671875	9.47998046875	303.6424102783203	53
autonomous existence in Germany). Of course, to a certain extent, she would	128.69960021972656	379.7992248535156	9.47998046875	303.6974639892578	53
remain a cultural stranger. She still would compare her old cultural expecta-	128.69960021972656	391.3193054199219	9.47998046875	303.6272735595703	53
tions with the new cultural orientations that she has learned in between	128.69960021972656	402.8393859863281	9.47998046875	303.59413146972656	53
(SCHÜTZ 1964a, 1964b). But as such an “enculturated” stranger she surely	128.69960021972656	414.29974365234375	9.47998046875	303.72401428222656	53
would be able to act autonomously again. In addition, as a cultural hybrid	128.69960021972656	425.81982421875	9.47998046875	303.63966369628906	53
(BHABHA 1994) she increasingly would envision certain opportunities for	128.69960021972656	437.33990478515625	9.47998046875	303.57322692871094	53
orientation, reflection, deliberation and action that are not open to autochtho-	128.69960021972656	448.8002624511719	9.47998046875	303.70985412597656	53
nous members of the immigrant receiving German society. On the other hand,	128.69960021972656	460.3203430175781	9.47998046875	303.62074279785156	53
she would still suffer from being positioned between the two cultures and so-	128.69960021972656	471.8404235839844	9.47998046875	303.6547393798828	53
cietal bodies as a marginal personality (STONEQUIST 1961).	128.69960021972656	483.30078125	9.47998046875	236.42454528808594	53
As mentioned above, Hülya’s new predicament of confinement and compul-	140.03958129882812	494.82086181640625	9.47998046875	292.1326599121094	53
sory labour is more severe than the normal type of life situation of an immi-	128.69960021972656	506.3409423828125	9.47998046875	303.5647430419922	53
grant. She gets deprived of her passport by having it stored in the administra-	128.69960021972656	517.80126953125	9.47998046875	303.51820373535156	53
tion bureau of the recruitment firm, and she does not receive a permit of	128.69960021972656	529.3214111328125	9.47998046875	303.59413146972656	53
residence for the whole time span of her work in the firm; her permit of resi-	128.69960021972656	540.8414306640625	9.47998046875	303.6851348876953	53
dence does not include the five days of extra work which are required from her	128.69960021972656	552.3018188476562	9.47998046875	303.6083526611328	53
after the expiry of her contract and she is not aware of the specific legal re-	128.69960021972656	563.8218994140625	9.47998046875	303.6234588623047	53
quirements, she only learns about them later on. The firm does not explain to	128.69960021972656	575.3419799804688	9.47998046875	303.69078063964844	53
the newly recruited foreign workers what their civil liberties and work rights	128.69960021972656	586.8023681640625	9.480010986328125	303.57423400878906	53
are, and nobody else—for example, the Turkish labour administration or Ger-	128.69960021972656	598.3224487304688	9.479995727539062	303.6328582763672	53
114	273.3596496582031	626.094482421875	9.480010986328125	14.220001220703125	54
man institutions such as the German labour administration, German unions,	128.69960021972656	115.31494140625	9.48004150390625	303.55519104003906	55
controlling public bodies (e.g., the Gewerbeaufsichtsämter) or representatives	128.69960021972656	126.83502197265625	9.48004150390625	303.60740661621094	55
of the German employer organisations (like the Industrie- und Handelskam-	128.69960021972656	138.29541015625	9.48004150390625	303.6244354248047	55
mer)—does this either. Hülya insinuates—and she seems to be correctly as-	128.69960021972656	149.81549072265625	9.48004150390625	303.5998077392578	55
suming—that the firm deliberately takes advantages of the ignorance of the	128.69960021972656	161.3355712890625	9.48004150390625	303.52870178222656	55
newly recruited workers, since after the year of official contract nobody likes to	128.69960021972656	172.79595947265625	9.48004150390625	303.7941436767578	55
stay in the firm, and, instead of this, the firm recruits new personnel in Turkey	128.69960021972656	184.3160400390625	9.48004150390625	303.6974334716797	55
that too is exploited and systematically deprived of its work rights and civil	128.69960021972656	195.83612060546875	9.48004150390625	303.59031677246094	55
liberties. The firm does not proceed legally, but it is remarkable that it can	128.69960021972656	207.2965087890625	9.48004150390625	303.5447235107422	55
enact these practices in such a systematic and effective manner. Striking struc-	128.69960021972656	218.81658935546875	9.48004150390625	303.6453399658203	55
tural similarities exist to slave labour in Nazi firms and concentration camps2	128.69960021972656	228.50152587890625	11.315185546875	303.6003875732422	55
or—maybe this comes closer—to prostitution into which unsuspecting young	128.70016479492188	241.794921875	9.48004150390625	303.57037353515625	55
women from Eastern Europe have been trapped who are lured and often “im-	128.70016479492188	253.31500244140625	9.48004150390625	303.5400390625	55
ported” to Western Europe.	128.70016479492188	264.8350830078125	9.48004150390625	104.50088500976562	55
Hülya has to live in a small room with four others young women in some	140.04014587402344	276.29547119140625	9.48004150390625	292.2589569091797	55
sort of army barracks situation. She has to work from six o’clock in the morn-	128.70016479492188	287.8155517578125	9.48004150390625	303.55523681640625	55
ing to ten o’clock at night: in addition to her normal work at the chicken	128.70016479492188	299.33563232421875	9.48004150390625	303.583740234375	55
slaughter house assembly line, she cleans the workplace together with three	128.70016479492188	310.7960205078125	9.48004150390625	303.69366455078125	55
other women without receiving any substantial payment. The safety regulations	128.70016479492188	322.31610107421875	9.480010986328125	303.61968994140625	55
in the factory are poorly enforced. Hülya gets injured twice, and her medical	128.70016479492188	333.8362121582031	9.47998046875	303.6073913574219	55
predicament is exacerbated by the negligence of the factory physician. In both	128.70016479492188	345.29656982421875	9.47998046875	303.5827331542969	55
2 It might be seen as an exaggeration to state structural similarities between compulsory	128.6999969482422	366.6831970214844	9.16094970703125	303.6045379638672	56
labour in a concentration camp and Hülya’s overload of work in the slaughterhouse for	137.2193603515625	377.0443420410156	7.980010986328125	295.1498718261719	56
chicken. One could argue, that Hülya always had the legal right to quit her work contract	137.2193603515625	386.2843933105469	7.980010986328125	295.0852355957031	56
and to work somewhere else or—at least—to return to Turkey without a proper annulment	137.2193603515625	395.464599609375	7.980010986328125	295.0876770019531	56
of the contract. And in fact, by physical force nobody endangered Hülya’s life at all.—But	137.2193603515625	404.6448059082031	7.980010986328125	295.07403564453125	56
on the other hand, decisive is the fact, that Hülya did not know about such alternatives. She	137.2193603515625	413.8848571777344	7.980010986328125	295.161865234375	56
mistakenly assumed that she was forced to remain in her work position in the slaughter-	137.21934509277344	423.0650634765625	7.980010986328125	294.9918670654297	56
