Engagement befördern anstatt es durch unverhältnismäßige Bürokratie zu hemmen.	70.85980224609375	551.26123046875	10.97998046875	453.46295166015625	262
Grundlegend geht es bei der Konzeption um eine „neue Verantwortungsteilung zwischen	70.85980224609375	570.221435546875	10.97998046875	453.47503662109375	262
Bürgergesellschaft und Aktivierendem Staat.“70 Die vormalige sozialdemokratische Skepsis	70.85980224609375	587.2537841796875	12.967239379882812	453.54888916015625	262
gegenüber dem aktiven Bürger wird damit zumindest reduziert und das klassische	70.86009216308594	608.2010498046875	10.979995727539062	453.50025939941406	262
sozialdemokratische Verteilungsparadigma relativiert.71 Diese Haltungen stünden auch	70.86009216308594	625.173828125	12.967483520507812	453.54530334472656	262
diametral der Idee einer aktiven Bürgergesellschaft entgegen und müssen daher	70.86007690429688	646.1210327148438	10.979995727539062	453.5310974121094	262
zwangsläufig überdacht werden, wenn man sich ernsthaft in diese Richtung öffnen möchte.	70.86007690429688	665.140625	10.979995727539062	453.6089782714844	262
66 Schröder, Gerhard (2000), Kap. V.	70.86000061035156	704.06201171875	12.324325561523438	162.7715301513672	263
67 Vgl. Mielke, Gerd (2001): S. 702.	70.86000061035156	715.5819702148438	12.324378967285154	155.47496032714844	263
68 Enquete-Kommission „Zukunft des Bürgerschaftlichen Engagements“ (2002): S. 2.	70.86000061035156	727.0419921875	12.324256896972654	374.5902862548828	263
69 FES: Leitbild Bürgergesellschaft. URL:	70.86000061035156	738.56201171875	12.324317932128904	180.58709716796875	263
http://www.fes.de/buergergesellschaft/arbeitskreis/leitbild.htm (Stand: 19.10.2009).	70.85962677001953	752.3863525390625	10.019996643066406	365.22090911865234	263
70 Ebd.	70.86000061035156	761.5419921875	12.324256896972654	30.539581298828125	263
71 Vgl. Mielke, Gerd (2001), S. 702.	70.86000061035156	773.06201171875	12.324321746826172	155.47496032714844	263
19	291.5400085449219	795.7608032226562	10.980003356933594	12.222930908203125	264
Skeptiker verlautbaren daher auch die Vermutung, der SPD gehe es zunächst gar nicht um	70.85958862304688	72.82110595703125	10.98004150390625	453.5970153808594	265
ein neues Bürgergesellschaftskonzept, das partizipatorische Impulse zwischen Staat,	70.85958862304688	91.7813720703125	10.98004150390625	453.6244201660156	265
Wirtschaft und Gesellschaft generieren soll, sondern möglicherweise eher um die	70.85958862304688	110.74163818359376	10.98004150390625	453.4827575683594	265
propagandistische Verbrämung des Abschieds von eigenen wohlfahrtsstaatlichen	70.85958862304688	129.76116943359378	10.98004150390625	453.4486999511719	265
Traditionen.72 Wahrlich ist der Umgang mit selbstständig handelnden Akteuren in einer	70.85958862304688	146.73382568359375	12.9676513671875	453.5940246582031	265
traditionellen sozialdemokratischen Denkweise komplizierter als in liberalen	70.8600082397461	167.6810302734375	10.98004150390625	453.60245513916016	265
Demokratiemodellen. Und tatsächlich bleibt die Frage nach dem Menschenbild weitgehend	70.8600082397461	186.64129638671875	10.98004150390625	453.47391510009766	265
unbeantwortet, denn bis auf den Verweis auf die notwendige Neuverteilung von Aufgaben	70.8600082397461	205.6015625	10.98004150390625	453.55631256103516	265
und Rechten zwischen Staat, Wirtschaft, bürgerschaftlichen Organisationen und	70.86001586914062	224.62109375	10.98004150390625	453.4859924316406	265
Netzwerken, bleiben grundlegende Änderungen vage. Über Umwege wird das Verständnis	70.86001586914062	243.58135986328125	10.98004150390625	453.5124816894531	265
dessen, wie sich Staat und Verwaltung gegenüber den Bürgern positionieren müssen	70.86001586914062	262.5416259765625	10.98004150390625	453.6112976074219	265
deutlicher. Etwa bei Michael Bürsch, Vorsitzender der Enquete-Kommission „Zukunft des	70.86001586914062	281.50189208984375	10.98004150390625	453.5738220214844	265
Bürgerschaftlichen Engagements“, Leiter des Arbeitskreises „Bürgergesellschaft und	70.86001586914062	300.52142333984375	10.98004150390625	453.4629211425781	265
aktivierender Staat“ der FES und Bundestagsabgeordneter der SPD:	70.86001586914062	319.42132568359375	10.980010986328123	334.4661865234375	265
Nicht der Staat und seine Verwaltungen definieren, was gut für alle ist, sondern zuallererst die	106.26000213623048	348.1663513183594	10.019989013671877	418.1065139770508	266
Bürgerinnen und Bürger. Engagement sieht dann manchmal anders aus, als es sich die	106.26000213623048	365.38671875	10.019989013671877	418.2277297973633	266
Verwaltung vorstellt. Für Behörden und andere staatliche Institutionen bedeutet dies ein	106.260009765625	382.6661987304688	10.019989013671877	418.21575927734375	266
Umdenken: Öffentlich Bedienstete müssen für den Umgang mit Engagierten vorbereitet und	106.25999450683594	399.8865661621094	10.019989013671877	418.1836700439453	266
(weiter)qualifiziert werden. […] Wenn sich die Beziehung zwischen Bürgerinnen und Bürgern	106.25999450683594	417.16705322265625	10.019989013671877	418.19264221191406	266
und dem Staat verändern soll, müssen sich Staat und Verwaltung gegenüber der	106.25999450683594	434.3874206542969	10.019989013671877	418.22169494628906	266
Gesellschaft, gegenüber bürgerschaftlichem Engagement öffnen. Denn die Bürgergesellschaft	106.260009765625	451.6077880859375	10.019989013671877	418.187744140625	266
kann nicht dort enden, wo staatliche Macht beginnt. Der Bürger ist mehr als Kunde, er ist	106.260009765625	468.8872680664063	10.019989013671877	418.19366455078125	266
Akteur.73	106.260009765625	483.8019714355469	12.325653076171875	38.88186645507813	266
Beachtenswert ist dabei die Feststellung, dass bürgerschaftliches Engagement auch gegen	70.86000061035156	513.70068359375	10.97998046875	453.5936126708984	267
die Interessen des Staates bzw. der Verwaltung wirken kann. Rückt man von dieser	70.86000061035156	532.6609497070311	10.97998046875	453.5464324951172	267
Vorstellung ab, drängt man bürgerschaftliches Engagement auch lediglich in die Rolle von	70.86000061035156	551.6212158203125	10.97998046875	453.4564056396485	267
Dienstleistern für vom Staat nicht(mehr) angebotene Sozialleistungen. Und sicherlich spielt	70.86000061035156	570.5814819335938	10.97998046875	453.4464569091797	267
diese Form des erwünschten Engagements eine nicht geringe Rolle. Doch aus einem	70.86000061035156	589.541748046875	10.979995727539062	453.52110290527344	267
anderen Blickwinkel betrachtet, ist diese Eigenständigkeit mehr Chance denn Gefahr, denn	70.86000061035156	608.561279296875	10.979995727539062	453.5870819091797	267
sie bietet einen Ausweg aus der genannten partizipationsdefizitären Situation. Doch	70.86000061035156	627.5216064453125	10.979995727539062	453.51231384277344	267
zwangsläufig müssen für diese Aktivitäten Räume geschaffen werden, denn durch ein	70.86000061035156	646.4818115234375	10.979995727539062	453.6595306396485	267
Anwachsen der Zahl der öffentlich agierenden Akteure entstehen auch zwangsläufig mehr	70.86000061035156	665.442138671875	10.979995727539062	453.5398406982422	267
und neue Konfliktsituation und Entscheidungszwänge, im Sinne von Koordinationsaufgaben	70.86000061035156	684.461669921875	10.979995727539062	453.4882659912109	267
wie sie in den Governance Debatten behandelt werden. Um dem zu entgegnen betont schon	70.86001586914062	703.4219360351562	10.996231079101562	453.5420227050781	267
72 Vgl. Ebd., S. 702.	70.86000061035156	738.56201171875	12.324317932128904	87.86500549316406	268
73 Bürsch, Michael MdB (2006): Leitbild Lebendige Bürgergesellschaft. Plädoyer für einen neuen	70.86000061035156	750.0819702148438	12.324378967285154	425.5319061279297	268
Gesellschaftsvertrag zwischen Staat, Wirtschaft und Gesellschaft. Friedrich-Ebert-Stiftung. Betrifft:	70.85962677001953	763.84619140625	10.019996643066406	434.4441452026367	268
Bürgergesellschaft 01. S. 8.	70.859619140625	775.3662109375	10.019996643066406	122.7640380859375	268
20	291.5400085449219	795.7608032226562	10.980003356933594	12.222930908203125	269
Schröder die Notwendigkeit der Rückkehr zum Prinzip der kleinen Einheiten.74 Dies bleibt	70.85958862304688	70.833740234375	12.9674072265625	453.6440734863281	270
auch 2007 noch aktuell: „Die solidarische Bürgergesellschaft hat ihren Ort vor allem in den	70.86056518554688	91.781005859375	10.98004150390625	453.4816589355469	270
Kommunen. […] Es ist die kommunale und regionale Lebenswelt mit ihrer jeweils	70.86056518554688	110.74127197265624	10.98004150390625	453.5574645996094	270
einzigartigen Geschichte und Kultur, die Heimat, Gemeinschaft, Überschaubarkeit und	70.86056518554688	129.76080322265622	10.98004150390625	453.4936828613281	270
Sicherheit im Wandel bietet.“75	70.86056518554688	146.673828125	12.9669189453125	148.44146728515625	270
Vor diesem Hintergrund zeichnet sich Reformbedarf in zweierlei Hinsicht ab. Zum einen ist ein	106.26000213623048	177.40631103515625	10.02001953125	418.17066192626953	271
Umbau der Kommunalverfassungen notwendig; denn der überwiegende Teil der	106.26000213623048	194.626708984375	10.02001953125	418.1736526489258	271
bürgerschaftlichen Aktivitäten und Initiativen wird an den Erfahrungen und Lebenswelten in	106.25999450683594	211.90618896484372	10.02001953125	418.2127227783203	271
den Städten und Dörfern anknüpfen. Hier gilt es, Schnittstellen zu schaffen, die die bisherigen	106.25999450683594	229.1265869140625	10.02001953125	418.13661193847656	271
kommunalen Entscheidungsfindungen systematisch um basisdemokratische und	106.25997924804688	246.40606689453125	10.02001953125	418.1736755371094	271
lokalplebiszitäre Komponenten ergänzen und erweitern.76	106.25997924804688	261.322021484375	12.324462890625	254.0419006347656	271
In Gemeinden aber auch darüber hinaus – so der Standpunkt der SPD – auf Länder und auf	70.86000061035156	291.1607666015625	10.98004150390625	453.6363983154297	272
Bundesebene sollen die Bürger ein direktes Mitspracherecht erhalten. Durch Volksbegehren	70.86000061035156	310.12103271484375	10.98004150390625	453.5079803466797	272
und Volksentscheide, die sich in gesetzlich festzulegenden Grenzen bewegen, sollte die	70.86000061035156	329.140625	10.97998046875	453.588119506836	272
parlamentarische Demokratie im verfassungsrechtlichen Rahmen Mitspracherechte und	70.86000061035156	348.10089111328125	10.97998046875	453.490463256836	272
Partizipationsmöglichkeiten erhalten.77 Darüber hinaus muss neben dem Erlass neuer	70.86000061035156	365.0738220214844	12.967315673828125	453.6718597412109	272
Regeln auch Deregulierung angestrebt werden. Zwar darf Deregulierung nicht zum	70.86026000976562	386.0210571289063	10.97998046875	453.5387878417969	272
staatlichen Prinzip werden, jedoch führen auch Verrechtlichungen jeder Lebenssituation	70.86026000976562	404.9813232421875	10.97998046875	453.4839172363281	272
nicht zu mehr Gerechtigkeit, sondern wirken vielmehr handlungshemmend. In dieselbe	70.86026000976562	424.0008850097656	10.97998046875	453.5782165527344	272
Kerbe schlägt die Absicht, bürokratische Hemmnisse zu beseitigen. Um einem	70.86026000976562	442.9611511230469	10.97998046875	453.5299377441406	272
bevormundenden Staat zu vermeiden, soll die häufigste Schnittstelle zwischen Bürger und	70.86026000976562	461.9214172363281	10.97998046875	453.5113220214844	272
Staat, die Verwaltung, durch Bürokratieabbau bürgernäher werden.78 Auch Privatisierung als	70.86026000976562	478.8938293457031	12.96783447265625	453.5674743652344	272
Instrument der Reformierung des Staates hin zu einer Bürgergesellschaft wird nicht	70.86044311523438	499.90032958984375	10.97998046875	453.5407409667969	272
ausgeschlossen. Jedoch wird im Hamburger Grundsatzprogramm betont, dass sie nicht	70.86044311523438	518.860595703125	10.97998046875	453.5190124511719	272
dazu führen darf, dass der Zugang zu öffentlichen Gütern behindert oder das	70.86044311523438	537.8208618164061	10.97998046875	453.5389099121094	272
Gewaltmonopol des Staates infrage gestellt wird. Auch sollen die langfristigen Auswirkungen	70.86044311523438	556.7811279296875	10.97998046875	453.7232360839844	272
auf die künftigen politischen Gestaltungsmöglichkeiten, nicht einem kurzfristigen Nutzen für	70.86044311523438	575.7413940429688	10.97998046875	453.6012878417969	272
die öffentlichen Finanzen unterliegen.79 Einige Staatsaufgaben werden hingegen als	70.86044311523438	592.7738037109375	12.967178344726562	453.4674377441406	272
Kernaufgaben angesehen, die nicht dem Markt übergeben werden sollen, wo sie	70.86050415039062	613.7210693359375	10.979995727539062	453.5968933105469	272
zwangsläufig zur Ware werden würden. Dazu zählt die SPD den Bereich der Sicherheit, als	70.86050415039062	632.6812744140625	10.979995727539062	453.5694885253906	272
Kehrseite des ebenso schützenswerten Gewaltmonopols des Staates. Auch Bildung soll als	70.86050415039062	651.6416015625	10.979995727539062	453.4651794433594	272
Menschenrecht nicht zur Ware werden, genauso wie die Soziale Sicherheit aus der	70.86050415039062	670.6611328125	10.979995727539062	453.4969787597656	272
Verpflichtung des Staates heraus, die Würde des Menschen zu schützen, nicht dem Markt	70.86050415039062	689.6213989257812	10.979995727539062	453.5123596191406	272
74 Vgl. Schröder, Gerhard (2000), Kap. V.	70.86000061035156	715.5819702148438	12.324378967285154	182.8295440673828	273
75 SPD (2007), S. 28f.	70.86000061035156	727.0419921875	12.324256896972654	96.67759704589844	273
76 Mielke, Gerd (2001), S. 708.	70.86000061035156	738.56201171875	12.324317932128904	135.52714538574222	273
77 Vgl. SPD Vorstand (2007), S. 32f.	70.86000061035156	750.0819702148438	12.324378967285154	159.4067840576172	273
78 Vgl. Ebd., S. 33.	70.86000061035156	761.5419921875	12.324256896972654	82.24478149414062	273
79 Vgl. Ebd., S. 32.	70.86000061035156	773.06201171875	12.324321746826172	82.24478149414062	273
21	291.5400085449219	795.7608032226562	10.980003356933594	12.222930908203125	274
übergeben werden darf. Schließlich wird auch Kultur dazu gezählt, die zwar nicht staatlich	70.85958862304688	72.82110595703125	10.98004150390625	453.5288391113281	275
bestimmt werden darf, jedoch ermöglicht werden muss auch wenn sie sich nicht am Markt	70.85958862304688	91.7813720703125	10.98004150390625	453.5179748535156	275
behaupten könnte.80	70.85958862304688	108.69384765625	12.96746826171875	98.94244384765624	275
Im Hamburger Programm werden dezidiert Vereine, Stiftungen, Initiativen, NGOs, Kirchen	70.8603286743164	139.72064208984378	10.9962158203125	453.5487289428711	276
und Religionsgemeinschaften, Gewerkschaften, Parteien sowie Sozial- und Umweltverbände	70.86033630371094	158.680908203125	10.98004150390625	453.4992218017578	276
als Partner des Staates und Träger der Zivilgesellschaft genannt.81 Dass die SPD auch	70.86033630371094	175.7138671875	12.9669189453125	453.65406799316406	276
Parteien in diese Auflistung integriert und diese als „unentbehrliche Mittler zwischen	70.8603515625	196.6610107421875	10.98004150390625	453.593505859375	276
Bürgergesellschaft und Staat“82 beschreibt, deutet darauf hin, dass politisches Engagement	70.8603515625	213.63385009765625	12.96746826171875	453.51275634765625	276
generell auch (nur) in diesen ihren Platz finden soll. Dies verwundert mit Blick auf die	70.85957336425781	234.58099365234372	10.98004150390625	453.5552215576172	276
schrumpfenden Mitgliederzahlen der sogenannten Volksparteien auch nicht wirklich, jedoch	70.85957336425781	253.60052490234372	10.98004150390625	453.4816131591797	276
scheint das die Realität zu verkennen. Denn wenn man die Entwicklungen im Mitglieder- und	70.85957336425781	272.560791015625	10.98004150390625	453.3959197998047	276
Aktivistenbereich auf das Verhältnis von Bürgergesellschaft und Parteien bezieht, werden	70.85957336425781	291.52105712890625	10.98004150390625	453.4695281982422	276
zwei sehr unterschiedliche Sphären der politischen Organisation und Teilhabe deutlich.	70.85957336425781	310.4813232421875	10.98004150390625	453.604721069336	276
Einerseits ein verbrauchtes und seine sozio-kulturelle Integrationsfähigkeit immer stärker	70.85957336425781	329.44158935546875	10.980010986328123	453.7122039794922	276
verlierendes Parteiensystem, auf der anderen Seite ein wesentlich lebendigeres und	70.85957336425781	348.461181640625	10.97998046875	453.5175628662109	276
hochgradig differenziertes System bürgerschaftlichen Engagements.83 Parteien haben,	70.85957336425781	365.4338073730469	12.967620849609375	453.5267791748047	276
vereinfacht ausgedrückt, dieselben Probleme wie Kirchen und Verbände was die Gewinnung	70.85968017578125	386.3810424804688	10.97998046875	453.61669921875	276
von neuen freiwillig Engagierten betrifft: sie waren bislang nicht in der Lage sich auf die	70.85968017578125	405.34130859375	10.97998046875	453.4596557617188	276
gewandelten Anforderungen des bürgerschaftlichen Engagements einzustellen und bieten	70.85968017578125	424.3608703613281	10.97998046875	453.61895751953125	276
nicht ausreichend Möglichkeiten zu einer flexiblen, projektbezogenen, zeitlich begrenzten	70.85968017578125	443.3211364746094	10.97998046875	453.557373046875	276
und selbstständigen Tätigkeit. Um darauf zu reagieren schlägt Mielke eine „Reform des	70.85968017578125	462.2814025878906	10.97998046875	453.5333862304688	276
traditionellen Mitgliederkonzepts [vor]. In Zeiten erhöhter Mobilität und Flexibilität sollten die	70.85968017578125	481.2416687011719	10.97998046875	453.6056518554688	276
Parteien neue Modelle von befristeten und flexiblen Mitgliedschaften entwickeln und sich	70.85968017578125	500.2019348144531	10.97998046875	453.49700927734375	276
somit den flexiblen und spontanen Teilhabeformen der Gegenwart öffnen.“84	70.85968017578125	517.1737060546875	12.968505859375	370.38232421875	276
5. Entwicklungslinien der Bürgergesellschaftskonzepte	70.86000061035156	562.6950073242189	12.0	314.69517517089844	277
Die Startpunkte von SPD und CDU auf dem Weg zu einem, wie sich gezeigt hat, weitgehend	70.86000061035156	589.78076171875	10.979995727539062	453.551986694336	278
übereinstimmenden Bürgergesellschaftskonzept, waren unterschiedliche. Die	70.86000061035156	608.7410278320312	10.979995727539062	453.4882659912109	278
Sozialdemokratie musste eine große Strecke mit grundsätzlichen Paradigmenwechseln	70.86000061035156	627.7012939453125	10.979995727539062	453.6805267333984	278
hinter sich lassen. Gerade auch, weil vergangene Reformdiskussionen der SPD vorwiegend	70.86000061035156	646.6615600585938	10.979995727539062	453.5980682373047	278
mit Elitedemokratie, Parteidominanz und Staatsbezogenheit verbunden waren.85	70.86000061035156	663.6937866210938	12.967361450195312	453.60203552246094	278
80 Vgl. Ebd., S. 31f.	70.86000061035156	704.06201171875	12.324325561523438	84.99424743652344	279
81 Ebd., S. 31.	70.86000061035156	715.5819702148438	12.324378967285154	62.2017822265625	279
82 Ebd., S. 33.	70.86000061035156	727.0419921875	12.324256896972654	62.2017822265625	279
83 Vgl. Mielke, Gerd (2007): Auf verlorenem Posten? Parteien in der Bürgergesellschaft. In:	70.86000061035156	738.56201171875	12.324317932128904	401.1683197021485	279
Forschungsjournal NSB, Jg.20, 4/2007, ( S. 63-71). S. 63.	70.859619140625	752.3863525390625	10.019996643066406	256.16830444335943	279
84 Ebd., S. 70.	70.86000061035156	761.5419921875	12.324256896972654	62.2017822265625	279
85 Vgl. Mielke, Gerd (2001): S. 704.	70.86000061035156	773.06201171875	12.324321746826172	155.47496032714844	279
22	291.5400085449219	795.7608032226562	10.980003356933594	12.222930908203125	280
Übergeordnetes Ziel sozialdemokratischer Politik war es immer, die gleiche Realwirkung von	70.85958862304688	72.82110595703125	10.98004150390625	453.5190124511719	281
universellen Menschen- und Bürgerrechten durchzusetzen. Dazu sind zielbestimmte	70.85958862304688	91.7813720703125	10.98004150390625	453.4904479980469	281
gesellschaftspolitische Einwirkungen, in Form von Umverteilungsmaßnahmen sowie	70.85958862304688	110.74163818359376	10.98004150390625	453.5606994628906	281
strukturierender und regulativer Politik, nötig.86 Diese Maßnahmen sind allerdings in den	70.85958862304688	127.77386474609376	12.96734619140625	453.6299133300781	281
komplexen Gesellschaften, die sich nicht mehr auf nationale Grenzen reduzieren lassen,	70.85955810546875	148.72100830078125	10.98004150390625	453.4420776367188	281
zunehmend an Wirksamkeitsgrenzen gestoßen. Die Steuerungsmöglichkeiten globaler	70.85955810546875	167.6812744140625	10.98004150390625	453.61669921875	281
Wirtschaftssysteme für Nationalstaaten sind denkbar begrenzt, weshalb die Souveränitäts-	70.85955810546875	186.64154052734372	10.98004150390625	453.627685546875	281
und Gestaltungsansprüche von diesen, einer anders gearteten Wirklichkeit	70.85954284667969	205.601806640625	10.98004150390625	453.60133361816406	281
gegenüberstehen. Vielmehr handelt es sich um ein Reagieren auf äußere Einflüsse, um	70.85954284667969	224.621337890625	10.98004150390625	453.7638092041016	281
Standortvorteile zu schaffen oder zu erhalten. Auch die innere und äußere Souveränität wird,	70.85954284667969	243.58160400390625	10.98004150390625	453.5266876220703	281
durch gewachsene Komplexitäten und pfadabhängige wohlfahrtsstaatliche Überforderung,	70.85954284667969	262.5418701171875	10.98004150390625	453.5279083251953	281
reduziert. Dass bedeutet, dass „alle normativen Ansprüche an die sozialökonomischen	70.85954284667969	281.50213623046875	10.98004150390625	453.4728546142578	281
Gestaltungsansprüche der Sozialen Demokratie in prinzipieller Weise an der veränderten	70.85954284667969	300.52166748046875	10.98004150390625	453.5442657470703	281
Realität“87 scheitern. Die Sozialdemokratie wird deshalb nicht gleich gänzlich	70.85954284667969	317.49383544921875	12.968109130859375	453.61842346191406	281
handlungsunfähig, jedoch müssen die geänderten Ausgangsbedingungen akzeptiert und als	70.86026000976562	338.4410705566406	10.97998046875	453.5957946777344	281
Grundlage politischen Handelns betrachtet werden. „In den Diskussionen um die	70.86026000976562	357.4013366699219	10.97998046875	453.4574890136719	281
Modernisierung des Staatsverständnisses der Sozialen Demokratie spielen in diesem	70.86026000976562	376.3616027832031	10.97998046875	453.4070129394531	281
Zusammenhang die Vorstellungen vom aktivierenden Staat eine besondere Rolle.“88	70.86026000976562	393.3938293457031	12.967315673828125	453.6017761230469	281
Weniger durch traditionelles hierarchisches Handeln als vielmehr durch die Rolle als	70.85977172851562	414.3410339355469	10.97998046875	453.5320739746094	281
Gewährleister und Moderator werden Zielvorstellungen gesetzt, die Implementierung jedoch	70.85977172851562	433.3013000488281	10.97998046875	453.5221862792969	281
erfolgt durch die jeweils am besten geeigneten Akteure aus Ökonomie, Staat oder	70.85977172851562	452.2615661621094	10.97998046875	453.5976867675781	281
Zivilgesellschaft. Sobald es sich jedoch um Aufgaben handelt, die eine Erfüllung von	70.85977172851562	471.2811279296875	10.97998046875	453.5244445800781	281
Rechtsansprüchen der Bürger gegenüber dem Staat betreffen, muss dieser in der	70.85977172851562	490.2413940429688	10.97998046875	453.5727844238281	281
Gewährleistungsverantwortung verbleiben.89 Mit dieser Einbettung der Zivilgesellschaft in	70.85977172851562	507.2138366699219	12.967803955078125	453.6519470214844	281
das politische System, übernimmt sie einerseits Dienstleistungsaufgaben, andererseits kann	70.85983276367188	528.1609497070311	10.97998046875	453.5134582519531	281
sie auch, durch ihre Potentiale demokratischer Selbststeuerung und ihre basisdemokratische	70.85983276367188	547.1212158203125	10.97998046875	453.5727233886719	281
Einwirkung, als „politische Steuerungsressource moderner Gesellschaften auf nationaler,	70.85983276367188	566.1407470703125	10.97998046875	453.7034606933594	281
regionaler und globaler Handlungsebene“90 wirken. Bei der beschriebenen	70.85983276367188	583.11376953125	12.96728515625	453.6238098144531	281
Bürgergesellschaftskonzeption der Sozialdemokratie, handelt es sich um einen intendierten	70.86039733886719	604.06103515625	10.979995727539062	453.4981842041016	281
Steuerungspluralismus: Wirtschaftliche Allokationsaufgaben können weitgehend über den	70.86039733886719	623.0213012695312	10.979995727539062	453.44764709472656	281
Markt geregelt werden; Über die Zivilgesellschaft können politische Selbstorganisation und	70.86039733886719	642.0408935546875	10.979995727539062	453.6111602783203	281
Selbstregulierung erfolgen und über Staatshandeln werden in möglichst kooperativen	70.86039733886719	661.0011596679688	10.979995727539062	453.4848175048828	281
Formen Rechtsgarantien gegeben.91 Waren Staat und Markt einmal die (einzigen) relevanten	70.86039733886719	678.3819580078125	12.559463500976562	453.4614410400391	281
86 Vgl. Meyer, Thomas (2005): Theorie der Sozialen Demokratie. Wiesbaden: VS-Verlag. S. 198.	70.86000061035156	715.5819702148438	12.324378967285154	426.7675018310547	282
87 Ebd., S. 204.	70.86000061035156	727.0419921875	12.324256896972654	67.75886535644531	282
88 Ebd., S. 205f.	70.86000061035156	738.56201171875	12.324317932128904	70.53041076660156	282
89 Vgl. Ebd., S. 206.	70.86000061035156	750.0819702148438	12.324378967285154	87.86500549316406	282
90 Ebd., S. 209.	70.86000061035156	761.5419921875	12.324256896972654	67.75886535644531	282
91 Ebd., S. 209.	70.86000061035156	773.06201171875	12.324321746826172	67.75886535644531	282
23	291.5400085449219	795.7608032226562	10.980003356933594	12.222930908203125	283
Steuerungs- und Regulierungsmechanismen, kommt mit der Zivilgesellschaft ein Akteur	70.85958862304688	72.82110595703125	10.98004150390625	453.6134948730469	284
