hinzu, der, mit der technischen Entwicklung neuer Medien und Informationstechnologie, auf	70.85958862304688	91.7813720703125	10.98004150390625	453.4530944824219	284
verschiedenen Ebenen stark an Bedeutung gewonnen hat. Durch die wesentlich höhere	70.85958862304688	110.74163818359376	10.98004150390625	453.5684509277344	284
Verfügbarkeit von Wissen entstehen zwei Phänomene. Zum einen sind Verwaltungen mit der	70.85958862304688	129.76116943359378	10.98004150390625	453.5299377441406	284
Verarbeitung der Informationsflut überfordert und zum anderen „nutzen zivilgesellschaftliche	70.85958862304688	148.721435546875	10.98004150390625	453.4597473144531	284
Akteure ihr spezifisches Wissen, um dem Staat bei der Lösung kollektiver Probleme, also in	70.85958862304688	167.68170166015625	10.98004150390625	453.5826721191406	284
der Politik, Konkurrenz zu machen.“92 Einhergehend mit diesem empowerment der	70.85958862304688	185.06201171875	12.574951171875	453.5682678222656	284
zivilgesellschaftlichen Akteure und einem damit wachsenden Bereich	70.86053466796875	205.60101318359372	10.98004150390625	453.56842041015625	284
außerparlamentarischer politischer Tätigkeit, stellt sich ein Schrumpfen der großen	70.86053466796875	224.62054443359372	10.98004150390625	453.6089477539063	284
Mitgliederparteien ein. Zwischen 1990 und 2005 sank die Mitgliederzahl bei deutschen	70.86053466796875	243.580810546875	10.98004150390625	453.5035400390625	284
Bundestagsparteien um ca. 36%, am stärksten davon betroffen war die SPD.93 Diese	70.86053466796875	260.5538330078125	12.96728515625	453.57861328125	284
Entwicklungen machen ein neues Parteien- und Politikverständnis notwendig.	70.8597412109375	281.440673828125	10.98004150390625	377.74932861328125	284
Auf konservativer Seite distanziert man sich zunächst von der Idee der Zivilgesellschaft.	70.8597412109375	310.4805908203125	10.98004150390625	453.5870971679688	285
Diese Abgrenzung findet ihren Ursprung in der zunächst vorhandenen Assoziation des	70.8597412109375	329.44085693359375	10.980010986328123	453.47064208984375	285
Begriffes mit den Umbrüchen und der Überwindung der realsozialistischen Systeme	70.8597412109375	348.46044921875	10.97998046875	453.48272705078125	285
1989/90, bei denen erheblicher Widerstand der Bevölkerung gegen die herrschende	70.8597412109375	367.42071533203125	10.97998046875	453.53662109375	285
staatliche Bevormundung geleistet wurde. Doch schon kurz darauf wird die	70.8597412109375	386.3809814453125	10.97998046875	453.523193359375	285
Bürgergesellschaft auch von dieser Seite beworben, um „in Zeiten großer	70.8597412109375	405.34124755859375	10.97998046875	453.628662109375	285
Orientierungslosigkeit und allgemeinem Werteverlusts neue bürgerliche Prinzipien und	70.8597412109375	424.3608093261719	10.97998046875	453.52337646484375	285
Tugenden [zu] transportieren.“94	70.8597412109375	441.2738342285156	12.966827392578125	155.76229858398438	285
Aus einer kritischen Warte heraus, wird das Bürgergesellschaftskonzept als neoliberale	70.85992431640625	472.3006896972656	10.97998046875	453.6221923828125	286
Subjektivierung und Ökonomisierung des Sozialen beanstandet. Durch die umfassende	70.85992431640625	491.2609558105469	10.97998046875	453.5069580078125	286
Einführung von Wettbewerbsdruck und Konkurrenzlogik werden Begriffe wie Kreativität,	70.85992431640625	510.22119140625	10.97998046875	453.521240234375	286
Selbstverwirklichung, Individualismus oder Autonomie in die neoliberale Semantik	70.85992431640625	529.1815185546875	10.97998046875	453.4948120117188	286
übernommen und zu Leitprinzipien gemacht. Die Referenzen auf diese Begriffe können, wie	70.85992431640625	548.2010498046875	10.97998046875	453.51898193359375	286
dargelegt, sowohl bei SPD als auch CDU mehrfach gefunden werden. „Aus passiven	70.85992431640625	567.1613159179688	10.97998046875	453.53546142578125	286
sozialstaatlichen Leistungsempfänger(inne)n und verwalteten Bürger(inne)n sollen aktive,	70.85992431640625	586.12158203125	10.979995727539062	453.5783081054688	286
eigenverantwortliche und sich selbst kontrollierende Individuen werden.“95 Gestützt durch die	70.85990905761719	603.0938110351562	12.968032836914062	453.64247131347656	286
Thesen von Friedrich August von Hayek und dessen Kritik an keynesianischen	70.86041259765625	624.041015625	10.979995727539062	453.5607299804688	286
Staatinterventionen in den freien Markt, liberalisiert sich auch das Denken auf der	70.86039733886719	643.0606079101562	10.979995727539062	453.5606842041016	286
gesellschaftlichen Makro-Ebene. Die generelle Abkehr vom Wohlfahrtsstaat, der vorwiegend	70.86039733886719	662.0208740234375	10.979995727539062	453.5014190673828	286
durch bürokratische Disziplinierung das Handeln der Bürger zu lenken versuchte, geht einher	70.86039733886719	680.9811401367188	10.979995727539062	453.6166534423828	286
mit der Beförderung eines Bildes vom autonomen und freien Bürger, der durch Eigeninitiative	70.86039733886719	699.94140625	10.979995727539062	453.57167053222656	286
92 Gohl, Christopher (2001): Bürgergesellschaft als politische Zielperspektive. In: Aus Politik und	70.86000061035156	727.0419921875	12.324256896972654	424.05201721191406	287
Zeitgeschichte, B 6-7/2001, (S. 5-11). S. 6.	70.85960388183594	740.8662109375	10.019996643066406	189.4361114501953	287
93 Vgl. Mielke, Gerd (2007), S. 66.	70.86000061035156	750.0819702148438	12.324378967285154	149.93289184570312	287
94 Vgl. Lösch, Bettina (2007), S. 267.	70.86000061035156	761.5419921875	12.324256896972654	162.1562957763672	287
95 Lösch, Bettina (2007), S. 271.	70.86000061035156	773.06201171875	12.324321746826172	142.25657653808594	287
24	291.5400085449219	795.7608032226562	10.980003356933594	12.222930908203125	288
seine Selbstverwirklichung verfolgt. Die SPD positioniert sich jedoch tendenziell – aus ihrer	70.85958862304688	72.82110595703125	10.98004150390625	453.5793762207031	289
Tradition heraus – skeptischer gegenüber einem zu freien Spiel kapitalistischer Kräfte als die	70.85958862304688	91.7813720703125	10.98004150390625	453.4541931152344	289
CDU und spricht sich daher auch für eine im Kern beizubehaltende starke Position des	70.85958862304688	110.74163818359376	10.98004150390625	453.5519104003906	289
Staates in der Gesellschaft aus. „Ein leistungsfähiger, transparenter und bürgerfreundlicher	70.85958862304688	129.76116943359378	10.98004150390625	453.5508117675781	289
Staat bleibt gerade in einer Welt, in der starke Einzelinteressen die Privatisierung öffentlicher	70.85958862304688	148.721435546875	10.98004150390625	453.6144714355469	289
Aufgaben versuchen, unverzichtbar.“96 Die CDU vertritt dagegen das Konzept des schlanken	70.85958862304688	165.69384765625	12.9678955078125	453.6297302246094	289
Staates, der sich seinen Kernaufgaben widmen, allerdings von allen anderen Aufgaben	70.86051940917969	186.6409912109375	10.98004150390625	453.61451721191406	289
möglichst ferngehalten werden soll. „Damit sich der Staat auf seine Kernaufgaben	70.86051940917969	205.60125732421875	10.98004150390625	453.6056671142578	289
konzentrieren kann, darf er weder mit Anforderungen überfrachtet werden noch solche	70.86051940917969	224.62078857421875	10.98004150390625	453.60682678222656	289
Aufgaben behalten oder an sich ziehen, deren Übernahme den Grundsätzen der	70.86051940917969	243.5810546875	10.98004150390625	453.56837463378906	289
Eigenverantwortung, Freiheit und Subsidiarität widerspricht.“97	70.86051940917969	260.49383544921875	12.9671630859375	301.8014678955078	289
Mit der Wendung hin zum aktivierenden Staat und damit zu einer neuen Form der	70.86044311523438	291.52069091796875	10.98004150390625	453.5234069824219	290
Staatlichkeit, erhalten – wie berichtet wurde – gerade die kleinen Einheiten größere	70.86044311523438	310.48095703125	10.9962158203125	453.5211486816406	290
Beachtung. Die besonders starke Referenz auf die Familie als kleine Einheit, zeugt von der	70.85934448242188	329.44122314453125	10.980010986328123	453.5912780761719	290
konservativen Tradition der CDU. Die Familie als gesellschaftliche Keimzelle ist für die	70.85934448242188	348.4608154296875	10.97998046875	453.5661926269531	290
Vermittlung von „Schlüsselqualifikationen sowie Tugenden (z.B. Engagement, Disziplin,	70.85934448242188	367.4210815429688	10.97998046875	453.6551208496094	290
Fleiß) und Werten (z.B. Freiheit, Gerechtigkeit, Nächstenliebe)“98 zuständig. Diese Ansichten	70.85934448242188	384.3938293457031	12.967498779296875	453.6245422363281	290
vertreten (neo-)konservative Autoren, wie etwa Udo di Fabio oder Paul Nolte. Sowohl der	70.8594970703125	405.3410339355469	10.97998046875	453.5640258789063	290
starke Bezug auf den Wert der Familie, als auch die Bekenntnis zu Leistungsgerechtigkeit im	70.8594970703125	424.360595703125	10.97998046875	453.65948486328125	290
Sinne bürgerlichen Leistungsdenkens, prägen Udo di Fabios Ansichten. Dabei distanziert er	70.8594970703125	443.3208618164063	10.97998046875	453.6002197265625	290
sich von kurzfristigen Selbstverwirklichungsideen und verweist lieber auf den Wert	70.8594970703125	462.2811279296875	10.97998046875	453.5903930664063	290
nachhaltiger sozialer und familiärer Bindungen.	70.8594970703125	481.1809997558594	10.97998046875	229.25030517578125	290
Eine Gesellschaft kann sich nur dann als frei und vernünftig bezeichnen, wenn sie	106.26000213623048	509.9263000488281	10.019989013671877	418.1786575317383	291
nachvollziehbar zu begründen vermag, welche Leistungen der Einzelne Gemeinschaften	106.26000213623048	527.206787109375	10.019989013671877	418.15467071533203	291
schuldet, die von seiner Zustimmung abhängen, von deren Existenz aber auch das Projekt	106.26000213623048	544.4271240234375	10.019989013671877	418.30005645751953	291
individueller Freiheit lebt. […] Halten wir als Gesellschaft eigentlich dieses Niveau an	106.25999450683594	561.7076416015625	10.019989013671877	418.13661193847656	291
rationaler Vergewisserung und pflegen die Wertschätzung von Gemeinschaftsbindung oder	106.25999450683594	578.927978515625	10.019989013671877	418.1737823486328	291
verlassen wir uns zu sehr auf die Automatismen des Marktes und die Auffangzuständigkeiten	106.25999450683594	596.1483154296875	10.020004272460938	418.2216339111328	291
des Staates? Warum erodieren eigentlich gerade die festeren, auf Dauer angelegten	106.25997924804688	613.4288330078125	10.020004272460938	418.1695861816406	291
Gemeinschaften? Fehlt es den Menschen nur an Einsicht, an Vernunft? Sehen sie nicht, dass	106.25997924804688	630.649169921875	10.020004272460938	418.1868591308594	291
die Verweigerung von Gemeinschaft – die abnehmende Bindung in Vereinen,	106.25997924804688	647.9296875	10.020004272460938	418.2048034667969	291
Gewerkschaften, Parteien, Kirchen, des Unternehmers an seine Belegschaft, die Abnahme	106.25997924804688	665.1500244140625	10.020004272460938	418.1346130371094	291
96 SPD (2007), S. 26f.	70.86000061035156	750.0819702148438	12.324378967285154	96.67759704589844	292
97 CDU (2007), S. 87.	70.86000061035156	761.5419921875	12.324256896972654	94.99525451660156	292
98 Schmitz, Michael (2003), S. 22.	70.86000061035156	773.06201171875	12.324321746826172	148.8567352294922	292
25	291.5400085449219	795.7608032226562	10.980003356933594	12.222930908203125	293
der Zahl stabiler Ehen –, dass all das ihre Abhängigkeit von indifferenten Mechanismen des	106.26000213623048	72.52630615234375	10.02001953125	418.1797561645508	294
Marktes und der Bürokratie der Staatsverwaltung steigert?99	106.260009765625	87.4420166015625	12.32470703125	265.62185668945307	294
So ähnlich sich die beiden Bürgergesellschaftskonzepte, mit Blick auf ihre neoliberale	70.86000061035156	117.28076171875	10.98004150390625	453.4981536865234	295
Ausrichtung und die Anwendung deren Instrumente auch sind, so zeigt sich der Unterschied	70.86000061035156	136.30029296875	10.98004150390625	453.4727630615234	295
am deutlichsten in der dargestellten konservativen Fundierung des Konzeptes seitens der	70.86000061035156	155.26055908203125	10.98004150390625	453.5068817138672	295
CDU. Die Hervorhebung traditionaler Ordnungsmechanismen wie der Familie als auch die	70.86000061035156	174.2208251953125	10.98004150390625	453.5123748779297	295
Werteverbundenheit mit der christlich-abendländischen Kultur und dem christlich-konservativ	70.8599853515625	193.18109130859372	10.98004150390625	453.57171630859375	295
geprägten, optimistischen Menschenbild, sowie die Referenz auf das klassische Ehrenamt,	70.86000061035156	212.20062255859372	10.98004150390625	453.5409393310547	295
stehen einem toleranteren, pluralistischeren Gesellschaftskonstrukt der SPD gegenüber.	70.86000061035156	231.10052490234372	10.9962158203125	430.4862518310547	295
6. Fazit und Ausblick	70.86000061035156	274.635009765625	12.0	119.34120178222656	296
Abschließend steht die Erkenntnis, dass sich die beiden Bürgergesellschaftskonzepte in ihrer	70.86000061035156	301.72076416015625	10.98004150390625	453.5716400146485	297
jeweiligen Ausgestaltung nicht wesentlich unterscheiden. Lediglich die parteiinhärenten	70.86000061035156	320.6810302734375	10.980010986328123	453.5079803466797	297
Grundannahmen bilden sich als Pfadabhängigkeiten in den einzelnen Elementen und	70.86000061035156	339.6413269042969	10.97998046875	453.4277801513672	297
Bereichen der gesellschaftspolitischen Überlegungen ab. Nachdem die beiden Konzeptionen	70.86000061035156	358.660888671875	10.97998046875	453.5640106201172	297
der Bürgergesellschaft dargelegt und die konvergente Entwicklung der SPD und CDU	70.86000061035156	377.62115478515625	10.97998046875	453.6068572998047	297
diesbezüglich deutlich wurden, erscheint ein parteiferner, von diesen Pfadabhängigkeiten	70.86001586914062	396.5814208984375	10.97998046875	453.5433044433594	297
unabhängig geführter Diskurs der Staatsformkonzeption mit Blick auf die Rolle der	70.86001586914062	415.5416870117188	10.97998046875	453.5058288574219	297
Zivilgesellschaft, als „gestärktem Akteur“ und in seinen wachsenden Forderungen bezüglich	70.86001586914062	434.5612487792969	10.97998046875	453.6003112792969	297
gesellschaftlicher Mitsprache, vor allem auf kommunaler Ebene, sinnvoll. Denn wie etwa der	70.86001586914062	453.5215148925781	10.97998046875	453.5135803222656	297
Deutschlandbericht des CIVICUS Civil Society Index Projektes zeigte, ist der Einfluss der	70.86001586914062	472.4817810058594	10.97998046875	453.5442199707031	297
deutschen Zivilgesellschaft auf Politik und Gesellschaft bereits vergleichsweise hoch	70.86001586914062	491.4420471191406	10.97998046875	453.6265563964844	297
einzuschätzen.100 Gerade mit Blick auf die Entwicklungen der großen Parteien, insbesondere	70.86001586914062	508.4138488769531	12.968475341796875	453.5917663574219	297
der SPD, die seit Jahren unter einem erheblichen Mitgliederschwund leidet und sich damit	70.8603744506836	529.4202270507811	10.97998046875	453.49149322509766	297
auch einer Diskussion über ihre Rolle und die dazu nötige gesellschaftliche Legitimation	70.8603744506836	548.3804931640625	10.97998046875	453.44315338134766	297
stellen muss. Dies kann im Rahmen dieser Arbeit nicht geleistet werden, wäre aber ein	70.8603744506836	567.3407592773438	10.97998046875	453.58048248291016	297
meines Erachtens lohnenswertes Vorhaben und demokratietheoretisch sinnvoll. Die	70.8603744506836	586.301025390625	10.979995727539062	453.6255874633789	297
Anbindungen an verschiedene existente Staatsformdiskussionen, die letztlich zur	70.8603744506836	605.320556640625	10.979995727539062	453.61344146728516	297
Bürgergesellschaftskonzeption geführt haben, sind dabei eng mit Überlegungen der	70.8603744506836	624.2808837890625	10.979995727539062	453.53446197509766	297
Governanceforschung verknüpft. Die Bürgergesellschaft kann nicht staatlich verordnet,	70.8603744506836	643.2410888671875	10.979995727539062	453.5508804321289	297
bürgerschaftliches Engagement nicht vom Staat erzwungen werden. „Unser freiheitlicher	70.8603744506836	662.201416015625	10.979995727539062	453.5782241821289	297
99 Di Fabio, Udo (2007): Gemeinsinn zwischen Rationalität und Romantik. Rede anlässlich 50 Jahre	70.86000061035156	727.0419921875	12.324256896972654	440.8165435791016	298
Aktion Gemeinsinn. URL: http://www.gemeinsinn.de/beitraege/50_Jahre_Gemeinsinn-	70.86065673828125	740.8662109375	10.019996643066406	380.724853515625	298
1R00edVeg_l.diRFeaibmioe_r,07S1a0b1in7e.p(d2f0(0S6ta):nDd:ie23S.t1ä0r.k2e00d9e)r.ZSi.vi4lgf.esellschaft in Deutschland. The Strength of Civil	70.86000061035156	752.3863525390625	21.47989654541016	453.62083435058594	298
Society in Germany. Berlin: Maecenata Verlag, 2006. S. 199.	70.86042785644531	775.3662109375	10.019996643066406	270.00086975097656	298
26	291.5400085449219	795.7608032226562	10.980003356933594	12.222930908203125	298
Staat lebt von Voraussetzungen, die er selbst nicht garantieren kann.“101 Die Möglichkeit	70.85958862304688	70.833740234375	12.9674072265625	453.6438903808594	299
besteht –normativ bewertet – letztlich darin, die geeignetsten Rahmenbedingungen zu	70.8603515625	91.781005859375	10.98004150390625	453.4937744140625	300
schaffen, in denen sich die Bürgergesellschaft einrichten und stabilisieren kann. Daher ist ein	70.8603515625	110.74127197265624	10.98004150390625	453.65728759765625	301
weiterer Begriff sinnvoll, der genau diese spezifische Rahmensetzung umschreibt. Die	70.8603515625	129.76080322265622	10.98004150390625	453.579345703125	302
Enquete-Kommission „Zukunft des Bürgerschaftlichen Engagements“ schlägt dafür die	70.86033630371094	148.7210693359375	10.98004150390625	453.4893341064453	303
Begriffe „ermöglichender“, „ermunternder“ oder – prominent aber auch kontrovers diskutiert –	70.86033630371094	167.68133544921875	10.98004150390625	453.5992584228516	304
den „aktivierenden Staat“ vor.102 Kontrovers deshalb, weil damit Vorstellungen verbunden	70.86033630371094	184.65386962890625	12.9677734375	453.5828399658203	305
werden, die mehr mit Zwang als mit Freiwilligkeit zu tun haben103 und mit dem Begriffspaar	70.86054992675781	203.61383056640625	12.96722412109375	453.5875701904297	306
fördern und fordern gut beschrieben sind. Das Staatsverständnis des aktivierenden Staates,	70.85995483398438	224.62030029296875	10.9962158203125	453.6683044433594	307
zeigt sich als zusammengesetztes Leitbild, mit Anknüpfungspunkten und Anleihen aus	70.85994720458984	243.58056640625	10.98004150390625	453.52774810791016	308
unterschiedlichen Strängen sozialstaatlicher Verwaltungs- und Staatsreformdebatten. Die	70.85994720458984	262.54083251953125	10.98004150390625	453.4322280883789	309
Modelle, die das Erscheinungsbild des aktivierenden Staates grundlegend prägen, zeigen	70.85994720458984	281.5010986328125	10.98004150390625	453.5331802368164	310
sich in der Betrachtung vergangener Reformleitbilder (siehe Kap.2.2), und weiterer	70.85994720458984	300.5206298828125	10.98004150390625	453.5442886352539	311
Konzepte; Vorwiegend sind hier die Schlagworte: Kommunitarismus, Wohlfahrtsmix,	70.85994720458984	319.48089599609375	10.980010986328123	453.56412506103516	312
Schlanker Staat und Aktiver Staat zu nennen.	70.85994720458984	338.38079833984375	10.97998046875	221.90579986572263	313
Wie sich die Debatte um das Reformkonzept Bürgergesellschaft weiterentwickeln wird ist	70.85994720458984	367.4206848144531	10.97998046875	453.56729888916016	314
unklar. Einerseits bekennen sich die großen Parteien zu den Vorhaben, die	70.85994720458984	386.3809509277344	10.97998046875	453.5398941040039	315
Eigenverantwortlichkeit der Bürger zu stärken und den eingeschlagenen Weg weiter zu	70.85994720458984	405.3412170410156	10.97998046875	453.5826187133789	316
verfolgen, andererseits sind auch skeptische Stimmen zu hören, die diese Debatte etwa als	70.85994720458984	424.36077880859375	10.97998046875	453.4992446899414	317
Mittel und Legitimation zur Abkehr von traditionellen Werten betrachten oder als bereits	70.85994720458984	443.321044921875	10.97998046875	453.5824966430664	318
abgegriffenes politisch und gesellschaftlich nicht mehr lebendiges Reformbild. Demnach sei	70.85994720458984	462.28131103515625	10.97998046875	453.5102310180664	319
bereits ein neues Leitbild erkennbar, dass stärker auf die ökonomischen und	70.85994720458984	481.2415771484375	10.97998046875	453.5386734008789	320
gesellschaftlichen Herausforderungen der Globalisierung abziele und durch eine Umrüstung	70.85994720458984	500.2018432617188	10.97998046875	453.5256118774414	321
individueller Lebensentwürfe und der gesellschaftlichen Architektur, auf den dadurch ständig	70.85994720458984	519.221435546875	10.97998046875	453.5969009399414	322
präsenten Konkurrenzkampf eingehe.	70.85994720458984	538.1212768554689	10.97998046875	183.46044158935547	323
101 CDU (2007), S. 87. Dieser Passus des Grundsatzprogrammes findet sich unter der Überschrift	70.86000061035156	658.1019287109375	12.324447631835938	431.4745941162109	324
„Freiheit in Verantwortung vor Gott und den Menschen“ und könnte daher in diesem Zusammenhang	70.86045837402344	671.8662109375	10.034774780273438	445.72877502441406	324
deplatziert erscheinen. Der Satz basiert jedoch offensichtlich auf dem sog. Böckenförde-Diktum des	70.85945129394531	683.38623046875	10.020004272460938	440.6976776123047	324
Verfassungsrechtlers Ernst-Wolfgang Böckenförde. Dieses lautet: „Der freiheitliche säkularisierte	70.85945129394531	694.8460693359375	10.034774780273438	427.996322631836	324
Staat lebt von Voraussetzungen, die er selbst nicht garantieren kann.“ (Ebd. (1976): Staat,	70.85946655273438	706.3660888671875	10.034767150878906	399.11663818359375	324
Gesellschaft, Freiheit. Frankfurt a.M.: Suhrkamp. S. 60.) Gerade der von der CDU ausgesparte	70.85946655273438	717.8860473632812	10.019996643066406	419.7839050292969	324
Hinweis auf den säkularisierten Staat, verweist auf die Bedeutung der Zivilgesellschaft. (Siehe dazu	70.85946655273438	729.345947265625	10.034767150878906	440.1104431152344	324
auch: Rath, Christian (2009): Freiheit ist Ansteckend. In: Die Tageszeitung, 23.09.2009. S. 04.)	70.85948181152344	740.8659057617188	10.019996643066406	419.5814666748047	324
102 Vgl. Enquete-Kommission (2002): S. 25.	70.86000061035156	750.0819702148438	12.324378967285154	191.9265289306641	324
103 Vgl. das Sondervotum des sachverständigen Mitglieds Prof. Dr. Roland Roth (Enquete-	70.86000061035156	761.5419921875	12.324256896972654	399.3065032958984	324
Kommission 2002, S. 25).	70.86044311523438	775.3662109375	10.019996643066406	114.52658081054688	324
27	291.5400085449219	795.7608032226562	10.980003356933594	12.222930908203125	325
Literatur	70.86000061035156	87.31512451171875	12.0	48.71040344238281	326
Allgemeine Literatur	70.86000061035156	114.69842529296876	10.97998046875	106.41265869140624	327
<ref>• <author><surname>Adloff</surname>, <given-names>Frank</given-names></author> (<year>2005</year>): <article-title>Zivilgesellschaft. Theorie und politische Praxis</article-title>. <other>Frankfurt, New	88.85951232910156	149.39202880859375	11.68914794921875	423.9960174560547	328
York</other>: <publisher>Campus Verlag</publisher>.</ref>	106.86013793945312	169.12066650390625	10.98004150390625	107.5941162109375	328
<ref>• <author><surname>Böckenförde</surname>, <given-names>Ernst Wolfgang</given-names></author> (<year>1976</year>): <article-title>Staat, Gesellschaft, Freiheit</article-title>. <other>Frankfurt a.M	88.86062622070312	188.09210205078125	11.68914794921875	414.1491394042969	328
.</other>: <publisher>Suhrkamp</publisher>.</ref>	106.86013793945312	207.761474609375	10.98004150390625	53.14979553222656	328
<ref>• <author><surname>Bürmann</surname>, <given-names>Jörg</given-names></author> (<year>2003</year>): <article-title>Die Gesellschaft nach der Arbeit</article-title>. <other>Münster, Hamburg, London	88.86062622070312	226.792236328125	11.68914794921875	431.2691955566406	328
</other>, <publisher>Lit Verlag</publisher>.</ref>	106.86013793945312	246.46160888671875	10.98004150390625	49.55055236816406	328
<ref>• <author><surname>Croissant</surname>, <given-names>Aurel</given-names></author>/<author><given-names>Hans-Joachim</given-names> <surname>Lauth</surname></author>/<author><given-names>Wolfgang</given-names> <surname>Merkel</surname></author> (<year>2000</year>): <article-title>Zivilgesellschaft und	88.86062622070312	265.4330444335937	11.68914794921875	425.0895690917969	328
Transformation</article-title>. <other>In:</other> <editor>Wolfgang Merkel</editor> (<other>Hrsg.</other>): <source>Systemwechsel 5. Zivilgesellschaft und	106.86013793945312	285.16168212890625	10.98004150390625	411.4678039550781	328
Transformation</source>. <other>Opladen</other>: <publisher>Leske+budrich</publisher>, <other>S.</other> <fpage>9</fpage>-<lpage>49</lpage>.</ref>	106.86013793945312	304.1219482421875	10.98004150390625	244.21273803710938	328
<ref>• <author><surname>Dahrendorf</surname>, <given-names>Ralf</given-names></author> (<year>2003</year>): <article-title>Auf der Suche nach einer neuen Ordnung: Vorlesungen zur	88.86062622070312	323.0933837890625	11.689117431640625	429.0016784667969	328
Politik der Freiheit im 21. Jahrhundert</article-title>. <other>München</other>: <publisher>C.H. Beck</publisher>. <volume>4</volume>.<other>Auflage 2007</other></ref>	106.86013793945312	342.82208251953125	10.97998046875	369.89202880859375	328
<ref>• <author><surname>Di Fabio</surname>, <given-names>Udo</given-names></author> (<year>2007</year>): <article-title>Gemeinsinn zwischen Rationalität und Romantik. Rede 	88.86062622070312	361.7923583984375	11.68914794921875	394.017333984375	328
anlässlich 50 Jahre Aktion Gemeinsinn	106.86013793945312	381.5210876464844	10.97998046875	192.5738220214844	328
