achieved 73% of the total vote. The new executive did not alter the agenda of	128.7003631591797	322.31610107421875	9.480010986328125	303.6282501220703	19
structural reforms, facing also major pressures from the EU to call for a bailout,	128.7003631591797	333.8362121582031	9.47998046875	303.60353088378906	19
after the downgrade of several Spanish banks’ credit ratings. Indeed, the hous-	128.7003631591797	345.29656982421875	9.47998046875	303.62449645996094	19
ing bubble crisis was evolved to a financial crisis in the banking system, partic-	128.70037841796875	356.816650390625	9.47998046875	303.6671447753906	19
ularly in the local and regional semipublic saving banks (cajas de ahorro).	128.70037841796875	368.33673095703125	9.47998046875	303.64154052734375	19
Finally, the PP government accepted a bailout deal from the EU to the banking	128.70037841796875	379.77044677734375	9.506622314453125	303.62921142578125	19
system under the form of a loan to recapitalize Spain’s weakest banks (De	128.70037841796875	391.3171691894531	9.47998046875	303.65771484375	19
Guindos, 2016). In exchange, the government implemented new reforms and	128.70037841796875	402.8372497558594	9.47998046875	303.5628356933594	19
accepted European monitoring of Spanish banking reform. However, the state	128.70037841796875	414.297607421875	9.47998046875	303.60748291015625	19
of the economy still experienced strong pressures during Rajoy’s first terms.	128.70037841796875	425.81768798828125	9.47998046875	303.6443786621094	19
Thus, public debt evolved from 69,5% (2011) to 99,3% of the GDP (2014),	128.70037841796875	437.3377685546875	9.47998046875	303.5192565917969	19
public deficit increased to -10,4% (2012), although budget cuts helped to re-	128.70037841796875	448.7981262207031	9.47998046875	303.5960388183594	19
duce it to -5.9% (2014). In turn, unemployment peaked in 2013 to almost five	128.70037841796875	460.3182067871094	9.47998046875	303.6302185058594	19
million people, while the youth unemployment rate reached 56% by that time,	128.70037841796875	471.8382873535156	9.47998046875	303.6539306640625	19
although since 2014 it started to decrease slightly5.	128.70037841796875	483.29864501953125	9.47998046875	303.6319580078125	19
The poor economic performance during the first years of the Rajoy govern-	128.70037841796875	492.9815368652344	11.317169189453125	192.92962646484375	19
ment, and the deepening of the social consequences of the austerity policies	140.0396728515625	506.334716796875	9.47998046875	292.21142578125	19
fuelled political disaffection and electoral volatility (Cordero and Montero	128.69969177246094	517.7950439453125	9.47998046875	303.6595916748047	19
4 In this respect, Castells (2011) argued that the exit from the Eurozone was the only way for	128.69969177246094	529.3151245117188	9.47998046875	303.55140686035156	19
the recovery of the Spanish economy. Similarly, Fernández-Albertos and Sánchez-Cuenca	128.6999969482422	557.21484375	9.6839599609375	303.69078063964844	20
(2013) defended that Spain should leave the euro if the EU could not strengthen the politi-	137.2201690673828	568.2186889648438	7.97998046875	295.0070343017578	20
cal integration.	137.2193603515625	577.5185546875	7.97998046875	295.11712646484375	20
5 The source for all data reported in this paragraph is Eurostat.	137.21934509277344	586.8184814453125	7.9799957275390625	48.411468505859375	20
HSR 41 (2016) 4 │ 218	128.6999969482422	594.4749145507812	9.683853149414062	202.7166290283203	20
2015, 350; Urquizu 2015). In 2012 and 2013 several surveys detected a dra-	241.97999572753906	627.35302734375	8.135208129882812	76.95033264160156	21
matic collapse of the support for the two main Spanish parties, while the exist-	128.6999969482422	115.3145751953125	9.48004150390625	303.54676818847656	22
ing small parties did not really benefited from this (Rodríguez-Teruel 2013),	128.6999969482422	126.83465576171875	9.48004150390625	303.6159210205078	22
suggesting a failure of the political supply in Spain (Fernández-Albertos 2015).	128.6999969482422	138.2950439453125	9.48004150390625	303.6235809326172	22
In this context, the European election in May 2014 triggered an unprecedented	128.6999969482422	149.81512451171875	9.48004150390625	303.59031677246094	22
electoral dealignment, with the appearance of new parties like Podemos and	128.6999969482422	161.335205078125	9.48004150390625	303.6282196044922	22
Ciudadanos on the EP, while the two main parties did not achieved even a 50%	128.6999969482422	172.79559326171875	9.48004150390625	303.57701110839844	22
of the total vote. The electoral change came mainly from young, urban, politi-	128.6999969482422	184.315673828125	9.48004150390625	303.6451873779297	22
cally-informed voters (Cordero and Montero 2015; Fernández-Albertos 2015).	128.6999969482422	195.83575439453125	9.48004150390625	303.57801818847656	22
Amongst these voters, European attachment was significantly stronger com-	128.6999969482422	207.296142578125	9.48004150390625	303.59312438964844	22
pared to the older electorate, although they seemed to express less interest in	128.6999969482422	218.81622314453125	9.48004150390625	303.5286102294922	22
the European election (Rodríguez-Teruel 2014). Interestingly, Spain remained	128.6999969482422	230.3363037109375	9.48004150390625	303.64146423339844	22
the largest country in the EU without Eurosceptic and far-right parties.	128.6999969482422	241.79669189453125	9.48004150390625	303.64442443847656	22
3.	128.6999969482422	253.3167724609375	9.48004150390625	268.19105529785156	22
3.1	128.6999969482422	287.12445068359375	12.47998046875	8.797149658203125	23
Theoretical Expectations and Data	128.6999969482422	318.64263916015625	10.97998046875	13.250656127929688	24
Expectations: Stability Rather than Change	157.05580139160156	287.12445068359375	12.47998046875	169.3186492919922	25
The financial crisis and its political consequences altered the position of Spain	157.0745086669922	318.64263916015625	10.97998046875	188.45411682128906	26
in the EU, as we have argued in the previous section. It changed from a story of	128.6999969482422	337.6745910644531	9.47998046875	303.6263885498047	27
economic success to a potential bailout, even though it would be ‘too big to	128.6999969482422	349.13494873046875	9.47998046875	303.7762908935547	27
fail’. This turn could not happen without affecting citizens’ perceptions of the	128.6999969482422	360.655029296875	9.47998046875	303.66807556152344	27
political system and its legitimacy, although this negative effect should not	128.6999969482422	372.17510986328125	9.47998046875	303.6206817626953	27
necessarily be immediate (Freire and Moury 2015, 179). Some figures show	128.6999969482422	383.6354675292969	9.47998046875	303.55433654785156	27
that trust in government and its ability to manage the crisis steadily declined as	128.6999969482422	395.1555480957031	9.47998046875	303.61973571777344	27
the crisis hit the Spanish economy, in a more consistent way than in other Eu-	128.6999969482422	406.6756286621094	9.47998046875	303.58848571777344	27
ropean countries (Roth 2009, 22). According to previous studies, the way citi-	128.6999969482422	418.135986328125	9.47998046875	303.6405487060547	27
zens perceive their national governments and institutions influences strongly	128.6999969482422	429.65606689453125	9.47998046875	303.5969696044922	27
their views and support for the EU (Anderson and Reichert 1995; Sánchez-	128.6999969482422	441.1761474609375	9.47998046875	303.6576690673828	27
Cuenca 2000). From a utilitarian perspective, this support is also explained by	128.6999969482422	452.6365051269531	9.47998046875	303.54957580566406	27
citizens’ perceptions of welfare gains from integration policies (Gabel 1998;	128.6999969482422	464.1565856933594	9.47998046875	303.56382751464844	27
Scharpf 1999). Hence, a regression in policy outcomes and the subsequent	128.6999969482422	475.6766662597656	9.47998046875	303.4955596923828	27
deterioration of the perception of national institutions might erode the support	128.6999969482422	487.13702392578125	9.47998046875	303.5997772216797	27
for the EU amongst citizens.	128.6999969482422	498.6571044921875	9.47998046875	303.6063995361328	27
However, these symptoms might not be necessarily appear among the politi-	128.6999969482422	510.17718505859375	9.47998046875	108.41708374023438	27
cal elite. Parliamentarians’ attitudes and perceptions are elaborated and sustained	140.03997802734375	521.6375732421875	9.47998046875	292.2475280761719	27
upon stronger cognitive support, since they are better informed about European	128.6999969482422	533.1575927734375	9.47998046875	303.71131896972656	27
issues and have a strongest attachment to the EU (Müller et al. 2012; Sojka et al.	128.6999969482422	544.677734375	9.47998046875	303.6540985107422	27
2015; Freire and Moury 2015). Indeed, as political representatives know better	128.6999969482422	556.1380615234375	9.47998046875	303.7449188232422	27
the limits in the EU’s room for manoeuvre, their expectations about the EU role	128.6999969482422	567.6581420898438	9.47998046875	303.80735778808594	27
are more in line with reality. In countries like Spain, where the potential for uni-	128.6999969482422	579.17822265625	9.480010986328125	303.71925354003906	27
lateral action is weaker, it might be even the case that such context of crisis could	128.6999969482422	590.6386108398438	9.479995727539062	303.68601989746094	27
HSR 41 (2016) 4 │ 219	128.6999969482422	602.15869140625	9.480010986328125	303.67091369628906	27
foster support for more integration, as the political elites might perceive that	241.97999572753906	627.35302734375	8.135208129882812	76.95033264160156	28
overcoming the current situation or avoiding new crisis in the future requires a	128.6999969482422	115.3145751953125	9.48004150390625	303.63780212402344	29
supranational solution. Alternatively, an opposite evolution is also possible, since	128.6999969482422	126.83465576171875	9.48004150390625	303.79881286621094	29
politicians could adopt more critic positions towards the EU in response to an	128.6999969482422	138.2950439453125	9.48004150390625	303.6916961669922	29
increase of Euroscepticism among voters (Hooghe and Marks 2009).	128.6999969482422	149.81512451171875	9.48004150390625	303.63768005371094	29
The main theoretical expectation in this article is that the attitudes of Span-	128.6999969482422	161.335205078125	9.48004150390625	255.14183044433594	29
ish MPs towards the EU have not significantly changed during the crisis. This	140.03997802734375	172.79559326171875	9.48004150390625	292.2040100097656	29
hypothesis is in line with the above mentioned arguments about elites’ higher	128.6999969482422	184.315673828125	9.48004150390625	303.5884552001953	29
cognitive competence and the political stability in parliament during the ob-	128.6999969482422	195.83575439453125	9.48004150390625	303.6234893798828	29
served period. Therefore, between 2004 and 2014, despite of the electoral	128.6999969482422	207.296142578125	9.48004150390625	303.5485382080078	29
changes mentioned in the previous section, the two main parties, both tradi-	128.6999969482422	218.81622314453125	9.48004150390625	303.58460998535156	29
tionally pro-EU, accounted for more than 80% of the seats at the lower house.6	128.6999969482422	230.3363037109375	9.48004150390625	303.4993133544922	29
Yet this does not mean the disappearance of ideological and party differences.	128.6999969482422	239.9615478515625	11.315185546875	303.59999084472656	29
In fact, some studies (Ruiz Jiménez and Egea de Haro 2011; Vázquez et al.	128.70016479492188	253.31463623046875	9.48004150390625	303.4860534667969	29
2014) have found differences in the pro-EU positions of PSOE and PP. For	128.70016479492188	264.834716796875	9.48004150390625	303.6150207519531	29
instance, the PSOE has traditionally shown a more federalist stance, while the	128.70016479492188	276.29510498046875	9.48004150390625	303.55908203125	29
PP has supported a view centred on the coincidence between EU and national	128.70016479492188	287.815185546875	9.48004150390625	303.6405029296875	29
interests. Hence, a second theoretical expectation is stable interparty divisions	128.70016479492188	299.33526611328125	9.48004150390625	303.5619812011719	29
along ideological divides in both main parties, even though we do not expect	128.70016479492188	310.795654296875	9.48004150390625	303.6045227050781	29
that these party differences respond to a high politicization of EU issues at the	128.70016479492188	322.31573486328125	9.480010986328125	303.6064758300781	29
national level. Consequently, they should not alter the general pattern of strong	128.70016479492188	333.8358459472656	9.47998046875	303.6188659667969	29
Europeanness amongst Spanish elites.	128.70016479492188	345.29620361328125	9.47998046875	303.7003479003906	29
3.2	128.70016479492188	356.8162841796875	9.47998046875	144.56903076171875	29
Dimensions of Europeanness	128.6999969482422	380.1426086425781	10.980010986328125	1
Our analysis focuses on the patterns of ‘Europeanness’ is defined here as a	164.09402465820312	380.1426086425781	10.980010986328125	124.34628295898438	31
“composite set of perceptions and sentiments” that drives political elites deci-	128.6999969482422	399.1145935058594	9.47998046875	303.5552520751953	32
sions and behaviours in the European integration (Best, Lengyel and Verzichel-	128.6999969482422	410.6346740722656	9.47998046875	303.54481506347656	32
li 2012, 8). In this sense, the concept departs from more generic uses in cultural	128.6999969482422	422.09503173828125	9.47998046875	303.6055450439453	32
and identity studies, and captures several aspects of attitudes and preferences	128.6999969482422	433.6151123046875	9.47998046875	303.65098571777344	32
towards European integration. Following those authors, Europeanness becomes	128.6999969482422	445.13519287109375	9.47998046875	303.5960235595703	32
a multidimensional concept including the emotive, cognitive-evaluative, and	128.6999969482422	456.5955505371094	9.47998046875	303.5789337158203	32
projective-conative dimensions (ibid. 8). The emotive dimension refers to	128.6999969482422	468.1156311035156	9.47998046875	303.6604766845703	32
feelings of attachment and thus towards the European integration. The cogni-	128.6999969482422	479.6357116699219	9.47998046875	303.57044982910156	32
tive-evaluative dimension includes attitudes dealing with the working of the	128.6999969482422	491.0960693359375	9.47998046875	303.55995178222656	32
EU and its scope of governance. Finally, the projective-conative dimension is	128.6999969482422	502.61614990234375	9.47998046875	303.54673767089844	32
based on the prospects and preferences for higher levels of European unifica-	128.6999969482422	514.13623046875	9.47998046875	303.56275939941406	32
tion and integration in the future.	128.6999969482422	525.5965576171875	9.47998046875	303.55528259277344	32
Hence, the empirical data will be developed in the three sets of indicators	128.6999969482422	537.11669921875	9.47998046875	125.62136840820312	32
corresponding to the dimensions previously mentioned. First, attitudes of sup-	140.03997802734375	548.63671875	9.47998046875	292.3091125488281	32
6 The proportion of seats at the Spanish low chamber by PSOE and PP was 89% (2004), 92%	128.6999969482422	560.0971069335938	9.47998046875	303.5315704345703	32
(2008) and 84% (2011).	128.6999969482422	585.1148681640625	9.683914184570312	303.5631561279297	33
HSR 41 (2016) 4 │ 220	137.2201690673828	596.1785278320312	7.9799957275390625	75.22348022460938	33
port for the EU, related to the emotive dimension (trust in EU institutions,	241.97999572753906	627.35302734375	8.135208129882812	76.95033264160156	34
attachment to the EU, and general support to the integration process). Second,	128.6999969482422	115.3145751953125	9.48004150390625	303.6482391357422	35
opinions and preferences on working of EU institutions and their scope of	128.70001220703125	126.83465576171875	9.48004150390625	303.5600280761719	35
governance (related to the cognitive dimension), including issues about how	128.70001220703125	138.2950439453125	9.48004150390625	303.53533935546875	35
the EU faced the financial crisis. Finally, options regarding the future of the	128.70001220703125	149.81512451171875	9.48004150390625	303.5636901855469	35
EU, including expectations and threats (conative dimension).	128.70001220703125	161.335205078125	9.48004150390625	303.70318603515625	35
MPs	128.70001220703125	172.79559326171875	9.48004150390625	232.2003173828125	35
%	210.9600067138672	234.9893798828125	7.5	12.0	36
Inter-	213.89999389648438	252.6893310546875	7.5	6.1199951171875	37
views	237.24000549316406	234.9893798828125	7.5	16.379257202148438	38
Freq.	237.66000366210938	243.6893310546875	7.5	15.540008544921875	38
Gender	238.6199951171875	252.6893310546875	7.5	13.55999755859375	38
Composition	277.8599853515625	234.9893798828125	7.5	20.51251220703125	39
Women Men	270.3599853515625	243.6893310546875	7.5	35.50347900390625	39
Experience:	262.79998779296875	252.6893310546875	7.5	46.37249755859375	39
First Mandate	329.82000732421875	234.9893798828125	7.5	32.03399658203125	40
Women Men	326.4599914550781	243.6893310546875	7.5	38.80499267578125	40
Experience:	320.5799865722656	252.6893310546875	7.5	46.49249267578125	40
more than one term	387.5400085449219	234.9893798828125	7.5	32.03399658203125	41
Women Men	375.17999267578125	243.6893310546875	7.5	56.82147216796875	41
3.3	378.29998779296875	252.6893310546875	7.5	46.37249755859375	41
Data	128.6999969482422	196.12261962890625	10.97998046875	13.270431518554688	42
Table 1: Sample for Spain in ENEC-2014	157.1041717529297	196.12261962890625	10.97998046875	20.487579345703125	43
(PPaPr)tido Popular 52,9 40 13	128.6999969482422	217.86065673828125	9.49554443359375	157.7377166748047	44
POabrrteidroo ESsopcaiñaloislt(aPSOE) 31,4 26 11	129.77999877929688	261.62933349609375	16.260009765625	147.63751220703125	45
IIzzqquuiieerrddaa UPlnuirdaal- 3,1 4 1	129.77999877929688	279.329345703125	16.2598876953125	147.63751220703125	45
DUenmióonc,rParcoiagr(eUsPoyyD) 1,4 1 0	129.77999877929688	297.02935791015625	16.260009765625	147.572265625	45
Grupo Parlamentario	129.77999877929688	314.7293701171875	16.20001220703125	147.572265625	45
Catalán (Convergencia i 4,6 3 2	129.77999877929688	332.4293518066406	7.5	62.583770751953125	45
Unió, CiU)	129.77999877929688	341.12933349609375	7.500030517578125	147.572265625	45
Grupo Parlamentario	129.77999877929688	349.88934326171875	7.5	30.116256713867188	45
Vasco (Partido Nacional- 1,4 1 0	129.77999877929688	358.829345703125	7.5	60.712493896484375	45
ista Vasco, PNV)	129.77999877929688	367.58935546875	7.5	147.572265625	45
Others 5,1 6 2	129.77999877929688	376.28936767578125	7.5	45.764251708984375	45
Total (n) 350 81 29	129.77999877929688	385.28936767578125	7.5	147.60601806640625	45
Source: Project ENEC (Spain); Real Dato (2016, 22).	129.77999877929688	394.2293701171875	7.5	147.69003295898438	45
27	128.6999969482422	403.3387756347656	7.97998046875	162.2517852783203	45
15	298.260009765625	266.00933837890625	7.5	7.537506103515625	46
3	298.260009765625	283.7092285
1	
1	30
1	30
4	30
52	302.005
The empirical basis for our analysis comes from the data gathered by the two	298.3125305175781	394.2293701171875	7.5	7.5337
waves of the elite survey of the IntUne project (2007 and 2009) and the recent	128.6999969482422	422.5745849609375	9.47998046875	303.5694122314453	53
ENEC survey (2014) conducted amongst national parliamentarians from sever-	128.6999969482422	434.0349426269531	9.47998046875	303.4633026123047	53
al European countries. This allows us to develop a comparative analysis across	128.6999969482422	445.5550231933594	9.47998046875	303.62071228027344	53
three parliamentary terms in Spain, covering the different periods described in	128.6999969482422	457.0751037597656	9.47998046875	303.6622772216797	53
the historical section. The content of the IntUne 2007 and 2009 elite surveys in	128.6999969482422	468.53546142578125	9.47998046875	303.63294982910156	53
Spain was presented and analysed in previous works (Jerez, Real-Dato and	128.6999969482422	480.0555419921875	9.47998046875	303.5628204345703	53
Vázquez 2010, 2015a). Regarding the 2014 ENEC survey, it basically repeated	128.6999969482422	491.57562255859375	9.47998046875	303.53819274902344	53
the structure and questions of the IntUne elite surveys, with some additional	128.6999969482422	503.0360107421875	9.47998046875	303.62733459472656	53
questions aimed at grasping the mood of national political representatives dur-	128.6999969482422	514.5560302734375	9.47998046875	303.54298400878906	53
ing the crisis. The sample consisted of 81 MPs, following the research design	128.6999969482422	526.076171875	9.47998046875	303.59507751464844	53
of the project (see Table 1). The fieldwork was implemented between October	128.6999969482422	537.5364990234375	9.47998046875	303.5069122314453	53
21st 2014 and February 18th 2015 – though almost all but three interviews	128.6999969482422	549.0565795898438	9.47998046875	303.60826110839844	53
were conducted before the end of 2014. Most of the interviews were face-to-	128.6999969482422	560.57666015625	9.47998046875	303.61302185058594	53
face (76.5%), while the rest were conducted by telephone. In this article, the	128.6999969482422	572.0369873046875	9.47998046875	303.63771057128906	53
sample is weighted by three criteria: parliamentary group, gender and past	128.6999969482422	583.55712890625	9.480010986328125	303.62355041503906	53
HSR 41 (2016) 4 │ 221	128.6999969482422	595.0772094726562	9.479995727539062	303.59413146972656	53
4	241.97999572753906	627.35302734375	8.135208129882812	76.95033264160156	54
4	331.5	266.00933837890625	7.5	3.75750732
1	331.5000305175781	283.709228515625	7.5	3.75750732
0	33
1	331.49627685546875	319.1
0	33
1	331.49627685546875	367.58935546875	7.5	3.7575
11	33
15	327.82879638671875	394.229370
7	356.1600036621094	266.00933837890625	7.5	7.5375061035
2	359.8800354003906	283.
1	359.877014160156
1	359.8770
0	359.8770
3	359.877
29	
9	356.2050476074219	394.2
7	38
0	389.100036621093
0	389.
1	389.
0	389.0977783203
1	389.
18	389.
12	385.4212951660156	394.229370117
8	413.760009765625	266.00933837890625	7.5	7.537506103515625	76
1	417.4
0	4
0	417.478515625	319.1
1	417.478515625	341.129333496
1	4
23	4
parliamentary experience (Table 1). The deviation rate respect to the designed	413.79754638671875	394.2293701171875	7.5	7.53375244140625	82
sample is 1.4% for party, 4.2% for sex (with a slight underrepresentation of	128.6999969482422	115.3145751953125	9.48004150390625	303.5542449951172	83
female MPs), and 0.5% for experience.	128.6999969482422	126.83465576171875	9.48004150390625	303.5126190185547	83
Data collection took place two years after the formation of the PP govern-	128.6999969482422	138.2950439453125	9.48004150390625	148.7554168701172	83
ment with a strong parliamentarian majority. In this respect, the 2014 ENEC	140.03997802734375	149.81512451171875	9.48004150390625	292.1915588378906	83
dataset differs from the two previous IntUne wages, conducted under PSOE	128.6999969482422	161.335205078125	9.48004150390625	303.58656311035156	83
governments. The party composition is indeed the main difference between	128.6999969482422	172.79559326171875	9.48004150390625	303.6718292236328	83
both datasets. Our analysis controls for this factor when it comes to interpret	128.6999969482422	184.315673828125	9.48004150390625	303.68312072753906	83
significant differences across time, by distinguishing between PSOE and PP	128.6999969482422	195.83575439453125	9.48004150390625	303.59120178222656	83
parliamentarians, or between left and right parties.	128.6999969482422	207.296142578125	9.48004150390625	303.63111877441406	83
4.	128.6999969482422	218.81622314453125	9.48004150390625	191.58888244628906	83
Findings: The Stability of Spanish Parliamentary Elite’s	128.6999969482422	252.62445068359375	12.47998046875	8.802139282226562	84
Europeanness	151.3661651611328	252.62445068359375	12.47998046875	269.5679168701172	85
The empirical results are presented following the three sets of indicators em-	151.3800048828125	267.14459228515625	12.47998046875	67.73019409179688	85
ployed to depict the patterns of Europeanness that we observed in the Spanish	128.6999969482422	292.91455078125	9.48004150390625	303.5495147705078	86
elite. Our analysis focus on the extent of change or stability detected in 2014	128.6999969482422	304.37493896484375	9.48004150390625	303.63389587402344	86
compared to the previous survey waves. In those cases of where significant	128.6999969482422	315.89501953125	9.48004150390625	303.5457000732422	86
differences are found, we check whether party differences are responsible for	128.6999969482422	327.41510009765625	9.480010986328125	303.5239715576172	86
these changes.	128.6999969482422	338.87548828125	9.47998046875	303.5959930419922	86
4.1	128.6999969482422	350.39556884765625	9.47998046875	54.85130310058594	86
The Emotive Dimension: Attitudes of Support to the EU	128.6999969482422	373.7226257324219	10.980010986328125	13.252853393554688	87
Most aspects dealing with the emotive dimension of Spanish parliamentarians’	157.07778930664062	373.7226257324219	10.980010986328125	242.08590698242188	88
Europeanness does not show major changes during the period 2007-2014 (Fig-	128.6999969482422	392.694580078125	9.47998046875	303.48313903808594	89
ure 1). This general stability confirms the high level of support for European	128.6999969482422	404.1549377441406	9.47998046875	303.62632751464844	89
integration among Spanish MPs. Only the level of trust in the European Par-	128.6999969482422	415.6750183105469	9.47998046875	303.56666564941406	89
liament (EP) has experienced a statistically significant increase from 6.3 in	128.6999969482422	427.1950988769531	9.47998046875	303.67747497558594	89
