governance (Marshall 2005).	85.08000183105469	86.74981689453125	12.0	152.7216033935547	30	ArialMT
Sociological approaches refer to the notion of “tacit knowledge”, which goes back	85.08000183105469	114.34979248046875	12.0	439.39442443847656	31	ArialMT
to the work of Polanyi (1985): a “canon of knowledge” is forming an integral part of	85.08001708984375	128.1497802734375	12.0	439.3787841796875	31	ArialMT
the individual and social life. This canon not only entails explicit forms of	85.08001708984375	141.94976806640625	12.0	439.35113525390625	31	ArialMT
knowledge to be learnt, but also deep-rooted and prevailing forms of implicit	85.07998657226562	155.749755859375	12.0	439.2911682128906	31	ArialMT
knowledge. This knowledge has the function to be an essential cultural frame in	85.07998657226562	169.54974365234375	12.0	439.3392028808594	31	ArialMT
the context of daily working and acting.	85.0799560546875	183.3497314453125	12.0	206.81161499023438	31	ArialMT
“It is not only instrumental in helping finding one’s way through the labyrinth of	112.07990264892578	208.246337890625	10.02001953125	381.68785858154297	32	ArialMT
modern, differentiated and pluralized societies, but also implies understandings of a	112.07990264892578	219.76934814453125	10.02001953125	381.76207733154297	32	ArialMT
certain moral order that cannot be reduced to its functionality in steering social	112.07990264892578	231.23223876953125	10.02001953125	381.7379684448242	32	ArialMT
practices. Usually the implied reference of the pursuing of social practices to social	112.07989501953125	242.7552490234375	10.02001953125	381.92034912109375	32	ArialMT
imaginaries and their normative taint goes without saying. Under conditions of societal	112.07989501953125	254.27825927734375	10.02001953125	381.8481140136719	32	ArialMT
transformation, however, practices become transparent as to their moral references,	112.07989501953125	265.74114990234375	10.02001953125	381.7369689941406	32	ArialMT
and thus questionable and criticisable on the grounds of their normative	112.07991027832031	277.26416015625	10.02001953125	381.7239227294922	32	ArialMT
embeddedness and their moral implications” (Langenohl/Westphal 2007: 9).	112.07991027832031	288.78717041015625	10.02001953125	335.7281951904297	32	ArialMT
With regard to normative socio-economic aspects underlying European policy	85.08000183105469	312.10980224609375	12.0	439.31532287597656	33	ArialMT
fields, the relevant philosophy of EU institutions towards that policy field has been	85.08000183105469	325.9097900390625	12.0	439.37757873535156	33	ArialMT
formed over a long period of time. It finds expression in the policy content as well	85.07998657226562	339.70977783203125	12.0	439.4039611816406	33	ArialMT
as in the promotion of certain procedures, by which the policy is carried through.	85.07998657226562	353.509765625	12.0	439.2215881347656	33	ArialMT
Nevertheless these underlying norms and rules are a dynamic explanans; they are	85.07998657226562	367.30975341796875	12.0	439.3535461425781	33	ArialMT
thus susceptible to processes of adaptations and changes over time.	85.07998657226562	381.1097412109375	12.0	364.4255676269531	33	ArialMT
Moreover, the relevant codes of communication and codes of bargaining,	85.08000183105469	408.7098083496094	12.0	439.2791290283203	34	ArialMT
applicable in the daily administrative and political work as well as in the internal	85.07998657226562	422.5097961425781	12.0	439.2948303222656	34	ArialMT
decision-making processes of EU institutions, have been internalized by the EU	85.07998657226562	436.3097839355469	12.0	439.3199768066406	34	ArialMT
personnel, the national delegations, the lobbyists and the MEPs, respectively7.	85.07998657226562	447.62823486328125	14.4815673828125	439.3559875488281	34	ArialMT
The enlargement of the European Union entails a kind of societal transformation	85.07998657226562	463.9097900390625	12.0	439.3332214355469	34	ArialMT
within EU institutions: While internal and external rules of the game become	85.07998657226562	477.70977783203125	12.0	439.2840270996094	34	ArialMT
transparent, this implicit knowledge has to be incorporated and habitualized by	85.07998657226562	491.509765625	12.0	439.2431945800781	34	ArialMT
members of the group of EU-8. While the foundation of this knowledge is a	85.07998657226562	505.30975341796875	12.0	439.4040222167969	34	ArialMT
dynamic one that allows for continuity as well as for changes, this special	85.07998657226562	519.1097412109375	12.0	439.3403625488281	34	ArialMT
transformation phase might entail a recomposition or a reconfiguration of	85.07998657226562	532.9097290039062	12.0	439.2287902832031	34	ArialMT
formalized knowledge and of principle frameworks8 to be applicable in the	85.07998657226562	544.2281494140625	14.481689453125	439.3608093261719	34	ArialMT
enlarged EU of now 27 Member States. The circulation of ideas and values as well	85.07998657226562	560.509765625	12.0	439.3487854003906	34	ArialMT
as the application of new strategies and innovative approaches can be described	85.07997131347656	574.309814453125	12.000015258789062	439.34153747558594	34	ArialMT
as cognitive Europeanization, in which personal and institutionalized aspects are	85.07997131347656	588.1098022460938	12.0	439.29600524902344	34	ArialMT
interwoven (Langenohl/Westphal 2007: 2). In general, concepts with reference to	85.07998657226562	601.9097900390625	12.0	439.3020324707031	34	ArialMT
“implicit knowledge”, social capital or “common sense” enable to put an academic	85.07998657226562	615.7098388671875	12.0	439.2480163574219	34	ArialMT
gloss on insights of social practice that seem obvious, and at other times yield	85.07998657226562	629.5098266601562	12.0	439.4160461425781	34	ArialMT
surprising results.	85.07998657226562	643.309814453125	12.0	94.00559997558594	34	ArialMT
7 Implicit knowledge can be realized inter-subjectively by socialization. Thereby, knowledge either	85.08000183105469	701.713623046875	11.912704467773438	439.30433654785156	35	ArialMT
retains its implicit form or it will be externalized, and thus transformed into explicit knowledge. This	85.07351684570312	715.1293334960938	10.019996643066406	439.3448791503906	35	ArialMT
happens through the process of articulation and codification.	85.07351684570312	726.65234375	10.019996643066406	266.8005676269531	35	ArialMT
8 While the knowledge is subject to different traditions, it is changeable and flexible through daily	85.08000183105469	736.2136840820312	11.912635803222656	439.3084259033203	35	ArialMT
action and experience. In the long run, also rules of institutions are considered as being permeable	85.08352661132812	749.689453125	10.019996643066406	439.3609313964844	35	ArialMT
and are thus considered to be possibly reconstructed.	85.08354187011719	761.15234375	10.019996643066406	237.33070373535156	35	ArialMT
6	518.4000244140625	37.36334228515625	12.0	6.0	36	TimesNewRomanPSMT
The actual dilemmas and difficulties of the societies of new Member States in the	85.08000183105469	72.9498291015625	12.0	439.3535919189453	37	ArialMT
phase of consolidation are conceptually underpinned by political culture, cultural	85.07998657226562	86.74981689453125	12.0	439.3727722167969	37	ArialMT
legacies, traditions of election and euro-scepticism (Taggert/Szcerbiak 2004) as	85.07998657226562	100.5498046875	12.0	439.3655700683594	37	ArialMT
well as by aspects of collective identity (Ademczyk/Gostmann 2007).	85.07998657226562	114.34979248046875	12.0	363.4991760253906	37	ArialMT
Vectors of Influence	85.08000183105469	142.33514404296875	12.0	114.68759155273438	38	Arial-BoldMT
The first factors influencing the degree of socialization and embeddedness in the	85.08000183105469	169.5498046875	12.0	439.4064483642578	39	ArialMT
internal negotiation structures of relevant EU institution as well as the frames of	85.07998657226562	183.34979248046875	12.0	439.2599792480469	39	ArialMT
perception, are skills and training of actors of the EU-8: The highly skilled staff of	85.07998657226562	197.08978271484375	12.0	439.3559875488281	39	ArialMT
the Brussels scene might have benefited from traineeships or preparatory	85.07998657226562	210.8897705078125	12.0	439.3548278808594	39	ArialMT
administrative programmes such as Twinning9, the observer status in EU	85.08000183105469	222.22003173828125	14.48748779296875	439.3332061767578	39	Arial-ItalicMT
institutions such as the Committee of Regions and the European Parliament. This	85.07998657226562	238.48980712890625	12.01776123046875	439.3895568847656	39	Arial-ItalicMT
has enabled the participants of the Candidate States to already getting a feeling	85.0799560546875	252.289794921875	12.0	439.37164306640625	39	ArialMT
for the setting and the internal (explicit and implicit) rules of each institution.	85.0799560546875	266.08978271484375	12.0	399.523193359375	39	ArialMT
Moreover, in the field of training and education actors might have participated in	85.08000183105469	293.6898193359375	12.0	439.40162658691406	40	ArialMT
European-focused study programmes and language courses before the accession	85.08001708984375	307.48980712890625	12.0	439.2960205078125	40	ArialMT
in 2004. Through multi-lingual interdisciplinary education and training there is an	85.08001708984375	321.289794921875	12.0	439.31280517578125	40	ArialMT
indirectly growing elite consensus over Europe: “One has to bear in mind that	85.08001708984375	335.08978271484375	12.0	439.36077880859375	40	ArialMT
throughout the region there is a relatively high degree of consensus among	85.08001708984375	348.8897705078125	12.0	439.32244873046875	40	ArialMT
(political) elites about the positive nature of European integration”	85.08001708984375	362.68975830078125	12.0	439.25274658203125	40	ArialMT
(Taggert/Szczerbiak 2004: 3). While the quality of human capital in the European-	85.08001708984375	376.48974609375	12.0	439.15435791015625	40	ArialMT
centred administration is improving, a re-formation or a refining of knowledge	85.08001708984375	390.28973388671875	12.0	439.32958984375	40	ArialMT
takes place: The capacity of this elite-circle enables for a differentiated EU-	85.08001708984375	404.0897216796875	12.0	439.26483154296875	40	ArialMT
focused thinking within line ministries and back-offices to support the Brussels	85.08003234863281	417.88970947265625	12.0	439.2347869873047	40	ArialMT
actors in a qualified way.	85.08001708984375	431.689697265625	12.0	131.40599060058594	40	ArialMT
From the perspective of new East and Central European Member States the year	85.08000183105469	459.2898254394531	12.0	439.2671661376953	41	ArialMT
of accession 2004 marked a rapid and dense flow of EU-focused expertise to the	85.08001708984375	473.0898132324219	12.0	439.26959228515625	41	ArialMT
Brussels arena. At the same time it is clear that a great number of EU	85.08001708984375	486.8898010253906	12.0	439.3812255859375	41	ArialMT
administrative staff is allotted from national line ministries for a period of three to	85.08004760742188	500.6898193359375	12.0	439.3223571777344	41	ArialMT
five years. Within the group of EU-8 the potential to nominate high-qualified EU	85.08004760742188	514.48974609375	12.0	439.3260192871094	41	ArialMT
personnel from line ministries and from political parties for posts in the Brussels	85.08004760742188	528.289794921875	12.0	439.2947692871094	41	ArialMT
scene varies. A characteristic of these newly formed networks is that they are	85.08004760742188	542.0897216796875	12.0	439.4208068847656	41	ArialMT
composed of relatively young, dynamic and flexible professionals. This means that	85.08004760742188	555.8897705078125	12.0	439.3752136230469	41	ArialMT
they are likely to regard the period of election, delegation or allotment in the	85.08004760742188	569.689697265625	12.0	439.3415832519531	41	ArialMT
Brussels arena as a further step of underlying carrier opportunities in the national	85.08004760742188	583.48974609375	12.0	439.3320007324219	41	ArialMT
context.	85.08004760742188	597.2897338867188	12.0	42.02400207519531	41	ArialMT
With respect to Cohesion Policy the Polish side was able to send and to nominate	85.08000183105469	624.8898315429688	12.0	439.3583526611328	42	ArialMT
(much more intensively than e.g. the Hungarian side) experts in the field of	85.07998657226562	638.6898193359375	12.0	439.3320007324219	42	ArialMT
regionalisation and strong advocates of an integrated regional policy: They	85.07998657226562	652.4898681640625	12.0	439.3415832519531	42	ArialMT
possess technical and administrative expertise and they are personalities with a	85.07998657226562	666.2898559570312	12.0	439.3667907714844	42	ArialMT
European mission (personal expertise). Consequently, they were allotted high	85.07998657226562	680.08984375	12.0	439.4411926269531	42	ArialMT
ranking posts such as Commissioner for Regional Policy within the European	85.07998657226562	693.8898315429688	12.01776123046875	439.3560485839844	42	Arial-ItalicMT
Commission or (Vice-)Chairmen of Committees in the European Parliament such	85.07998657226562	707.6898193359375	12.0	439.2900085449219	42	ArialMT
9 On the basis of Twinning programmes bilateral administrative contacts between administrative	85.08000183105469	733.6241455078125	14.096961975097656	439.36610412597656	43	Arial-ItalicMT
staff of old and new Member States which proofed valuable might be continued on a regular basis.	85.08311462402344	749.6903076171875	10.019996643066406	439.3590850830078	43	ArialMT
These networks which represent a form of transnational openness, are informal training areas.	85.08309936523438	761.1531982421875	10.019996643066406	416.9541931152344	43	ArialMT
7	518.4000244140625	37.36334228515625	12.0	6.0	44	TimesNewRomanPSMT
as the Committee for Regional Development. These persons have in common that	85.08000183105469	72.9498291015625	12.01776123046875	439.24562072753906	45	Arial-ItalicMT
they have an international academic background in combination with formerly	85.08000183105469	86.74981689453125	12.0	439.2887725830078	45	ArialMT
high-ranking posts within the national administration and the political scene	85.08001708984375	100.5498046875	12.0	439.33795166015625	45	ArialMT
respectively10. While they are using the Brussels experience to shape their	85.08000183105469	111.86822509765625	14.4815673828125	439.2552032470703	45	ArialMT
respective home career, they are supposed to have strong connections to the	85.08001708984375	128.1497802734375	12.0	439.3236083984375	45	ArialMT
national part of the Brussels scene.	85.08001708984375	141.94976806640625	12.0	187.51678466796875	45	ArialMT
The second factor refers to the political background in East and Central European	85.08000183105469	169.5498046875	12.0	439.3583526611328	46	ArialMT
Member States to allow for a relative independence and support which also	85.07998657226562	183.34979248046875	12.0	439.3631896972656	46	ArialMT
implies a close, trustworthy and open correspondence with national actors of the	85.07997131347656	197.08978271484375	12.0	439.35594177246094	46	ArialMT
Brussels scene. That means that there must be congruence between the content	85.0799560546875	210.8897705078125	12.0	439.2083740234375	46	ArialMT
of European-inspired thinking and the national elite’s positioning on the	85.0799560546875	224.68975830078125	12.0	439.38720703125	46	ArialMT
transnational European integration process. Moreover, optimal chains of	85.0799560546875	238.48974609375	12.0	439.38116455078125	46	ArialMT
communication to transfer the European-inspired knowledge adequately have to	85.07994079589844	252.28973388671875	12.0	439.3056182861328	46	ArialMT
be guaranteed.	85.0799560546875	266.0897216796875	12.0	80.70718383789062	46	ArialMT
This European-inspired thinking affects questions of economic redistribution,	85.08000183105469	293.6898193359375	12.0	439.24562072753906	47	ArialMT
welfare and governmental regulation of the economy. These modes of distribution	85.07998657226562	307.48980712890625	12.0	439.3848571777344	47	ArialMT
are combined with several non-economic issues such as ecologist, gender and	85.07998657226562	321.289794921875	12.0	439.2768859863281	47	ArialMT
lifestyle (Marks et al 2006: 157). In other words this implies norms and rules set by	85.07998657226562	335.08978271484375	12.0	439.3320007324219	47	ArialMT
EU institutions to handle e.g. EU Cohesion Policy and the European employment	85.07998657226562	348.8897705078125	12.0	439.3200378417969	47	ArialMT
policy, thus the Lisbon Strategy for Growth and Jobs, and cross-sections such as	85.07998657226562	362.68975830078125	12.017730712890625	439.3080139160156	47	Arial-ItalicMT
the urban dimension, innovation policy, environmental protection, sustainable	85.07998657226562	376.48974609375	12.0	439.3655700683594	47	ArialMT
growth and even enlargement and energy policy. These consolidated ideals of	85.07998657226562	390.28973388671875	12.0	439.2527770996094	47	ArialMT
Western civilization also affect procedural aspects such as participatory decision-	85.07998657226562	404.0897216796875	12.0	439.2480163574219	47	ArialMT
making. In this logic e.g. the European Parliament is the embodiment of issues	85.07997131347656	417.88970947265625	12.017730712890625	439.36314392089844	47	Arial-ItalicMT
such as regionalization, culture, support of cultural and linguistic diversity as well	85.0799560546875	431.689697265625	12.0	439.315185546875	47	ArialMT
as social and territorial cohesion, which is now even codified in the Treaty of	85.07992553710938	445.48968505859375	12.017730712890625	439.3547668457031	47	Arial-ItalicMT
Lisbon.	85.07992553710938	459.3674011230469	12.0	38.601600646972656	47	Arial-ItalicMT
Given the political and economic transnationalization, which European integration	85.08000183105469	486.8898010253906	12.0	439.3656768798828	48	ArialMT
implies, it has to be reflected that the state is still a central agent and a centre	85.08000183105469	500.6898193359375	12.0	439.2887725830078	48	ArialMT
stage for transnational processes as well as a vehicle for transnational	85.08001708984375	514.48974609375	12.0	439.35235595703125	48	ArialMT
democratization (Langenohl/Westphal 2007: 8ff.). Moreover, it is important to	85.08001708984375	528.289794921875	12.0	439.40765380859375	48	ArialMT
understand the domestic context of party competition in order to gain a full picture	85.08001708984375	542.0897216796875	12.0	439.3367919921875	48	ArialMT
of the context for national elite positions on European integration	85.08003234863281	555.8897705078125	12.0	439.2479705810547	48	ArialMT
(Taggert/Szczerbiak 2004: 17f.). In other words, parties can be considered as	85.08001708984375	569.689697265625	12.0	439.25518798828125	48	ArialMT
gatekeepers for European interaction: European argumentation is closely related	85.08001708984375	583.48974609375	12.0	439.33197021484375	48	ArialMT
to positions in their party systems (Taggert/Szczerbiak 2004: 2). Consequently,	85.08001708984375	597.2897338867188	12.0	439.4075927734375	48	ArialMT
actors of the Brussels scene are through direct or indirect party affinity embedded	85.08001708984375	611.0897216796875	12.0	439.3800048828125	48	ArialMT
in different frames of political thinking, which implies understandings of a certain	85.08001708984375	624.8897705078125	12.0	439.33917236328125	48	ArialMT
moral order and based on different regulatory ideas as to wealth distribution within	85.07998657226562	638.6897583007812	12.0	439.3488464355469	48	ArialMT
a given society (Langenohl/Westphal 2007: 8). Actors have thus to adequately	85.07998657226562	652.48974609375	12.0	439.2696228027344	48	ArialMT
articulate political-societal projects to react to developments such as fragmenting,	85.08001708984375	666.289794921875	12.0	439.37640380859375	48	ArialMT
10 Apart from Commissioner Mrs. Danuta Hübner, the MEPs Mr. Janowski (Civic Platform -	85.08000183105469	701.713623046875	11.912704467773438	439.38209533691406	49	ArialMT
Platforma Obywatelska (PO)) and Mr. Olbrycht (PO) and Mr. Sariusz-Wolski (PO) can be	85.07708740234375	715.189453125	10.034767150878906	439.3028564453125	49	Arial-ItalicMT
mentioned. While from from 2004 onwards, e.g. the latter has been (Vice-) Chairman of the	85.07708740234375	726.65234375	10.019996643066406	439.3399658203125	49	ArialMT
Committee for External Affairs, he used to be Minister for European Affairs 1991-1996 and 2000-	85.07710266113281	738.1753540039062	10.019996643066406	439.4431610107422	49	ArialMT
2001 and Counceller for the Prime Minister for questions relating to European Integration. In	85.07710266113281	749.6983642578125	10.019996643066406	439.44712829589844	49	ArialMT
addition, he was Vice-Director of the European-oriented University of Natolin, Poland.	85.07710266113281	761.1612548828125	10.019996643066406	377.3622283935547	49	ArialMT
8	518.4000244140625	37.36334228515625	12.0	6.0	50	TimesNewRomanPSMT
disintegrative and exclusionary dynamics within societies. It is a discernible pattern	85.08000183105469	72.9498291015625	12.0	439.42323303222656	51	ArialMT
that it is easier for actors of oppositional parties to support pro-European views	85.08000183105469	86.74981689453125	12.0	439.30799865722656	51	ArialMT
and of having an increased interest to demonstrate leadership	85.07998657226562	100.5498046875	12.0	439.3631896972656	51	ArialMT
(Taggert/Szczerbiak 2004). The capacity for strategic thinking and the addressee-	85.07998657226562	114.34979248046875	12.0	439.2768249511719	51	ArialMT
orientation among politicians and administrative staff of the Brussels scene also	85.07998657226562	128.1497802734375	12.0	439.3716125488281	51	ArialMT
depends on the frequency of governmental changes: Political changes might be	85.07998657226562	141.94976806640625	12.0	439.3752136230469	51	ArialMT
coupled with a shuffling of personnel and thematic reorientations as well as with	85.07998657226562	155.749755859375	12.0	439.3259582519531	51	ArialMT
necessary changing loyalties11.	85.07998657226562	167.06817626953125	14.48162841796875	166.656005859375	51	ArialMT
As to the second factor it can be stated that Polish political activists for regional	85.08000183105469	197.08984375	12.0	439.3488311767578	52	ArialMT
policy of the Brussels scene are predominately pro-market libertarian oriented.	85.08001708984375	210.88983154296875	12.0	439.286376953125	52	ArialMT
This means that their party affiliation allows them - as concerns EU issues - to	85.08001708984375	224.6898193359375	12.0	439.4088134765625	52	ArialMT
support so-called new politics dimensions such as environment and participatory	85.08001708984375	238.48980712890625	12.0	439.29718017578125	52	ArialMT
decision-making (Henderson 2001: 10 in Marks et al 2006: 168). While parties	85.08001708984375	252.289794921875	12.0	439.40875244140625	52	ArialMT
aiming at a pro-market libertarian orientation were in opposition since the Polish	85.08001708984375	266.08978271484375	12.0	439.37762451171875	52	ArialMT
parliamentary elections of 2005 e.g. MEPs belonging to the PO were still in a	85.08003234863281	279.8897705078125	12.01776123046875	439.30796813964844	52	Arial-ItalicMT
position to argue more quality than quantity-oriented, together with a view on side-	85.08001708984375	293.68975830078125	12.0	439.3079833984375	52	ArialMT
policy fields: Given that opposition party members were nationally not directly	85.08004760742188	307.48974609375	12.0	439.2528381347656	52	ArialMT
responsible for the negotiation outcomes of the Councils of Ministers, they have	85.08004760742188	321.28973388671875	12.017730712890625	439.3919982910156	52	Arial-ItalicMT
had the freedom to think in different categories and to carve out creative niches	85.080078125	335.0897216796875	12.0	439.2587890625	52	ArialMT
while articulating political-societal projects. In this logic they could use the moral	85.08009338378906	348.88970947265625	12.0	439.33799743652344	52	ArialMT
embeddedness and integrational power of the relevant EU institution (and the	85.080078125	362.689697265625	12.0	439.362060546875	52	ArialMT
party family) for their transnational argumentation, while demonstrating an	85.080078125	376.48968505859375	12.0	439.3067626953125	52	ArialMT
openness for different regulatory ideas and an abandoning of nationally embedded	85.08006286621094	390.2896728515625	12.0	439.33314514160156	52	ArialMT
practices of norm- and rule-setting. This tendency is supported by the Polish	85.08004760742188	404.08966064453125	12.0	439.2912292480469	52	ArialMT
personnel of EU institutions such as the European Commission and the Council of	85.08004760742188	417.8896484375	12.017730712890625	439.2743835449219	52	Arial-ItalicMT
Ministers, which has been selected through big parties already in 2004.	85.08004760742188	431.68963623046875	12.017730712890625	377.55718994140625	52	Arial-ItalicMT
The negotiation potential of actors of the New Member States	85.08000183105469	459.67510986328125	12.0	349.3679962158203	53	Arial-BoldMT
In the empirical part three examples are highlighted to illuminate the power of the	85.08000183105469	486.8898010253906	12.0	439.35597229003906	54	ArialMT
alleged peripheral group of EU-8. That means that the management of structural	85.07998657226562	500.6898193359375	12.0	439.4016418457031	54	ArialMT
mismatches might be beneficial for the so called outsiders. This inferior position	85.07998657226562	514.48974609375	12.0	439.3835754394531	54	ArialMT
enables actors of this inner circle vis-à-vis their negotiation partners to	85.07998657226562	528.289794921875	12.0177001953125	371.6112365722656	54	Arial-ItalicMT
- be taken as an example because they have an openness for new thematic	103.08000183105469	542.08984375	12.0	412.98121643066406	54	ArialMT
fields (e.g. eco-tourism in the field of agriculture);	121.08000183105469	555.8897705078125	12.0	259.47837829589844	54	ArialMT
- introduce or suggest new and creative ways of thinking;	103.08000183105469	569.6898193359375	12.0	312.8136749267578	54	ArialMT
