- have the “right” to act in a contra-factual way, which might at first sight	103.08000183105469	583.4898071289062	12.000015258789062	389.4719696044922	54	ArialMT
suggest a naïve way of behaving.	121.07998657226562	597.289794921875	12.0	178.20477294921875	54	ArialMT
Due to the similar authoritarian legacy, the commonly shared accession process,	85.08000183105469	624.8898315429688	12.0	439.23719787597656	55	ArialMT
thus the experience of “Europeanization from scratch” there is less diversity and	85.08001708984375	638.6898193359375	12.0	439.3380126953125	55	ArialMT
more bunching among the EU-8. Seen from the socio-economic angle, the group	85.08004760742188	652.4898681640625	12.0	439.3523864746094	55	ArialMT
of EU-8 formed net recipients with high expectations as to the volume and the	85.08003234863281	666.2898559570312	12.0	439.3679656982422	55	ArialMT
intensity of structural funds and CAP allowances. Within this new embeddedness,	85.08004760742188	680.08984375	12.0	439.2359924316406	55	ArialMT
some communities or clusters might again take the leadership: This might be true	85.08004760742188	693.8898315429688	12.0	439.4039611816406	55	ArialMT
for the Polish delegation due to the size of the delegation and the respective	85.08004760742188	707.6898193359375	12.0	439.2828063964844	55	ArialMT
11 In contrast to possible changes in the national context, which might happen at a quicker pace,	85.08000183105469	736.2136840820312	11.912635803222656	439.2719268798828	56	ArialMT
the seven political core fractions of the European Parliament are forming kind of an established	85.07707214355469	749.689453125	10.034767150878906	439.35487365722656	56	Arial-ItalicMT
pool.	85.07705688476562	761.15234375	10.019996643066406	21.739395141601562	56	ArialMT
9	518.4000244140625	37.36334228515625	12.0	6.0	57	TimesNewRomanPSMT
administrative potential or for the Visegrád group as a special form of inner circle,	85.08000183105469	72.9498291015625	12.01776123046875	439.3031768798828	58	Arial-ItalicMT
which goes back to geographic and historical-cultural proximity.	85.07998657226562	86.74981689453125	12.0	336.13677978515625	58	ArialMT
Based on the advantage of a small number of interlocuters, already in 2004,	85.08000183105469	114.34979248046875	12.0	439.3704376220703	59	ArialMT
Working Groups among officials from the Permanent Representations of Member	85.08001708984375	128.1497802734375	12.01776123046875	439.22509765625	59	Arial-ItalicMT
States in Brussels were formed. To compensate for uncertainties regular, weekly	85.08001708984375	141.94976806640625	12.01776123046875	439.3536376953125	59	Arial-ItalicMT
meetings and exchanges of additional information were organized on the basis of	85.08001708984375	155.749755859375	12.0	439.30078125	59	ArialMT
the EU-8.	85.08001708984375	169.54974365234375	12.0	50.714385986328125	59	ArialMT
To gain an insight into the potential of the EU-8, three examples are highlighted in	85.08000183105469	197.08984375	12.0	439.3056182861328	60	ArialMT
the following. These small case studies are based on increasingly popular themes.	85.08001708984375	210.88983154296875	12.0	437.61004638671875	60	ArialMT
New legal instrument: European Grouping for Territorial Cooperation (EGTC)	85.08000183105469	238.48980712890625	12.01776123046875	408.1044158935547	61	Arial-ItalicMT
The main input for the introduction of this framework legal instrument and thus the	85.08000183105469	266.08984375	12.0	439.37879943847656	62	ArialMT
upgrade of the goal of territorial cohesion stems from the European Parliament in	85.08001708984375	279.88983154296875	12.01776123046875	439.39801025390625	62	Arial-ItalicMT
close cooperation with the DG Regio of the European Commission. The underlying	85.08001708984375	293.6898193359375	12.01776123046875	439.3775634765625	62	Arial-ItalicMT
assumption, which reflects the philosophy of the European Parliament, is to	85.08001708984375	307.48980712890625	12.0	439.36322021484375	62	ArialMT
incorporate the territorial dimension into Community policies, given the real impact	85.08001708984375	321.289794921875	12.0	439.3427734375	62	ArialMT
of sectoral policies – such as transport, environment, competition and research	85.08001708984375	335.08978271484375	12.0	439.3896484375	62	ArialMT
policy – on the territory of the European Union. The initial draft, which included a	85.08001708984375	348.8897705078125	12.0	439.39801025390625	62	ArialMT
thematically broad arrangement and combined interregional, intraregional and	85.08001708984375	362.68975830078125	12.0	439.33319091796875	62	ArialMT
transnational dimensions was strongly supported by the Polish rapporteur,	85.08001708984375	376.48974609375	12.0	439.2816162109375	62	ArialMT
nominated by the Committee on Regional Development in the EP, Mr Jan Olbrycht	85.08001708984375	390.28973388671875	12.017730712890625	439.41839599609375	62	Arial-ItalicMT
(PO). The former president of Upper Silesia is a strong advocate for a far-reaching	85.08001708984375	404.0897216796875	12.017730712890625	439.37158203125	62	Arial-ItalicMT
regionalization. It is remarkable that - in the context of EU cohesion policy - he was	85.08001708984375	417.88970947265625	12.0	439.4495849609375	62	ArialMT
the only politician out of MEPs of the EU-8 to be nominated as rapporteur for a	85.08001708984375	431.689697265625	12.0	439.39202880859375	62	ArialMT
draft regulation under the procedure of co-decision. Moreover, as a member of the	85.08001708984375	445.48968505859375	12.0	439.43157958984375	62	ArialMT
European People’s Party he has the standing and the openness to bargain with	85.08001708984375	459.2896728515625	12.017730712890625	439.30316162109375	62	Arial-ItalicMT
other national delegations and to closely co-operate with other EU-institutions. In	85.08001708984375	473.08966064453125	12.0	439.35833740234375	62	ArialMT
this context, he could benefit from close and long-lasting personal contacts with	85.08000183105469	486.8896484375	12.0	439.3260040283203	62	ArialMT
the Commissioner Mrs Danuta Hübner and with the Committee of the Regions	85.08001708984375	500.68963623046875	12.01776123046875	439.35125732421875	62	Arial-ItalicMT
(CoR)12. Although the draft first met with resistance from various old Member	85.08001708984375	512.0081787109375	14.48162841796875	439.29827880859375	62	ArialMT
States based on a fear of loss of national sovereignty and of a too strong local or	85.08000183105469	528.289794921875	12.0	439.2251739501953	62	ArialMT
regional level, finally the Council’s Common Position supported key elements of	85.07998657226562	542.0897827148438	12.0	439.3475646972656	62	ArialMT
the initial draft to manage cross-border projects more effectively. In addition, an	85.07998657226562	555.8897705078125	12.0	439.3523864746094	62	ArialMT
institutionalized integration of the CoR on the procedural side could be initiated for	85.0799560546875	569.6897583007812	12.01776123046875	439.33203125	62	Arial-ItalicMT
the first time: This indirect instrumentalization of the CoR throws new lines into the	85.07997131347656	583.48974609375	12.017745971679688	439.31993103027344	62	Arial-ItalicMT
division of work of EU institutions and is an example of an – up to date – unusual	85.0799560546875	597.289794921875	12.0	439.357177734375	62	ArialMT
inter-institutional cooperation.	85.07992553710938	611.0897827148438	12.0	156.7583770751953	62	ArialMT
It has to be admitted that the introduction of this legal instrument was possible also	85.08000183105469	638.6898193359375	12.0	439.30201721191406	63	ArialMT
due to its relatively cost-free stance. When it comes to the application, regionally	85.08000183105469	652.4898681640625	12.0	439.2864532470703	63	ArialMT
elected Polish MEPs such as Mr. Mieczyslaw Edmund Janowski (PO) were again	85.08000183105469	666.2898559570312	12.0177001953125	439.41236877441406	63	Arial-ItalicMT
strong advocates for the introduction of diverse cross-border projects in the	85.07998657226562	680.08984375	12.0	439.3787536621094	63	ArialMT
12 As a member of the board on the Association of European Regions and his former activities for	85.08000183105469	713.2335815429688	11.927467346191406	439.3650665283203	64	Arial-ItalicMT
the regionalization of Poland during the 1990s Mr. Olbrycht is already well-recognized in the	85.07705688476562	726.6492309570312	10.019996643066406	439.2768249511719	64	ArialMT
Brussels scene and known as a smooth cooperation partner. Expert interview with a representative	85.07707214355469	738.1722412109375	10.019996643066406	439.2586212158203	64	ArialMT
of the Permanent Representation of Poland to the European Union, Brussels, March 2007 and	85.07707214355469	749.6952514648438	10.019996643066406	439.47413635253906	64	ArialMT
expert interview with a lobbyist of a Polish region, Brussels, September 2007.	85.07707214355469	761.1581420898438	10.019996643066406	341.8362579345703	64	ArialMT
10	512.4000244140625	37.36334228515625	12.0	12.0	65	TimesNewRomanPSMT
Regional Operational Programmes of their constituencies. In addition, members of	85.08000183105469	72.9498291015625	12.01776123046875	439.25282287597656	66	Arial-ItalicMT
the group of EU-8 might benefit from additional money from the title for External	85.08001708984375	86.74981689453125	12.0	439.41009521484375	66	ArialMT
Policy for the support of cross-border projects along EU’s external borders. This	85.08001708984375	100.5498046875	12.0	439.41119384765625	66	ArialMT
means that although the Polish delegation was said to play the nationalistic card	85.08001708984375	114.34979248046875	12.0	439.3524169921875	66	ArialMT
(as to the Reform Treaty), the enthusiastic advocacy for the introduction of the	85.08001708984375	128.1497802734375	12.01776123046875	439.38482666015625	66	Arial-ItalicMT
EGTC underlines a liberal stance.	85.08001708984375	141.94976806640625	12.01776123046875	179.4407958984375	66	Arial-ItalicMT
To sum up, the notion of territorial cohesion not only respects the principle of the	85.08000183105469	169.5498046875	12.0	439.3583526611328	67	ArialMT
Lisbon Strategy by strengthening the cluster and network approach together with a	85.08000183105469	183.34979248046875	12.01776123046875	439.33558654785156	67	Arial-ItalicMT
focus on the urban dimension, but it is now also fixed in the Lisbon Treaty.	85.08001708984375	197.08978271484375	12.01776123046875	393.5160217285156	67	Arial-ItalicMT
Policy framing through the introduction of Housing	85.08000183105469	224.6898193359375	12.01776123046875	265.44236755371094	68	Arial-ItalicMT
The second example scrutinizes the policy-making process for the introduction of	85.08000183105469	252.289794921875	12.0	439.3379669189453	69	ArialMT
a new theme within the financially most important goal convergence. With regard	85.07998657226562	266.08978271484375	12.01776123046875	439.3728332519531	69	Arial-ItalicMT
to policy framing the stress on the theme of housing underlines the importance of	85.08001708984375	279.8897705078125	12.01776123046875	439.25042724609375	69	Arial-ItalicMT
the urban dimension and could be interpreted as a contribution to discussions of	85.08004760742188	293.68975830078125	12.0	439.3295593261719	69	ArialMT
the newly launched energy efficiency debate and the energy productivity	85.08004760742188	307.48974609375	12.0	439.2420349121094	69	ArialMT
discussion. In addition, it implied aspects of social inclusion, thus another principle	85.08004760742188	321.28973388671875	12.0	439.3920593261719	69	ArialMT
underlying the European project.	85.08004760742188	335.0897216796875	12.0	173.33523559570312	69	ArialMT
Based on the family of nation’s argument the introduction of this theme has been	85.08000183105469	362.6898193359375	12.0	439.3463897705078	70	ArialMT
promoted by representatives of former Visegrád countries13: Based on shared	85.08000183105469	374.00823974609375	14.499298095703125	439.3692169189453	70	Arial-ItalicMT
problems with the conversion of unused industrial buildings, beneficiaries should	85.07998657226562	390.289794921875	12.0	439.3824157714844	70	ArialMT
be exclusively new Member States. The final introduction of this policy strand in	85.07998657226562	404.08978271484375	12.0	439.3487854003906	70	ArialMT
the General Provision of EU cohesion policy in mid-2006 was remarkable, since	85.07998657226562	417.8897705078125	12.017730712890625	439.3318786621094	70	Arial-ItalicMT
the financing of housing aspects happens for the first time ever. In general, it	85.07998657226562	431.68975830078125	12.0	439.2768859863281	70	ArialMT
follows the actual European-wide tendency that the urban dimension is	85.07998657226562	445.48974609375	12.0	439.3103942871094	70	ArialMT
strengthened by a separate Communication of the European Commission in	85.07998657226562	459.28973388671875	12.017730712890625	439.3199768066406	70	Arial-ItalicMT
autumn of 2006. In addition, energy efficiency aspects have become increasingly	85.0799560546875	473.0897216796875	12.0	439.27923583984375	70	ArialMT
important during the last years, reflected in the agenda of the Summit of G-8. In	85.0799560546875	486.88970947265625	12.017730712890625	439.32000732421875	70	Arial-ItalicMT
sum, the group of EU-8 has proved to be forerunners and has carved out a	85.0799560546875	500.689697265625	12.0	439.38836669921875	70	ArialMT
creative niche.	85.0799560546875	514.4896850585938	12.0	77.3280029296875	70	ArialMT
New modes of governance: the politics of new financial instruments	85.08000183105469	542.08984375	12.0	357.4967803955078	71	ArialMT
The third example reflects the introduction of new financial instruments and the	85.08000183105469	569.6898193359375	12.0	439.3103790283203	72	ArialMT
application of new procedures. The underlying assumption is that a set of new	85.07998657226562	583.4898681640625	12.0	439.4123840332031	72	ArialMT
instruments is used as a vehicle to support the goals of the updated Lisbon	85.07998657226562	597.2898559570312	12.0177001953125	439.3619689941406	72	Arial-ItalicMT
Strategy of 2005: The main aim is to ensure an integrated approach to the	85.07998657226562	611.08984375	12.0177001953125	439.3356018066406	72	Arial-ItalicMT
enhancement of competitiveness and growth in Europe which includes active	85.07998657226562	624.8898315429688	12.0	439.3164367675781	72	ArialMT
labour market instruments such as training and retraining, but also focus the urban	85.07998657226562	638.6898193359375	12.0	439.3476257324219	72	ArialMT
dimension, innovation policy, energy policy as well as rural development.	85.08000183105469	652.4898681640625	12.0	386.24281311035156	72	ArialMT
In the negotiation phase actors of the group of EU-8 showed an affinity for the	85.08000183105469	680.08984375	12.0	439.41957092285156	73	ArialMT
introduction and the application of new financial instruments such as Jaspers,	85.07998657226562	693.8898315429688	12.0177001953125	439.3559875488281	73	Arial-ItalicMT
Jeremie and Jessica. As to e.g. Jeremie the application of Public Private	85.07998657226562	707.6898193359375	12.0177001953125	439.3247985839844	73	Arial-ItalicMT
Partnership under the financially most attractive goal convergence is to improve	85.0799560546875	721.4898681640625	12.0177001953125	439.36322021484375	73	Arial-ItalicMT
13 The Hungarian delegation has taken the lead when massive lobbying activities were launched.	85.08000183105469	747.7337036132812	11.912635803222656	439.4220733642578	74	ArialMT
Expert Interview, European Commission, GD Regio, March 2007.	85.07705688476562	761.1493530273438	10.019996643066406	289.0268859863281	74	ArialMT
11	512.4000244140625	37.36334228515625	12.0	12.0	75	TimesNewRomanPSMT
the business environment and to promote employment growth among small and	85.08000183105469	72.9498291015625	12.0	439.3272247314453	76	ArialMT
medium-sized enterprises (SME). Priority projects might focus the creation of the	85.08001708984375	86.74981689453125	12.0	439.375244140625	76	ArialMT
knowledge-based (innovative) economy, the improvement of access to capital of	85.08001708984375	100.5498046875	12.0	439.34881591796875	76	ArialMT
the SME sector and the development of industrial and logistics parks.	85.08001708984375	114.34979248046875	12.0	367.62359619140625	76	ArialMT
In practice, the stress on this dimension was beneficial for the five socio-	85.08000183105469	141.9498291015625	12.0	439.2239532470703	77	ArialMT
economically poorest regions in Poland. At the end of the financial negotiations in	85.08000183105469	155.74981689453125	12.0	439.35597229003906	77	ArialMT
mid-2006, additional money is granted to five vojevodships with the obligation to	85.07998657226562	169.5498046875	12.01776123046875	439.3512268066406	77	Arial-ItalicMT
stress and to support the innovation capacity. At the same time, the notion of	85.08004760742188	183.34979248046875	12.0	439.3439636230469	77	ArialMT
public private partnership refers to a process-orientation with the involvement and	85.08004760742188	197.08978271484375	12.0	439.3080749511719	77	ArialMT
commitments of local partners. These arrangements include alliances of	85.08004760742188	210.8897705078125	12.0	439.2480163574219	77	ArialMT
knowledge between universities and enterprises and thus narrow nationally	85.08004760742188	224.68975830078125	12.0	439.2156066894531	77	ArialMT
embedded practices of norms and rule-setting.	85.08004760742188	238.48974609375	12.0	247.53842163085938	77	ArialMT
In the context of lobbying for a regionally based innovation-orientation the strong	85.08000183105469	266.08984375	12.0	439.33558654785156	78	ArialMT
input from the Polish MEP Mr Mieczyslaw Edmund Janowski14 (PO) should be	85.08000183105469	277.408203125	14.4993896484375	439.3943634033203	78	Arial-ItalicMT
mentioned. He is the author of an Initiative Report on „the contribution of the future	85.08001708984375	293.6898193359375	12.01776123046875	439.346435546875	78	Arial-ItalicMT
regional policy to the innovative capacity of the EU”, adopted in the spring of 2007.	85.08001708984375	307.48980712890625	12.0	439.30322265625	78	ArialMT
During the redaction of the report he has closely cooperated with a Dutch MEP of	85.08001708984375	321.289794921875	12.0	439.20245361328125	78	ArialMT
the same political fraction, sharing the affinity of the principle of “open innovation”.	85.08001708984375	335.08978271484375	12.0	439.25152587890625	78	ArialMT
Moreover, Mr Janowski is a regionally based advocate for the necessary	85.08001708984375	348.8897705078125	12.0	439.31402587890625	78	ArialMT
information campaign as to the broad application of instruments such as Jeremie	85.08001708984375	362.68975830078125	12.017730712890625	439.3800048828125	78	Arial-ItalicMT
and Jaspers. In consequence, Poland was among the first to open a liaison office	85.08004760742188	376.48974609375	12.017730712890625	439.3487854003906	78	Arial-ItalicMT
in Warsaw in 2007 for Jaspers: While showing a great amount of goodwill, the	85.08004760742188	390.28973388671875	12.017730712890625	439.2707824707031	78	Arial-ItalicMT
Polish authorities’ part of the Brussels scene are regarded as forerunners.	85.08001708984375	404.0897216796875	12.0	439.1951904296875	78	ArialMT
Moreover, based on the Twinning experience, regular networking conferences	85.08003234863281	417.88970947265625	12.017730712890625	439.27439880371094	78	Arial-ItalicMT
focusing the innovation capacity are organized with Dutch partners. While	85.07998657226562	431.689697265625	12.0	439.1735534667969	78	ArialMT
bilaterally exchanging experience, promoting increased cooperation and improving	85.07998657226562	445.48968505859375	12.0	439.3824157714844	78	ArialMT
the coordination between relevant actors at all levels, the potential for best	85.07998657226562	459.2896728515625	12.017730712890625	439.3931579589844	78	Arial-ItalicMT
practice under the Open Method of Coordination is used.	85.0799560546875	473.08966064453125	12.017730712890625	301.598388671875	78	Arial-ItalicMT
These newly launched instruments can be financially more or less ignored.	85.08000183105469	500.6898193359375	12.0	439.36561584472656	79	ArialMT
Nevertheless, they are quality-oriented and they might thus entail long-lasting,	85.08001708984375	514.4898071289062	12.0	439.202392578125	79	ArialMT
wide-spread effects on the procedural side. It can be stated that the Polish MEPs	85.08001708984375	528.289794921875	12.0	439.30084228515625	79	ArialMT
were able to benefit from the vectors of opportunity based on the internal	85.08001708984375	542.0897827148438	12.0	439.32122802734375	79	ArialMT
philosophy of the European Parliament. Moreover, possessing of the necessary	85.08001708984375	555.8897705078125	12.0	439.35357666015625	79	ArialMT
political background, they were able to fulfil their role as transmitter of the	85.08001708984375	569.6897583007812	12.0	439.375244140625	79	ArialMT
European-inspired approach as to the innovation and cross-border orientation into	85.08001708984375	583.48974609375	12.0	439.3583984375	79	ArialMT
the national and regional socio-economic contexts.	85.08001708984375	597.289794921875	12.0	269.4983825683594	79	ArialMT
Conclusions	85.08000183105469	625.275146484375	12.0	72.01199340820312	80	Arial-BoldMT
The aim of this paper was to nuance the understanding of bargaining from the	85.08000183105469	652.4898071289062	12.0	439.3560333251953	81	ArialMT
perspective of newcomers. This paper has provided a preliminary mapping of	85.08001708984375	666.289794921875	12.0	439.2264404296875	81	ArialMT
negotiation tactics and strategies of actors of the EU-8. In presenting three case	85.08001708984375	680.08984375	12.0	439.4400634765625	81	ArialMT
studies it has become clear that there exists a potential for successful	85.08001708984375	693.8898315429688	12.0	439.33319091796875	81	ArialMT
negotiations, which yielded surprising results on the policy, politics and even polity	85.08000183105469	707.6898193359375	12.0	439.30079650878906	81	ArialMT
14 Mr Janowski was a mayor of Rrzeszów and a former Senator to represent Torún. Since the	85.08000183105469	736.2136840820312	11.927467346191406	439.36805725097656	82	Arial-ItalicMT
beginning of the 1990s he is interested in the regionalization of Poland and he is a founding	85.07708740234375	749.689453125	10.019996643066406	439.346923828125	82	ArialMT
member of the Polish Association of Cities.	85.07708740234375	761.15234375	10.034767150878906	190.16958618164062	82	Arial-ItalicMT
12	512.4000244140625	37.36334228515625	12.0	12.0	83	TimesNewRomanPSMT
level. Actors of the group of EU-8 could successfully use their outsider status and	85.08000183105469	72.9498291015625	12.0	439.4015655517578	84	ArialMT
the semi-optimal integration as an instrument to reinforce their negotiation	85.08000183105469	86.74981689453125	12.0	439.3848419189453	84	ArialMT
possibilities. The newcomers were thus able to positively “play the card of	85.08000183105469	100.5498046875	12.0	439.3488311767578	84	ArialMT
underdogs”.	85.07998657226562	114.34979248046875	12.0	64.04399108886719	84	ArialMT
It remains an open question whether participants now better know how to cope	85.08000183105469	141.9498291015625	12.0	439.38233947753906	85	ArialMT
with the knowledge of increased - by definition multilateral - possibilities of	85.07998657226562	155.74981689453125	12.0	439.2252502441406	85	ArialMT
negotiations in the concert of now 27 Member States, while being alert to the	85.07998657226562	169.5498046875	12.0	439.3631896972656	85	ArialMT
Reform Treaty as a future basis of conduct. Are actors of the EU-8 now fully	85.07998657226562	183.34979248046875	12.01776123046875	439.2950134277344	85	Arial-ItalicMT
incorporated into the internal structures of supranational institutions of the EU? In	85.07999420166016	197.08978271484375	12.0	439.3020248413086	85	ArialMT
addition, it remains to be seen, whether regional formations or clusterings such as	85.08001708984375	210.8897705078125	12.0	439.33074951171875	85	ArialMT
the Visegrád Group will pertain as new inner circles, based on smooth cooperation	85.08001708984375	224.68975830078125	12.01776123046875	439.31640625	85	Arial-ItalicMT
during the last years.	85.08001708984375	238.48974609375	12.0	111.46319580078125	85	ArialMT
In a medium term perspective actors of the EU-8, which are socialized and	85.08000183105469	266.08984375	12.0	439.3606719970703	86	ArialMT
embedded in the internal structures, might increasingly be able to argue out of the	85.08000183105469	279.88983154296875	12.0	439.3560333251953	86	ArialMT
corpus of the respective EU institution. This dynamic and somewhat transformed	85.08001708984375	293.6898193359375	12.0	439.32843017578125	86	ArialMT
knowledge might be incorporated in the working agenda or the philosophy of a	85.08001708984375	307.48980712890625	12.0	439.28997802734375	86	ArialMT
department of the European Institution or in the work of the national context of the	85.08001708984375	321.289794921875	12.0	439.39434814453125	86	ArialMT
Brussels scene.	85.08001708984375	335.08978271484375	12.0	84.70680236816406	86	ArialMT
13	512.4000244140625	37.36334228515625	12.0	12.0	87	TimesNewRomanPSMT
Bibliography	85.08000183105469	73.33514404296875	12.0	73.44960021972656	88	Arial-BoldMT
Ademczyk, Grzegorz; Gostmann, Peter (2007): Polen zwischen Nation und Europa. Zur	85.08000183105469	97.84625244140625	10.02001953125	387.3130645751953	89	ArialMT
Konstruktion kollektiver Identität im polnischen Parlament. Wiesbaden: DUV.	85.08000183105469	109.3692626953125	10.02001953125	338.4745330810547	89	ArialMT
Bartolini, S. (2004): Old and New Peripheries in the Processes of European Territorial Integration.	85.08000183105469	134.68634033203125	10.02001953125	431.30690002441406	90	ArialMT
In: Ansell, C. K.; Di Palma, G (eds.): Restructuring Territoriality: Europe and the United States	85.07000732421875	146.14923095703125	10.02001953125	413.5133972167969	90	ArialMT
