partner’s low output. Whether he contributed	49.60630798339844	268.50372314453125	9.0	185.34152221679688	99	DOPNMA+NewBaskerville-Roman
less than the participant due to lack of ability	49.60630798339844	279.5035095214844	9.0	185.34059143066406	99	DOPNMA+NewBaskerville-Roman
or to lack of motivation did not seem to matter	49.60630798339844	290.5032958984375	9.0	185.34332275390625	99	DOPNMA+NewBaskerville-Roman
to them. In contrast, participants who did not	49.60630798339844	301.5030822753906	9.0	185.3397216796875	99	DOPNMA+NewBaskerville-Roman
endorse the instrumental value of work exerted	49.60630798339844	312.50286865234375	9.0	185.3334197998047	99	DOPNMA+NewBaskerville-Roman
more effort when their partner was incapable	49.60630798339844	323.5026550292969	9.0	185.33522033691406	99	DOPNMA+NewBaskerville-Roman
rather than lazy. Somewhat surprisingly, these	49.60630798339844	334.50244140625	9.0	185.33700561523438	99	DOPNMA+NewBaskerville-Roman
participants who were low on the instrumental	49.60630798339844	345.5022277832031	9.0	185.34243774414062	99	DOPNMA+NewBaskerville-Roman
component actually worked harder when	49.60630798339844	356.50201416015625	9.0	185.3315887451172	99	DOPNMA+NewBaskerville-Roman
paired with an incapable partner than did the	49.60630798339844	367.5018005371094	9.0	185.34153747558594	99	DOPNMA+NewBaskerville-Roman
participants who were high on the instrumental	49.60630798339844	378.5015869140625	9.0	185.3415069580078	99	DOPNMA+NewBaskerville-Roman
component. Thus, it seems that people who	49.60630798339844	389.5013732910156	9.0	185.32797241210938	99	DOPNMA+NewBaskerville-Roman
do not subscribe to the instrumental value of	49.60630798339844	400.50115966796875	9.0	185.33880615234375	99	DOPNMA+NewBaskerville-Roman
work are willing to compensate for a capability	49.60630798339844	411.5009460449219	9.0	185.34239196777344	99	DOPNMA+NewBaskerville-Roman
deﬁcit, perhaps in order to gain the immedi-	49.60630798339844	422.500732421875	8.999984741210938	185.3388214111328	99	DOPNMA+NewBaskerville-Roman
ate incentives for high production. That is, for	49.60630798339844	433.5005187988281	9.0	185.34783935546875	99	DOPNMA+NewBaskerville-Roman
them, work may not lead invariably to rewards	49.60630798339844	444.50030517578125	9.0	185.33071899414062	99	DOPNMA+NewBaskerville-Roman
or be rewarding in itself but, when beneﬁts are	49.60630798339844	455.5001220703125	9.0	185.33792114257812	99	DOPNMA+NewBaskerville-Roman
directly tied to collective production, they will	49.60630798339844	466.49993896484375	9.0	185.33883666992188	99	DOPNMA+NewBaskerville-Roman
compensate for less capable coworkers.	49.60630798339844	477.4997253417969	9.0	157.68899536132812	99	DOPNMA+NewBaskerville-Roman
As predicted, participants who endorsed the	57.606407165527344	488.49951171875	9.0	177.34052276611328	99	DOPNMA+NewBaskerville-Roman
equity principle were affected by the sucker	49.60630798339844	499.49932861328125	9.0	185.34959411621094	99	DOPNMA+NewBaskerville-Roman
manipulations. If their partner provided the	49.60630798339844	510.4991455078125	9.0	185.30642700195312	99	DOPNMA+NewBaskerville-Roman
impression that the participant could become	49.60630798339844	521.4989013671875	9.0	185.34152221679688	99	DOPNMA+NewBaskerville-Roman
the sucker, those who reported a preference for	49.60630798339844	532.4987182617188	9.0	185.34420776367188	99	DOPNMA+NewBaskerville-Roman
equity over equality reduced their effort con-	49.60630798339844	543.49853515625	9.0	185.33883666992188	99	DOPNMA+NewBaskerville-Roman
siderably. In comparison, when they thought	49.60630798339844	554.4983520507812	9.0	185.28392028808594	99	DOPNMA+NewBaskerville-Roman
their team partner was less capable at the	49.60630798339844	565.4981689453125	9.0	185.33518981933594	99	DOPNMA+NewBaskerville-Roman
task, they exerted extra effort to compensate	49.60630798339844	576.4979248046875	9.0	185.3424072265625	99	DOPNMA+NewBaskerville-Roman
for their partner’s deﬁcits. Apparently it matters	49.60630798339844	587.4977416992188	9.0	185.33970642089844	99	DOPNMA+NewBaskerville-Roman
for people endorsing the equity principle	49.60630798339844	598.49755859375	9.0	185.34149169921875	99	DOPNMA+NewBaskerville-Roman
50	49.606300354003906	634.5123291015625	8.0	8.319999694824219	100	DOPNMA+NewBaskerville-Roman
why a coworker’s contributions are subpar. If	246.94480895996094	70.49725341796875	9.0	185.34242248535156	101	DOPNMA+NewBaskerville-Roman
poor performance is due to a lack of ability, they	246.94480895996094	81.4970703125	9.0	185.35142517089844	101	DOPNMA+NewBaskerville-Roman
almost appear to act according to the principle	246.94480895996094	92.49688720703125	9.0	185.3415069580078	101	DOPNMA+NewBaskerville-Roman
that input should be proportional to individual	246.94480895996094	103.4967041015625	9.0	185.3783416748047	101	DOPNMA+NewBaskerville-Roman
resources or ability. If they do not have any	246.94480895996094	114.49652099609375	9.0	185.33338928222656	101	DOPNMA+NewBaskerville-Roman
reason to believe that resources or abilities are	246.94480895996094	125.496337890625	9.0	185.34239196777344	101	DOPNMA+NewBaskerville-Roman
disproportionate, they are sensitive to the subpar	246.94480895996094	136.49615478515625	9.0	185.32530212402344	101	DOPNMA+NewBaskerville-Roman
contributions of their partner and exert less	246.94480895996094	147.4959716796875	9.0	185.3009796142578	101	DOPNMA+NewBaskerville-Roman
effort. People who are more likely to endorse	246.94480895996094	158.49578857421875	9.0	185.3388214111328	101	DOPNMA+NewBaskerville-Roman
the equality norm do not seem to be affected	246.94480895996094	169.49554443359375	9.000030517578125	185.3334197998047	101	DOPNMA+NewBaskerville-Roman
by the reason for their partner’s lesser input.	246.94480895996094	180.495361328125	9.0	185.33433532714844	101	DOPNMA+NewBaskerville-Roman
If it appears to be lack of motivation or skill,	246.94480895996094	191.49514770507812	9.0	185.3361053466797	101	DOPNMA+NewBaskerville-Roman
it does not seem to affect them. They do not	246.94480895996094	202.49493408203125	9.0	185.33705139160156	101	DOPNMA+NewBaskerville-Roman
endorse the equity norm, and consequently, it	246.94480895996094	213.49472045898438	9.0	185.40907287597656	101	DOPNMA+NewBaskerville-Roman
seems that they do not experience any danger	246.94480895996094	224.4945068359375	9.0	185.50172424316406	101	DOPNMA+NewBaskerville-Roman
of becoming a sucker in the light of a violation	246.94480895996094	235.49429321289062	9.0	185.34776306152344	101	DOPNMA+NewBaskerville-Roman
of such a norm.	246.94480895996094	246.49407958984375	9.0	63.01799011230469	101	DOPNMA+NewBaskerville-Roman
People who see hard work as an ethical marker	254.94491577148438	257.4938659667969	9.0	177.3251953125	101	DOPNMA+NewBaskerville-Roman
also react to the apparent reasons that a coworker	246.94480895996094	268.49365234375	9.0	185.32798767089844	101	DOPNMA+NewBaskerville-Roman
is performing poorly. Participants who believed	246.94480895996094	279.4934387207031	9.0	185.3190155029297	101	DOPNMA+NewBaskerville-Roman
in the ethical value of work were affected by the	246.94480895996094	290.49322509765625	9.0	185.37745666503906	101	DOPNMA+NewBaskerville-Roman
apparent cause of their partners’ inferior con-	246.94480895996094	301.4930114746094	9.0	185.3387908935547	101	DOPNMA+NewBaskerville-Roman
tributions to the collective product. They, like	246.94480895996094	312.4927978515625	9.0	185.3352508544922	101	DOPNMA+NewBaskerville-Roman
equity endorsers seemed willing to compensate	246.94480895996094	323.4925842285156	9.0	185.37208557128906	101	DOPNMA+NewBaskerville-Roman
for lack of ability. However, they reduced their	246.94480895996094	334.49237060546875	9.0	185.3433074951172	101	DOPNMA+NewBaskerville-Roman
input when the partner was loaﬁng. Thus, the	246.94480895996094	345.4921569824219	9.0	185.33702087402344	101	DOPNMA+NewBaskerville-Roman
ethical value that people see in work is not simply	246.94480895996094	356.491943359375	9.0	185.3630828857422	101	DOPNMA+NewBaskerville-Roman
self-focused (i.e. ‘If I work hard, I am good’) but	246.94480895996094	367.4917297363281	9.0	185.36305236816406	101	DOPNMA+NewBaskerville-Roman
also other-focused (i.e. ‘Lazy people are bad’).	246.94480895996094	378.49151611328125	9.0	185.3451385498047	101	DOPNMA+NewBaskerville-Roman
In other words, people who believe in the ethical	246.94480895996094	389.4913024902344	9.0	185.32798767089844	101	DOPNMA+NewBaskerville-Roman
value of work have a broader moral concern.	246.94480895996094	400.4910888671875	9.0	185.33970642089844	101	DOPNMA+NewBaskerville-Roman
When they are working with somebody who does	246.94480895996094	411.4908752441406	9.0	185.35047912597656	101	DOPNMA+NewBaskerville-Roman
not seem to spend much effort on the task, they	246.94480895996094	422.49066162109375	8.999984741210938	185.3441619873047	101	DOPNMA+NewBaskerville-Roman
are not willing to compensate for the other’s	246.94480895996094	433.4904479980469	9.0	185.33522033691406	101	DOPNMA+NewBaskerville-Roman
lack of effort and, in the spirit of defending	246.94480895996094	444.490234375	9.0	185.34327697753906	101	DOPNMA+NewBaskerville-Roman
their moral claim, are prepared to forego	246.94480895996094	455.49005126953125	9.0	185.3280487060547	101	DOPNMA+NewBaskerville-Roman
part of their reward. Hence defending their	246.94480895996094	466.4898681640625	9.0	185.32984924316406	101	DOPNMA+NewBaskerville-Roman
moral claim seems more important than the	246.94480895996094	477.4896545410156	9.0	185.32801818847656	101	DOPNMA+NewBaskerville-Roman
external reward. People who do not believe in	246.94480895996094	488.48944091796875	9.0	185.3343048095703	101	DOPNMA+NewBaskerville-Roman
the ethical value of work, have less of a mission	246.94480895996094	499.4892578125	9.0	185.3486785888672	101	DOPNMA+NewBaskerville-Roman
to defend some ethical principle, and hence do	246.94480895996094	510.48907470703125	9.0	185.3684844970703	101	DOPNMA+NewBaskerville-Roman
not appear to experience great psychological	246.94480895996094	521.4888916015625	9.0	185.3369903564453	101	DOPNMA+NewBaskerville-Roman
costs if another person might free-ride on their	246.94480895996094	532.4886474609375	9.0	185.35411071777344	101	DOPNMA+NewBaskerville-Roman
effort. Consequently they exerted the same	246.94480895996094	543.4884643554688	9.0	185.32618713378906	101	DOPNMA+NewBaskerville-Roman
effort, no matter whether the other person was	246.94480895996094	554.48828125	9.0	185.3460235595703	101	DOPNMA+NewBaskerville-Roman
incapable or not motivated.	246.94480895996094	565.488037109375	9.0	111.22200012207031	101	DOPNMA+NewBaskerville-Roman
Contrary to our predictions, the global PWE	254.94491577148438	576.4878540039062	9.0	177.344970703125	101	DOPNMA+NewBaskerville-Roman
measure did not moderate the free-rider effect.	246.94480895996094	587.4876708984375	9.0	185.3892059326172	101	DOPNMA+NewBaskerville-Roman
Moreover, the free rider effect was only weakly	246.94480895996094	598.4874877929688	9.0	185.34239196777344	101	DOPNMA+NewBaskerville-Roman
Abele and Diehl the protestant work ethic and group performance	126.52100372314453	36.5263671875	9.01068115234375	306.0107955932617	102	DOPOAA+NewBaskerville-SC
related to the belief in the instrumental value	49.60609436035156	70.5076904296875	9.0	185.33880615234375	103	DOPNMA+NewBaskerville-Roman
of work. The trends suggest that people who	49.60609436035156	81.50750732421875	9.0	185.3388214111328	103	DOPNMA+NewBaskerville-Roman
believe in the notion that work should and will	49.60609436035156	92.50732421875	9.0	185.33880615234375	103	DOPNMA+NewBaskerville-Roman
pay off did not take advantage of the possibil-	49.60609436035156	103.50714111328125	9.0	185.3315887451172	103	DOPNMA+NewBaskerville-Roman
ity to free-ride on somebody else’s effort. They	49.60609436035156	114.5069580078125	9.0	185.34422302246094	103	DOPNMA+NewBaskerville-Roman
worked equally hard when working alone and	49.60609436035156	125.50677490234375	9.0	185.335205078125	103	DOPNMA+NewBaskerville-Roman
when working with another when contribu-	49.60609436035156	136.506591796875	9.0	185.32981872558594	103	DOPNMA+NewBaskerville-Roman
tions were not identiﬁable. Participants who	49.60609436035156	147.50640869140625	9.0	185.3315887451172	103	DOPNMA+NewBaskerville-Roman
believed to a lesser extent in the instrumental	49.60608673095703	158.5062255859375	9.0	185.3343276977539	103	DOPNMA+NewBaskerville-Roman
value of work were affected by the social context.	49.60608673095703	169.5059814453125	9.000030517578125	185.33696746826172	103	DOPNMA+NewBaskerville-Roman
When it needed their individual effort to get the	49.60608673095703	180.50579833984375	9.0	185.34239959716797	103	DOPNMA+NewBaskerville-Roman
reward they worked much harder, compared to	49.60608673095703	191.50558471679688	9.0	185.3639907836914	103	DOPNMA+NewBaskerville-Roman
the situation in which they could free-ride on	49.60608673095703	202.50537109375	9.0	185.33611297607422	103	DOPNMA+NewBaskerville-Roman
somebody else’s effort.	49.60608673095703	213.50515747070312	9.0	91.31220245361328	103	DOPNMA+NewBaskerville-Roman
In sum, neither the sucker effect nor the free-	57.60618591308594	224.50494384765625	9.0	177.3251953125	103	DOPNMA+NewBaskerville-Roman
rider effect was moderated by the global con-	49.60608673095703	235.50473022460938	9.0	185.34062957763672	103	DOPNMA+NewBaskerville-Roman
struct of PWE. However the sucker-effect seemed	49.60608673095703	246.5045166015625	9.0	185.33968353271484	103	DOPNMA+NewBaskerville-Roman
to be moderated in different ways by the three	49.60608673095703	257.5043029785156	9.0	185.3442611694336	103	DOPNMA+NewBaskerville-Roman
components of the PWE, namely the belief	49.60608673095703	268.50408935546875	9.0	185.3405990600586	103	DOPNMA+NewBaskerville-Roman
in the ethical value of work, the belief in the	49.60608673095703	279.5038757324219	9.0	185.3379135131836	103	DOPNMA+NewBaskerville-Roman
instrumental value of work and the endorsement	49.60608673095703	290.503662109375	9.0	185.3243637084961	103	DOPNMA+NewBaskerville-Roman
of the equity principle. The free-rider effect,	49.60608673095703	301.5034484863281	9.0	185.34062957763672	103	DOPNMA+NewBaskerville-Roman
on the other hand, seems to be only marginally	49.60608673095703	312.50323486328125	9.0	185.3307113647461	103	DOPNMA+NewBaskerville-Roman
moderated by the belief in the instrumental	49.60608673095703	323.5030212402344	9.0	185.26139068603516	103	DOPNMA+NewBaskerville-Roman
value of work.	49.60608673095703	334.5028076171875	9.0	55.88099670410156	103	DOPNMA+NewBaskerville-Roman
Sucker and free-rider effects seem to be quali-	57.60618591308594	345.5025939941406	9.0	177.35220336914062	103	DOPNMA+NewBaskerville-Roman
tatively different motivation losses in group per-	49.60608673095703	356.50238037109375	9.0	185.3504867553711	103	DOPNMA+NewBaskerville-Roman
formance. The sucker-effect is moderated by	49.60608673095703	367.5021667480469	9.0	185.32979583740234	103	DOPNMA+NewBaskerville-Roman
beliefs about the instrumental and ethical value	49.60608673095703	378.501953125	9.0	185.3333969116211	103	DOPNMA+NewBaskerville-Roman
of work and preferences for equity, whereas these	49.60608673095703	389.5017395019531	9.0	185.35411834716797	103	DOPNMA+NewBaskerville-Roman
components tells us less about who is likely to	49.60608673095703	400.50152587890625	9.0	185.33878326416016	103	DOPNMA+NewBaskerville-Roman
free-ride. One potentially contributing difference	49.60608673095703	411.5013122558594	9.0	185.32439422607422	103	DOPNMA+NewBaskerville-Roman
between avoiding being the sucker and free-	49.60608673095703	422.5010986328125	8.999984741210938	185.32979583740234	103	DOPNMA+NewBaskerville-Roman
riding is that avoiding the sucker role is a reaction	49.60608673095703	433.5008850097656	9.0	185.32622528076172	103	DOPNMA+NewBaskerville-Roman
to the behavior, anticipated or actual, of another	49.60608673095703	444.50067138671875	9.0	185.33519744873047	103	DOPNMA+NewBaskerville-Roman
person. In the experimental manipulation of the	49.60608673095703	455.50048828125	9.0	185.31722259521484	103	DOPNMA+NewBaskerville-Roman
sucker-effect, the other person is giving the im-	49.60608673095703	466.50030517578125	9.0	185.34600067138672	103	DOPNMA+NewBaskerville-Roman
pression that he is lowering their input because	49.60608673095703	477.5000915527344	9.0	185.36580657958984	103	DOPNMA+NewBaskerville-Roman
he does not feel like working hard. Consequently	49.60608673095703	488.4998779296875	9.0	185.32173919677734	103	DOPNMA+NewBaskerville-Roman
the participant sees the danger that he might	49.60608673095703	499.49969482421875	9.0	185.3352279663086	103	DOPNMA+NewBaskerville-Roman
be exploited, and the psychological cost of ex-	49.60608673095703	510.49951171875	9.0	185.27132415771484	103	DOPNMA+NewBaskerville-Roman
ploitation is higher than foregoing part of the	49.60608673095703	521.499267578125	9.0	185.37206268310547	103	DOPNMA+NewBaskerville-Roman
monetary reward for high productivity. But	49.60608673095703	532.4990844726562	9.0	185.32799530029297	103	DOPNMA+NewBaskerville-Roman
these psychological costs are not experienced	49.60608673095703	543.4989013671875	9.0	185.33702850341797	103	DOPNMA+NewBaskerville-Roman
by everybody alike. More speciﬁcally, it is subject	49.60608673095703	554.4987182617188	9.0	185.33072662353516	103	DOPNMA+NewBaskerville-Roman
to individual differences that are bundled in the	49.60609436035156	565.49853515625	9.0	185.32261657714844	103	DOPNMA+NewBaskerville-Roman
PWE construct. A high belief in the instrumental	49.60609436035156	576.498291015625	9.0	185.31991577148438	103	DOPNMA+NewBaskerville-Roman
value of work makes you immune to the sucker-	49.60609436035156	587.4981079101562	9.0	185.34690856933594	103	DOPNMA+NewBaskerville-Roman
effect. Thus, instrumental value seems to be	49.60609436035156	598.4979248046875	9.0	185.2938232421875	103	DOPNMA+NewBaskerville-Roman
a more self-focused belief in the long-range	246.94459533691406	70.49761962890625	9.0	185.34596252441406	104	DOPNMA+NewBaskerville-Roman
beneﬁts of working hard and thus less responsive	246.94459533691406	81.4974365234375	9.0	185.32981872558594	104	DOPNMA+NewBaskerville-Roman
to the social context. A strong endorsement	246.94461059570312	92.49725341796875	9.0	185.34420776367188	104	DOPNMA+NewBaskerville-Roman
of the equity principle makes one particularly	246.94461059570312	103.4970703125	9.0	185.335205078125	104	DOPNMA+NewBaskerville-Roman
vulnerable to the sucker-effect. Seemingly, the	246.94461059570312	114.49688720703125	9.0	185.33795166015625	104	DOPNMA+NewBaskerville-Roman
psychological costs of exploitation are perceived	246.94461059570312	125.4967041015625	9.0	185.33071899414062	104	DOPNMA+NewBaskerville-Roman
as high by people who believe in equity, and	246.94461059570312	136.49652099609375	9.0	185.3370361328125	104	DOPNMA+NewBaskerville-Roman
thus they avoid being the sucker. Interestingly	246.94461059570312	147.496337890625	9.0	185.33880615234375	104	DOPNMA+NewBaskerville-Roman
a strong belief in the ethical value of work also	246.94461059570312	158.49615478515625	9.0	185.34869384765625	104	DOPNMA+NewBaskerville-Roman
makes one especially vulnerable to the sucker	246.94461059570312	169.49591064453125	9.000030517578125	185.34063720703125	104	DOPNMA+NewBaskerville-Roman
effect, suggesting that the cost of compensating	246.94461059570312	180.4957275390625	9.0	185.337890625	104	DOPNMA+NewBaskerville-Roman
for another’s laziness is too costly.	246.94461059570312	191.49551391601562	9.0	135.71102905273438	104	DOPNMA+NewBaskerville-Roman
The free-rider effect does not seem to be	254.94471740722656	202.49530029296875	9.0	177.31800842285156	104	DOPNMA+NewBaskerville-Roman
affected so strongly by the PWE components.	246.94461059570312	213.49508666992188	9.0	185.34060668945312	104	DOPNMA+NewBaskerville-Roman
Although it appears that belief in the instrumental	246.94461059570312	224.494873046875	9.0	185.32888793945312	104	DOPNMA+NewBaskerville-Roman
value of work may reduce free-riding, this	246.94461059570312	235.49465942382812	9.0	185.32080078125	104	DOPNMA+NewBaskerville-Roman
evidence in our data is statistically weak. More-	246.94461059570312	246.49444580078125	9.0	185.34332275390625	104	DOPNMA+NewBaskerville-Roman
over, we obtained no evidence that the ethical	246.94461059570312	257.4942321777344	9.0	185.34149169921875	104	DOPNMA+NewBaskerville-Roman
value and equity preference moderate free-	246.94461059570312	268.4940185546875	9.0	185.34512329101562	104	DOPNMA+NewBaskerville-Roman
riding. One possible reason is that people may	246.94461059570312	279.4938049316406	9.0	185.34420776367188	104	DOPNMA+NewBaskerville-Roman
not be aware of the reduction of effort that we	246.94461059570312	290.49359130859375	9.0	185.33612060546875	104	DOPNMA+NewBaskerville-Roman
label free-riding. If they are not aware that they	246.94461059570312	301.4933776855469	9.0	185.3397216796875	104	DOPNMA+NewBaskerville-Roman
are working less hard in a collective effort, their	246.94461059570312	312.4931640625	9.0	185.3621826171875	104	DOPNMA+NewBaskerville-Roman
beliefs about the work and equity may not be	246.94461059570312	323.4929504394531	9.0	185.34060668945312	104	DOPNMA+NewBaskerville-Roman
relevant. Moreover, it is clear that motivation	246.94461059570312	334.49273681640625	9.0	185.3424072265625	104	DOPNMA+NewBaskerville-Roman
loss in a free-rider situation is less of an affective	246.94461059570312	345.4925231933594	9.0	185.3370361328125	104	DOPNMA+NewBaskerville-Roman
reaction than in a sucker effect condition. From	246.94461059570312	356.4923095703125	9.0	185.3477783203125	104	DOPNMA+NewBaskerville-Roman
a certain perspective, free-riding seems rational.	246.94461059570312	367.4920959472656	9.0	185.34060668945312	104	DOPNMA+NewBaskerville-Roman
That is, reducing effort in team situations after	246.94461059570312	378.49188232421875	9.0	185.34600830078125	104	DOPNMA+NewBaskerville-Roman
getting joint feedback that the team is doing	246.94461059570312	389.4916687011719	9.0	185.33697509765625	104	DOPNMA+NewBaskerville-Roman
well could be an adaptive approach to collective	246.94461059570312	400.491455078125	9.0	185.326171875	104	DOPNMA+NewBaskerville-Roman
endeavors. In the long run, it is functional to	246.94461059570312	411.4912414550781	9.0	185.33880615234375	104	DOPNMA+NewBaskerville-Roman
save one’s resources when they are apparently	246.94461059570312	422.49102783203125	8.999984741210938	185.34063720703125	104	DOPNMA+NewBaskerville-Roman
not needed for future endeavors when they	246.94461059570312	433.4908142089844	9.0	185.3280029296875	104	DOPNMA+NewBaskerville-Roman
may be needed. This strategy does not neces-	246.94461059570312	444.4906005859375	9.0	185.335205078125	104	DOPNMA+NewBaskerville-Roman
sarily contradict the ethical value of work.	246.94461059570312	455.49041748046875	9.0	167.92559814453125	104	DOPNMA+NewBaskerville-Roman
In conclusion, we examined individual dif-	254.94471740722656	466.490234375	9.0	177.3360137939453	104	DOPNMA+NewBaskerville-Roman
ferences in free-riding and sucker-effects in	246.94461059570312	477.4900207519531	9.0	185.335205078125	104	DOPNMA+NewBaskerville-Roman
collective work. People who believe in equity and	246.94461059570312	488.48980712890625	9.0	185.32171630859375	104	DOPNMA+NewBaskerville-Roman
the ethical value of work are particularly sensitive	246.94461059570312	499.4896240234375	9.0	185.34780883789062	104	DOPNMA+NewBaskerville-Roman
to being the sucker and, thus, reduce their own	246.94461059570312	510.48944091796875	9.0	185.37841796875	104	DOPNMA+NewBaskerville-Roman
effort rather than compensate for the laziness	246.94461059570312	521.4892578125	9.0	185.33523559570312	104	DOPNMA+NewBaskerville-Roman
of a coworker. By comparison, people who be-	246.94461059570312	532.489013671875	9.0	185.33428955078125	104	DOPNMA+NewBaskerville-Roman
lieve that work should and will be rewarded in	246.94461059570312	543.4888305664062	9.0	185.34420776367188	104	DOPNMA+NewBaskerville-Roman
the long-run do not seem to react to being the	246.94461059570312	554.4886474609375	9.0	185.34600830078125	104	DOPNMA+NewBaskerville-Roman
sucker. There is also a tendency for these people	246.94461059570312	565.4884033203125	9.0	185.34954833984375	104	DOPNMA+NewBaskerville-Roman
who believe in the instrumental value of work	246.94461059570312	576.4882202148438	9.0	185.33880615234375	104	DOPNMA+NewBaskerville-Roman
to be less likely to free-ride. One implication is	246.94461059570312	587.488037109375	9.0	185.34417724609375	104	DOPNMA+NewBaskerville-Roman
that belief in the instrumental value of work is	246.94461059570312	598.4878540039062	9.0	185.22808837890625	104	DOPNMA+NewBaskerville-Roman
51	423.9639892578125	634.5123291015625	8.0	8.32000732421875	105	DOPNMA+NewBaskerville-Roman
Group Processes & Intergroup Relations 11(1)	49.606300354003906	36.4920654296875	9.0	164.2131118774414	106	DOPNKP+NewBaskerville-Italic
a guide for one’s own behavior: ‘If I work hard,	49.606300354003906	70.50787353515625	9.0	185.3478012084961	107	DOPNMA+NewBaskerville-Roman
I will be rewarded’. In contrast, both the ethical	49.606300354003906	81.5076904296875	9.0	185.37210845947266	107	DOPNMA+NewBaskerville-Roman
component of PWE and the equity norm are	49.606300354003906	92.50750732421875	9.0	185.33971405029297	107	DOPNMA+NewBaskerville-Roman
prescriptions not only about how one should	49.606300354003906	103.50732421875	9.0	185.33879852294922	107	DOPNMA+NewBaskerville-Roman
act but also how one should react to others’	49.606300354003906	114.50714111328125	9.0	185.32706451416016	107	DOPNMA+NewBaskerville-Roman
expenditures of effort in collective work.	49.606300354003906	125.5069580078125	9.0	163.55699920654297	107	DOPNMA+NewBaskerville-Roman
Acknowledgment	49.606300354003906	151.13897705078125	11.0	84.1390151977539	108	DOPNNA+NewBaskerville-Bold
