Was unterscheidet diese drei Typen allerdings voneinander? Zum einen	157.3503875732422	198.2935791015625	9.989990234375	296.1735382080078	146	ELOMCN+TimesNewRomanPSMT
deuten sich Unterschiede bzgl. der Selbstwirksamkeit bzw. des Selbstwertge-	141.75001525878906	210.7730712890625	9.989990234375	311.8179168701172	146	ELOMCN+TimesNewRomanPSMT
fühls an. Mit Ausnahme der Einzelgänger waren diese jeweils sehr defizitär	141.75001525878906	223.2835693359375	9.989990234375	311.8258514404297	146	ELOMCN+TimesNewRomanPSMT
ausgeprägt, was nicht zuletzt auf multiple Versagenserfahrungen (im institu-	141.75001525878906	235.7940673828125	9.989990234375	311.85179138183594	146	ELOMCN+TimesNewRomanPSMT
tionellen Kontext) vor der Haft zurückzuführen ist. Sowohl die Mitglieder	141.75001525878906	248.2735595703125	9.989990234375	311.7978973388672	146	ELOMCN+TimesNewRomanPSMT
der Diebe als auch die anderer Gruppen berichteten von wiederholten Erleb-	141.75003051757812	260.7840576171875	9.989990234375	311.7667541503906	146	ELOMCN+TimesNewRomanPSMT
nissen persönlichen Scheiterns in der Schule, bei Behörden und Ämter oder	141.75003051757812	273.2945556640625	9.989990234375	311.761962890625	146	ELOMCN+TimesNewRomanPSMT
auch gegenüber der Polizei und Justiz. Während zum anderen allerdings das	141.75003051757812	285.7740478515625	9.989990234375	311.809814453125	146	ELOMCN+TimesNewRomanPSMT
Verhalten der Diebe vielfach wie eine offensive, provokative Reaktion auf	141.75003051757812	298.2845458984375	9.989990234375	311.78009033203125	146	ELOMCN+TimesNewRomanPSMT
diese Erfahrungen – projiziert auf die Institution Gefängnis – wirkt, erweckt	141.75003051757812	310.7950439453125	9.989990234375	311.8589172363281	146	ELOMCN+TimesNewRomanPSMT
das Verhalten der Angehörigen anderer Gemeinschaften gegenüber dem	141.7500457763672	323.2745361328125	9.989990234375	311.8169708251953	146	ELOMCN+TimesNewRomanPSMT
Anstaltspersonal einer eher abwartenden, zweckrationalen Eindruck.	141.7500457763672	335.7840270996094	9.989990234375	274.63002014160156	146	ELOMCN+TimesNewRomanPSMT
I9: Nach dem ganzen Mist, den ich schon in Deutschland erlebt habe,	155.93983459472656	354.2663879394531	9.990020751953125	283.41136169433594	147	ELOLOF+TimesNewRomanPS-ItalicMT
ist es ein gutes Gefühl, selbst einmal an der Macht zu sein. Hier kann	155.93983459472656	366.74688720703125	9.990020751953125	283.40528869628906	147	ELOLOF+TimesNewRomanPS-ItalicMT
ich mich wehren und meine Meinung sagen.	155.93983459472656	379.2563781738281	9.990020751953125	176.3424835205078	147	ELOLOF+TimesNewRomanPS-ItalicMT
I4: Wie gesagt hatte ich schon viele Probleme in meinem Leben. Hier	155.93983459472656	397.766845703125	9.990020751953125	283.47422790527344	148	ELOLOF+TimesNewRomanPS-ItalicMT
möchte ich meine Ruhe haben und keinen Ärger. Wenn man macht,	155.93983459472656	410.2473449707031	9.990020751953125	283.48631286621094	148	ELOLOF+TimesNewRomanPS-ItalicMT
was die Wärter sagen, ist alles in Ordnung.	155.93983459472656	422.7568359375	9.990020751953125	174.0867462158203	148	ELOLOF+TimesNewRomanPS-ItalicMT
Nur die Einzelgänger wirken gefestigter, was auf einer stabileren Persönlich-	141.7500457763672	441.29541015625	9.989990234375	311.87379455566406	149	ELOMCN+TimesNewRomanPSMT
keit oder weniger Versagenserfahrungen bzw. einer andersartigen Interpreta-	141.7500457763672	453.77490234375	9.989990234375	311.83375549316406	149	ELOMCN+TimesNewRomanPSMT
tion dieser beruhen könnte.	141.7500457763672	466.2853698730469	9.989990234375	108.92396545410156	149	ELOMCN+TimesNewRomanPSMT
I3: Die Banden der Russen wollen immer Ärger machen, die suchen	155.93983459472656	484.7677307128906	9.990020751953125	283.42832946777344	150	ELOLOF+TimesNewRomanPS-ItalicMT
den Streit, um sich gut zu fühlen. Die anderen Russen hier sind eher	155.93983459472656	497.24822998046875	9.990020751953125	283.3722381591797	150	ELOLOF+TimesNewRomanPS-ItalicMT
scheu, nicht ängstlich. Die gehen zwar Problemen mit den Wärtnern	155.93983459472656	509.7577209472656	9.990020751953125	283.4172821044922	150	ELOLOF+TimesNewRomanPS-ItalicMT
aus dem Weg, aber kämpfen mit anderen schon. Die brauchen auch	155.93983459472656	522.2681884765625	9.990020751953125	283.38331604003906	150	ELOLOF+TimesNewRomanPS-ItalicMT
Freunde. Ich kann ganz gut ohne die alle leben. Ich brauche nieman-	155.93984985351562	534.7486572265625	9.990020751953125	283.4592590332031	150	ELOLOF+TimesNewRomanPS-ItalicMT
den.	155.93984985351562	547.2591552734375	9.990020751953125	16.9410400390625	150	ELOLOF+TimesNewRomanPS-ItalicMT
In diesem Kontext fallen somit die Diebe als extremste Gruppe auf, die es am	141.75006103515625	565.7696533203125	10.01806640625	311.8118591308594	151	ELOMCN+TimesNewRomanPSMT
offenkundigsten auf die Generierung eines Images von Stärke und Härte	141.7500762939453	578.2781982421875	9.989990234375	311.8458709716797	151	ELOMCN+TimesNewRomanPSMT
während der Haftzeit anlegen. Dafür missachtet man gezielt institutionelle	141.7500762939453	590.7886962890625	9.990005493164062	311.7729034423828	151	ELOMCN+TimesNewRomanPSMT
Regeln, um sein Durchsetzungsvermögen zu demonstrieren, das man dadurch	141.75006103515625	603.2991943359375	9.990005493164062	311.81982421875	151	ELOMCN+TimesNewRomanPSMT
symbolisiert, dass Sanktionen einem nichts anhaben können.	141.75006103515625	615.7796630859375	9.990005493164062	242.72998046875	151	ELOMCN+TimesNewRomanPSMT
[Soziale Probleme]	144.60964965820312	158.46221923828125	9.510009765625	77.494140625	221	ELOLPJ+FranklinGothicLT-Book
85	442.20037841796875	158.46221923828125	9.510009765625	11.406280517578125	153	ELOLPJ+FranklinGothicLT-Book
Russlanddeutsche im Jugendstrafvollzug	141.75	175.75006103515625	8.00994873046875	141.7625732421875	223	ELOLPJ+FranklinGothicLT-Book
23. Jahrgang 2012, Heft 1	340.17529296875	175.75006103515625	8.00994873046875	93.66250610351562	193	ELOLPJ+FranklinGothicLT-Book
I9: Warum soll ich nach deren Regeln leben, wenn ich mir meine Ehre	155.93978881835938	198.2655029296875	9.989990234375	283.4322204589844	156	ELOLOF+TimesNewRomanPS-ItalicMT
erhalten kann? Wir kämpfen nicht für ein Ziel, sondern nur um uns	155.93978881835938	210.7449951171875	9.989990234375	283.3763122558594	156	ELOLOF+TimesNewRomanPS-ItalicMT
durchzusetzen. Das verstehen die nicht. Ich bin kein Krimineller, nicht	155.9397735595703	223.2554931640625	9.989990234375	283.45823669433594	156	ELOLOF+TimesNewRomanPS-ItalicMT
Mafia, aber habe nach dem Knast auch nichts zu erwarten. Was habe	155.9397735595703	235.7659912109375	9.989990234375	283.35850524902344	156	ELOLOF+TimesNewRomanPS-ItalicMT
ich zu verlieren? Aber hier drin möchte ich jemand sein. So ist das.	155.9397735595703	248.2454833984375	9.989990234375	269.45127868652344	156	ELOLOF+TimesNewRomanPS-ItalicMT
Alles in allem trugen auch solche Aussagen zu dem Gesamteindruck bei, dass	141.74998474121094	266.7840576171875	9.989990234375	311.83982849121094	157	ELOMCN+TimesNewRomanPSMT
sich diese Subkultur in den drei Gefängnissen weniger aus „Berufskriminel-	141.74998474121094	279.2945556640625	9.989990234375	311.7780303955078	157	ELOMCN+TimesNewRomanPSMT
len“ (russisch: blatnoi) zusammensetzte, die die Haftanstalten und die illega-	141.74998474121094	291.7459716796875	10.01806640625	311.8188018798828	157	ELOMCN+TimesNewRomanPSMT
len Geschäfte kontrollieren, als aus desillusionierten, trotzigen Heranwach-	141.75	304.2845458984375	9.989990234375	311.8057556152344	157	ELOMCN+TimesNewRomanPSMT
senden. Während es den Mitgliedern anderer Gruppen eher um ein zweckori-	141.75	316.7950439453125	9.989990234375	311.8406982421875	157	ELOMCN+TimesNewRomanPSMT
entiertes, positives Verhältnis zu den Beamten ging, um unnötigen Proble-	141.75	329.2745361328125	9.989990234375	311.8747863769531	157	ELOMCN+TimesNewRomanPSMT
men auszuweichen bzw. dadurch Vorteile zu erhalten, unterschieden sich die	141.75	341.7850036621094	9.989990234375	311.7918701171875	157	ELOMCN+TimesNewRomanPSMT
Diebe von diesen vor allem dadurch, dass sie sich untereinander Anerken-	141.75001525878906	354.29547119140625	9.989990234375	311.77281188964844	157	ELOMCN+TimesNewRomanPSMT
nung und Respekt für subversives Verhalten und das Aushalten von Sanktio-	141.75001525878906	366.7759704589844	9.989990234375	311.86683654785156	157	ELOMCN+TimesNewRomanPSMT
nen zusprachen.	141.75001525878906	379.28546142578125	9.989990234375	64.41252136230469	157	ELOMCN+TimesNewRomanPSMT
I4: Manche machen: „Du Hurensohn“, oder was weiß ich. Treten die	155.93980407714844	397.767822265625	9.990020751953125	283.42323303222656	158	ELOLOF+TimesNewRomanPS-ItalicMT
Türen, dass sie töten. Dann wird Beamter dich auch hassen so, wird	155.93978881835938	410.2483215332031	9.990020751953125	283.416259765625	158	ELOLOF+TimesNewRomanPS-ItalicMT
mit dir nicht vernünftig sein. Mir ist nicht zu schade, morgens raus	155.93978881835938	422.7578125	9.990020751953125	283.3613586425781	158	ELOLOF+TimesNewRomanPS-ItalicMT
und sagen: „Guten Morgen“, dann Essen holen. Dann behandeln die	155.93978881835938	435.2682800292969	9.990020751953125	283.365478515625	158	ELOLOF+TimesNewRomanPS-ItalicMT
dich auch wie Erwachsenen. Aber wenn du so mit denen Späße	155.93978881835938	447.748779296875	9.990020751953125	283.4382629394531	158	ELOLOF+TimesNewRomanPS-ItalicMT
machst, das, dies, dann werden die auch als Kind behandeln. (…)	155.93978881835938	460.2582702636719	9.990020751953125	283.3861999511719	158	ELOLOF+TimesNewRomanPS-ItalicMT
Man muss auch nicht übertrieben höflich sein, aber soll sich normal	155.93978881835938	472.76776123046875	9.990020751953125	283.45233154296875	158	ELOLOF+TimesNewRomanPS-ItalicMT
benehmen, dann kann es einem hier ganz gut gehen. Das Personal	155.93978881835938	485.2472839355469	9.990020751953125	283.36248779296875	158	ELOLOF+TimesNewRomanPS-ItalicMT
versucht uns ja auch zu erziehen. Wenn man sich anpasst, hat man	155.93978881835938	497.75775146484375	9.990020751953125	283.4073486328125	158	ELOLOF+TimesNewRomanPS-ItalicMT
keinen großen Ärger. Ich will auch nicht ein Jahr oder länger ohne	155.93978881835938	510.2682189941406	9.990020751953125	283.4222412109375	158	ELOLOF+TimesNewRomanPS-ItalicMT
Umschluss alleine in einer Zelle sitzen.	155.9397735595703	522.748779296875	9.990020751953125	156.60423278808594	158	ELOLOF+TimesNewRomanPS-ItalicMT
I2: Wir wollen mit den Wärtern nichts zu tun haben. Wir sagen, was	155.9397735595703	541.2581787109375	9.990020751953125	283.42417907714844	159	ELOLOF+TimesNewRomanPS-ItalicMT
wir denken. Die wollen uns zwar bestrafen, aber wir sind schon im	155.9397735595703	553.7686767578125	9.990020751953125	283.39830017089844	159	ELOLOF+TimesNewRomanPS-ItalicMT
Gefängnis, was sollen die tun? Wenn ich ein paar Monate mehr be-	155.9397735595703	566.2491455078125	9.990020751953125	283.41429138183594	159	ELOLOF+TimesNewRomanPS-ItalicMT
komme, macht das nichts. Die anderen sollen nicht denken, dass ich	155.9397735595703	578.7596435546875	9.990005493164062	283.46116638183594	159	ELOLOF+TimesNewRomanPS-ItalicMT
schwach bin.	155.9397735595703	591.2701416015625	9.990005493164062	52.24969482421875	159	ELOLOF+TimesNewRomanPS-ItalicMT
Das Auftreten der Befragten unterschied sich aber nicht nur bzgl. der Beam-	141.74998474121094	609.7777099609375	9.990005493164062	311.7740020751953	160	ELOMCN+TimesNewRomanPSMT
ten, sondern auch hinsichtlich der Motivation hinter Kämpfen mit anderen	141.74998474121094	622.2882080078125	9.990005493164062	311.80189514160156	160	ELOMCN+TimesNewRomanPSMT
Inhaftierten, die im Gefängnis grundsätzlich bedeutsam sind; in diesem Sinne	141.74996948242188	634.7987060546875	9.990005493164062	311.82470703125	160	ELOMCN+TimesNewRomanPSMT
86	141.75	158.46221923828125	9.510009765625	11.406280517578125	161	ELOLPJ+FranklinGothicLT-Book
23. Jahrgang 2012, Heft 1	141.75	175.75006103515625	8.00994873046875	93.60807800292969	199	ELOLPJ+FranklinGothicLT-Book
[Soziale Probleme]	373.2300109863281	158.46221923828125	9.510009765625	77.49984741210938	200	ELOLPJ+FranklinGothicLT-Book
Steffen Zdun	340.203369140625	175.75006103515625	8.00994873046875	44.964935302734375	201	ELOLPJ+FranklinGothicLT-Book
kämpften alle Befragten um Anerkennung und Respekt. Obwohl man sein	141.75	198.2935791015625	9.989990234375	311.80902099609375	165	ELOMCN+TimesNewRomanPSMT
Image bzw. seine Position im Gefängnis offensichtlich wiederholt verteidi-	141.75	210.7730712890625	9.989990234375	311.79473876953125	165	ELOMCN+TimesNewRomanPSMT
gen muss, scheint hierbei zunächst die erste Phase nach der Ankunft ent-	141.75	223.2835693359375	9.989990234375	311.76287841796875	165	ELOMCN+TimesNewRomanPSMT
scheidend zu sein, in der man seine Stärke und Verteidigungsbereitschaft zu	141.74998474121094	235.7940673828125	9.989990234375	311.8318634033203	165	ELOMCN+TimesNewRomanPSMT
demonstrieren hat.	141.74998474121094	248.2735595703125	9.989990234375	74.41250610351562	165	ELOMCN+TimesNewRomanPSMT
I4: Wenn dich jemand anmacht, hören das die anderen. Was wirst du	155.9397735595703	266.7559814453125	9.989990234375	283.4203338623047	166	ELOLOF+TimesNewRomanPS-ItalicMT
zurück machen, sagen. Wenn du nichts machst, bist du Opfer. Dann	155.9397735595703	279.2664794921875	9.989990234375	283.4001922607422	166	ELOLOF+TimesNewRomanPS-ItalicMT
macht dich jeder an. Dann schaffst du nicht, wieder zu schlagen.	155.9397735595703	291.7459716796875	9.989990234375	283.4153289794922	166	ELOLOF+TimesNewRomanPS-ItalicMT
Wenn du einen nicht geschlagen hast, schlägst du nicht anderen.	155.9397735595703	304.2564697265625	9.989990234375	283.5061798095703	166	ELOLOF+TimesNewRomanPS-ItalicMT
Dann fangen andere auch an. Wenn du dann auf einmal schlägst,	155.9397735595703	316.7669677734375	9.989990234375	283.46327209472656	166	ELOLOF+TimesNewRomanPS-ItalicMT
musst du alle schlagen. Dann besser einen schlagen sofort als alle.	155.93978881835938	329.2464599609375	9.989990234375	268.2314147949219	166	ELOLOF+TimesNewRomanPS-ItalicMT
I3: Man wird erst einmal getestet. Leute kommen und machen dich an.	155.93978881835938	347.75689697265625	9.990020751953125	283.4742736816406	167	ELOLOF+TimesNewRomanPS-ItalicMT
Dann musst du zeigen, wer du bist. Machst du das nicht, bist du der	155.93978881835938	360.2673645019531	9.990020751953125	283.41229248046875	167	ELOLOF+TimesNewRomanPS-ItalicMT
Depp, auf dem alle rumhacken. Nichts ist wichtiger als der erste Ein-	155.93978881835938	372.7468566894531	9.990020751953125	283.3662109375	167	ELOLOF+TimesNewRomanPS-ItalicMT
druck. Ich habe mir nichts gefallen lassen und seitdem eigentlich Ru-	155.93978881835938	385.25732421875	9.990020751953125	283.4443054199219	167	ELOLOF+TimesNewRomanPS-ItalicMT
he. Aber es gibt manchmal Spinner, die durchdrehen oder einen noch	155.93978881835938	397.7677917480469	9.990020751953125	283.35638427734375	167	ELOLOF+TimesNewRomanPS-ItalicMT
nicht kennen. Denen muss man dann auch zeigen, damit Ruhe ist.	155.93978881835938	410.248291015625	9.990020751953125	261.976806640625	167	ELOLOF+TimesNewRomanPS-ItalicMT
Dies sahen die meisten Befragten als übertriebene, aber notwendige Realität	141.75	428.7858581542969	9.989990234375	311.83502197265625	168	ELOMCN+TimesNewRomanPSMT
an. Während I3 als Einzelgänger diese Kämpfe aber vor allem als Strategie	141.75	441.29632568359375	9.989990234375	311.8639831542969	168	ELOMCN+TimesNewRomanPSMT
des Selbstschutzes beschrieb, nahmen die Diebe diese bzw. die Unterdrü-	141.75	453.77581787109375	9.989990234375	311.8838195800781	168	ELOMCN+TimesNewRomanPSMT
ckung der „Opfer“ insbesondere als ein Machtinstrument wahr.	141.75	466.2862854003906	9.989990234375	253.20956420898438	168	ELOMCN+TimesNewRomanPSMT
I2: Wie gesagt traut sich eigentlich sowieso keiner, uns anzugreifen.	155.93978881835938	484.7686462402344	9.990020751953125	283.4592590332031	169	ELOLOF+TimesNewRomanPS-ItalicMT
Die haben alle Angst. Wenn einer nicht macht, was wir sagen, dann	155.93978881835938	497.2491455078125	9.990020751953125	283.41217041015625	169	ELOLOF+TimesNewRomanPS-ItalicMT
kann das schon Ärger geben. (…) Wenn da einer Opfer ist, der muss	155.93978881835938	509.7586364746094	9.990020751953125	283.462158203125	169	ELOLOF+TimesNewRomanPS-ItalicMT
für uns schon so machen. Der wird eigentlich nicht geschlagen, weil	155.93978881835938	522.2681884765625	9.990020751953125	283.4223327636719	169	ELOLOF+TimesNewRomanPS-ItalicMT
er sowieso alles macht. Der hat nur Angst, dass wir schlagen. Also	155.93978881835938	534.7486572265625	9.990020751953125	283.4182434082031	169	ELOLOF+TimesNewRomanPS-ItalicMT
soll der schon putzen und aufräumen.	155.9397735595703	547.2591552734375	9.990020751953125	150.5143280029297	169	ELOLOF+TimesNewRomanPS-ItalicMT
Im Gegensatz dazu zeigt sich bei den Mitgliedern anderer Gruppen, dass	141.74998474121094	565.7976684570312	9.989990234375	311.7809295654297	170	ELOMCN+TimesNewRomanPSMT
diesen Gewaltanwendung nicht nur als Mittel des Selbstschutzes dient,9 son-	141.74998474121094	576.440673828125	11.8275146484375	311.8146514892578	170	ELOMCN+TimesNewRomanPSMT
dern offensichtlich auch zur Aufwertung des Egos, d. h. sie ziehen hieraus	141.74978637695312	590.7837524414062	9.990493774414062	311.7842102050781	170	ELOMCN+TimesNewRomanPSMT
eher im Verborgenen Anerkennung und Respekt.	141.75009155273438	603.2942504882812	9.990005493164062	196.66213989257812	170	ELOMCN+TimesNewRomanPSMT
I6: Es ist schon wichtig, dass man hier seine Stärke zeigt, um Freunde	155.93988037109375	621.7456665039062	9.990005493164062	283.40625	171	ELOLOF+TimesNewRomanPS-ItalicMT
zu machen und seine Ruhe zu haben. (…) Es geht ja nicht nur darum,	155.93988037109375	634.2561645507812	9.990005493164062	283.3803405761719	171	ELOLOF+TimesNewRomanPS-ItalicMT
[Soziale Probleme]	144.60964965820312	158.46221923828125	9.510009765625	77.494140625	190	ELOLPJ+FranklinGothicLT-Book
87	442.20037841796875	158.46221923828125	9.510009765625	11.406280517578125	173	ELOLPJ+FranklinGothicLT-Book
Russlanddeutsche im Jugendstrafvollzug	141.75	175.75006103515625	8.00994873046875	141.7625732421875	192	ELOLPJ+FranklinGothicLT-Book
23. Jahrgang 2012, Heft 1	340.17529296875	175.75006103515625	8.00994873046875	93.66250610351562	175	ELOLPJ+FranklinGothicLT-Book
sich zu behaupten. Es geht hier auch um Respekt, durch andere, aber	155.93978881835938	198.2655029296875	9.989990234375	283.3312683105469	176	ELOLOF+TimesNewRomanPS-ItalicMT
auch vor sich selbst. Man muss schon zeigen, wer man ist. Es ist ein	155.93978881835938	210.7449951171875	9.989990234375	283.430419921875	176	ELOLOF+TimesNewRomanPS-ItalicMT
gutes Gefühl, wenn man zeigen kann, dass man stärker ist. Das	155.93978881835938	223.2554931640625	9.989990234375	283.4012451171875	176	ELOLOF+TimesNewRomanPS-ItalicMT
braucht man hier drin, um zu überleben, dieses Gefühl.	155.9397735595703	235.7659912109375	9.989990234375	221.31739807128906	176	ELOLOF+TimesNewRomanPS-ItalicMT
In Anlehnung hieran ist auch ein weiterer Aspekt zu verstehen, die Bedeu-	141.74998474121094	254.2735595703125	9.989990234375	311.83888244628906	177	ELOMCN+TimesNewRomanPSMT
tung des Überlegenheitsgefühls, auf das in bisherigen Berichten bislang bloß	141.74998474121094	266.7840576171875	9.989990234375	311.79490661621094	177	ELOMCN+TimesNewRomanPSMT
bzgl. der Diebe hingewiesen wurde (Pawlik-Mierzwa/Otto 2003). Die vorlie-	141.74998474121094	279.2945556640625	9.989990234375	311.85975646972656	177	ELOMCN+TimesNewRomanPSMT
genden Daten deuten darauf hin, dass dieses für die Mitglieder beider Formen	141.74998474121094	291.7740478515625	9.989990234375	311.7947540283203	177	ELOMCN+TimesNewRomanPSMT
von Gemeinschaften relevant ist, wenn auch in unterschiedlicher Form. Wäh-	141.74998474121094	304.2845458984375	9.989990234375	311.8388214111328	177	ELOMCN+TimesNewRomanPSMT
rend die Angehörigen der anderen Gruppen dieses – auch in der Straßenkul-	141.74998474121094	316.7950439453125	9.989990234375	311.83290100097656	177	ELOMCN+TimesNewRomanPSMT
tur zentrale Einstellungsmuster (Zdun 2012) – einerseits mit weniger Nach-	141.74998474121094	329.2745361328125	9.989990234375	311.81776428222656	177	ELOMCN+TimesNewRomanPSMT
druck formulieren, kommt bei den Dieben in der totalitären Institution Ge-	141.74998474121094	341.75689697265625	10.018096923828125	311.82188415527344	177	ELOMCN+TimesNewRomanPSMT
fängnis andererseits hinzu, sich hierbei auch auf die aktuelle Situation im	141.74998474121094	354.29547119140625	9.989990234375	311.8178253173828	177	ELOMCN+TimesNewRomanPSMT
Gefängnis bzw. die Mitgefangenen zu beziehen. Dies dürfte darauf zurückzu-	141.74996948242188	366.7759704589844	9.989990234375	311.8648376464844	177	ELOMCN+TimesNewRomanPSMT
führen sein, dass man hier mehr wert als andere Gruppen auf eine vermeintli-	141.74996948242188	379.28546142578125	9.989990234375	311.8089294433594	177	ELOMCN+TimesNewRomanPSMT
che Vormachtkampfstellung legt und daher stärker in Konkurrenz mit den	141.74996948242188	391.7949523925781	9.989990234375	311.82183837890625	177	ELOMCN+TimesNewRomanPSMT
übrigen Gefangenen sieht. Dies beinhaltet sogar, dass man auffällig viel die	141.74996948242188	404.27545166015625	9.989990234375	311.8008117675781	177	ELOMCN+TimesNewRomanPSMT
eigene ethnische Überlegenheit darzustellen versucht, bspw. indem man kul-	141.74996948242188	416.7859191894531	9.989990234375	311.8200378417969	177	ELOMCN+TimesNewRomanPSMT
turelle „Besonderheiten“ hervorhebt.	141.74996948242188	429.29638671875	9.989990234375	147.43038940429688	177	ELOMCN+TimesNewRomanPSMT
I1: Wir sind die stärkste Gruppe im Gefängnis, uns greift keiner an.	155.93975830078125	447.748779296875	9.990020751953125	283.4772033691406	178	ELOLOF+TimesNewRomanPS-ItalicMT
Die haben alle Angst vor uns. Ich war noch nie in so einer starken	155.93975830078125	460.2582702636719	9.990020751953125	283.38140869140625	178	ELOLOF+TimesNewRomanPS-ItalicMT
Gruppe, auch nicht draußen. Die Türken und Skinheads sind überall	155.93975830078125	472.76776123046875	9.990020751953125	283.3643798828125	178	ELOLOF+TimesNewRomanPS-ItalicMT
feige, aber hier trauen die sich gar nichts gegen uns, auch nicht die	155.9397735595703	485.2472839355469	9.990020751953125	283.29026794433594	178	ELOLOF+TimesNewRomanPS-ItalicMT
Jugoslawen. (…) Dann ist da noch, dass wir alles teilen. Wir helfen	155.9397735595703	497.75775146484375	9.990020751953125	283.42234802246094	178	ELOLOF+TimesNewRomanPS-ItalicMT
uns. Bei uns bleibt keiner ohne Tabak. Die Deutschen müssen manch-	155.9397735595703	510.2682189941406	9.990020751953125	283.4663543701172	178	ELOLOF+TimesNewRomanPS-ItalicMT
mal alles tauschen, was sie haben. Das gibt es bei uns nicht. Das ist	155.9397735595703	522.748779296875	9.990020751953125	283.3762969970703	178	ELOLOF+TimesNewRomanPS-ItalicMT
bei uns die Kultur, bei uns bedeutet Familie und Zusammenhalt noch	155.9397735595703	535.2591552734375	9.990020751953125	283.44126892089844	178	ELOLOF+TimesNewRomanPS-ItalicMT
etwas.	155.93978881835938	547.7696533203125	9.990020751953125	25.284683227539062	178	ELOLOF+TimesNewRomanPS-ItalicMT
I6: Die Russen fühlen sich hier besonders stark. Gut, mit denen will	155.93978881835938	566.2501220703125	9.990020751953125	283.4442138671875	179	ELOLOF+TimesNewRomanPS-ItalicMT
auch keiner kämpfen, nur manchmal. Mit den anderen Gruppen ver-	155.93978881835938	578.7606811523438	9.990005493164062	283.43438720703125	179	ELOLOF+TimesNewRomanPS-ItalicMT
suchen wir halt auch auszukommen. Hier sind viele verrückte Typen,	155.93978881835938	591.2711181640625	9.990005493164062	283.3883361816406	179	ELOLOF+TimesNewRomanPS-ItalicMT
das ist nicht wie draußen, wo Türken und Nazis nur als Gruppe stark	155.93978881835938	603.7506713867188	9.990005493164062	283.4062805175781	179	ELOLOF+TimesNewRomanPS-ItalicMT
sind. Hier hilft es schon, wenn man Freunde hat, um denen aus dem	155.93978881835938	616.2611083984375	9.990005493164062	283.4932556152344	179	ELOLOF+TimesNewRomanPS-ItalicMT
Weg zu gehen.	155.93978881835938	628.7716064453125	9.990005493164062	58.03590393066406	179	ELOLOF+TimesNewRomanPS-ItalicMT
88	141.75	158.46221923828125	9.510009765625	11.406280517578125	180	ELOLPJ+FranklinGothicLT-Book
23. Jahrgang 2012, Heft 1	141.75	175.75006103515625	8.00994873046875	93.60807800292969	181	ELOLPJ+FranklinGothicLT-Book
[Soziale Probleme]	373.2300109863281	158.46221923828125	9.510009765625	77.49984741210938	182	ELOLPJ+FranklinGothicLT-Book
Steffen Zdun	340.203369140625	175.75006103515625	8.00994873046875	44.964935302734375	183	ELOLPJ+FranklinGothicLT-Book
Trotz dieser Unterschiede wird das jeweilige Bedürfnis deutlich, sich im Ver-	141.75	198.2935791015625	9.989990234375	311.7621154785156	184	ELOMCN+TimesNewRomanPSMT
gleich zu anderen als überlegen darzustellen, d. h. zu empfinden; eine Selbst-	141.75	210.7730712890625	9.99066162109375	311.83111572265625	184	ELOMCN+TimesNewRomanPSMT
bekräftigungsstrategie, um seine Selbstwirksamkeit zu stärken. Deshalb lobt	141.75027465820312	223.28424072265625	9.989990234375	311.8040771484375	184	ELOMCN+TimesNewRomanPSMT
man sich (untereinander) regelmäßig für vermeintliche Erfolge seines Han-	141.75027465820312	235.79473876953125	9.989990234375	311.7897644042969	184	ELOMCN+TimesNewRomanPSMT
delns, um diesem einen Sinn zuzusprechen. Zudem dürfte bei den Dieben die	141.75027465820312	248.24615478515625	10.01806640625	311.807861328125	184	ELOMCN+TimesNewRomanPSMT
permanente Abwertung Dritter auch den Zusammenhalt stärken. Dies gilt	141.75027465820312	260.78472900390625	9.989990234375	311.8177795410156	184	ELOMCN+TimesNewRomanPSMT
ebenso bzgl. des Anstaltspersonals, dem gegenüber man sich auch als überle-	141.75027465820312	273.29522705078125	9.989990234375	311.84588623046875	184	ELOMCN+TimesNewRomanPSMT
gen darstellt und damit das Aushalten von Sanktionen bekräftigt, nach dem	141.75027465820312	285.77471923828125	9.989990234375	311.9117431640625	184	ELOMCN+TimesNewRomanPSMT
Motto:	141.75027465820312	298.28521728515625	9.989990234375	27.217758178710938	184	ELOMCN+TimesNewRomanPSMT
